,feature_name,cultured_feature_counts,uncultured_feature_counts
2146,Site-specific recombinase XerD,2,0
2147,4-diphosphocytidyl-2C-methyl-D-erythritol kinase,0,5
2148,Molybdopterin or thiamine biosynthesis adenylyltransferase,0,1
2149,Membrane carboxypeptidase/penicillin-binding protein PbpC,1,1
2150,"Exonuclease VII, large subunit",1,0
2151,"Uncharacterized conserved protein YeaO, DUF488 family",0,1
2152,DNA endonuclease related to intein-encoded endonucleases,1,0
2153,Ferredoxin-fold anticodon binding domain,0,2
2154,Mu-like prophage host-nuclease inhibitor protein Gam,0,2
2155,"Signal transduction histidine kinase UhpB, glucose-6-phosphate specific",1,1
2156,Uncharacterized conserved protein with two CxxC motifs,1,0
2157,"Transcriptional regulator GlxA, contains an amidase domain and an AraC-type DNA-binding HTH domain",1,0
2158,"NADPH-dependent 2,4-dienoyl-CoA reductase, sulfur reductase, or a related oxidoreductase",0,2
2159,"RNA interferase (RNase) VapC, contains PIN domain",1,0
2160,Deoxyinosine 3'-endonuclease (endonuclease V),0,3
2161,"Predicted phosphodiesterase, calcineurin family",0,4
2162,Superfamily II DNA and RNA helicase,0,3
2163,"Aldehyde, CO or xanthine dehydrogenase, Mo-binding subunit",1,2
2164,Na+/phosphate symporter,1,0
2165,23S rRNA A2030 N6-methylase RlmJ,1,1
2166,DNA-binding nucleoid-associated protein YbaB/EfbC,2,0
2167,VanZ-like family protein (function unknown),1,1
2168,"CRISPR/Cas system-associated exonuclease Cas4, RecB family",0,1
2169,DNA-binding response regulator DpiB of citrate/malate metabolism,0,1
2170,"Nucleotide-binding universal stress protein,  UspA family",1,2
2171,Phosphoribosyl-ATP pyrophosphohydrolase,1,1
2172,Phosphoenolpyruvate carboxylase,1,0
2173,"Transcriptional regulator, middle operon regulator (Mor) family",2,0
2174,"PepSY domain containing protein, regulator of zincin peptidase activity",2,2
2175,"Uncharacterized conserved protein YoaH, UPF0181 family",2,0
2176,Arginine exporter protein ArgO,1,0
2177,"Uncharacterized conserved protein YdcH, DUF465 family",3,0
2178,Predicted SAM-depedendent methyltransferase,1,0
2179,"Outer membrane protein assembly factor BamE, lipoprotein component of the BamABCDE complex",2,0
2180,"c-di-GMP phosphodiesterase YuxH/PdeH, contains EAL and HDOD domains",2,1
2181,"Transcriptional regulatory protein LevR, contains PRD, AAA+ and EIIA domains",0,1
2182,vWFA (von Willebrand factor type A) domain of Mg and Co chelatases,0,2
2183,Pectate lyase,1,0
2184,"Uncharacterized Zn-finger containing protein, UPF0148 family",2,0
2185,"Possible nuclease of RNase H fold, RuvC/YqgF family",1,0
2186,"Uncharacterized membrane protein YobD, UPF0266 family",1,0
2187,CO dehydrogenase/acetyl-CoA synthase delta subunit (corrinoid Fe-S protein),2,1
2188,"ABC-type antimicrobial peptide transport system, permease component",0,2
2189,"DNA uptake channel protein ComEC C-terminal domain, metallo-beta-lactamase superfamily",0,1
2190,"Abortive phage infection protein AbiEi, antitoxin conponent of an AbiEi-AbiEii TA system",1,0
2191,Mannitol-1-phosphate/altronate dehydrogenases,0,4
2192,Archaeal flavoprotein,0,1
2193,"tRNA U38,U39,U40 pseudouridine synthase TruA",0,2
2194,"TPP-dependent indolepyruvate ferredoxin oxidoreductase, alpha subunit",0,4
2195,"Uncharacterized copper-binding protein, cupredoxin-like subfamily",0,1
2196,Epoxyqueuosine reductase QueG (queuosine biosynthesis),1,1
2197,"Sialic acid synthase SpsE, contains C-terminal SAF domain",0,1
2198,"Uncharacterized conserved protein YgiM, contains N-terminal SH3 domain, DUF1202 family",1,0
2199,"Ethanolamine utilization protein EutS, microcompartment shell protein",1,0
2200,"Membrane-associated protease RseP, regulator of RpoE activity",0,4
2201,"Aldo/keto reductase, related to diketogulonate reductase",0,1
2202,"Uncharacterized membrane protein YsdA, DUF1294 family",0,1
2203,"Membrane-anchored protein YidD, putatitve component of membrane protein insertase Oxa1/YidC/SpoIIIJ",2,2
2204,Sugar phosphate isomerase/epimerase,0,0
2205,"Uncharacterized Zn-binding protein, DUF971 domain",1,0
2206,Cytochrome b subunit of formate dehydrogenase,1,0
2207,Carboxysome shell and ethanolamine utilization microcompartment protein CcmL/EutN,1,1
2208,Ribosomal protein S15P/S13E,0,1
2209,"Signal transducer regulating beta-lactamase production, contains metallopeptidase domain",0,1
2210,DNA-binding SWIB/MDM2 domain,1,1
2211,Preprotein translocase subunit Sec63,0,5
2212,DICT sensory domain found in diguanylate cyclases and two-component systems,2,1
2213,Uncharacterized conserved protein MJ0501,0,1
2214,Phenolic acid decarboxylase,0,1
2215,L-rhamnose isomerase,1,1
2216,"Predicted ATPase/kinase of ASKHA (acetate and sugar kinases, HSC70, actin) superfamily",0,0
2217,"Predicted small methyltransferase MTH1000, UPF0146 family",4,0
2218,N-terminal domain of uncharacterized protein YciW (function unknown),0,3
2219,NADH/NAD ratio-sensing transcriptional regulator Rex,0,1
2220,"Pyrimidine/purine nucleoside phosphorylase YaiE/PpnP, UPF0345/DUF1255 family",0,1
2221,Isopentenyl phosphate kinase,0,3
2222,"TRAP-type mannitol/chloroaromatic compound transport system, periplasmic component",1,2
2223,Ribosomal protein L31,0,1
2224,K+-sensing histidine kinase KdpD,2,1
2225,"Peptidoglycan-binding domain, expansin YoaJ",0,1
2226,"Uncharacterized conserved protein YycO, NlpC/P60 family",1,0
2227,"Predicted Zn-dependent peptidase, M16 family",1,0
2228,Ribosome maturation factor RimP,2,1
2229,Mu-like prophage protein gp29,0,1
2230,"Uncharacterized conserved protein YrrD, contains PRC-barrel domain",0,0
2231,Methionyl-tRNA formyltransferase,0,2
2232,"Predicted RNA- or ssDNA-binding protein, translin family",1,0
2233,Acetylornithine deacetylase/Succinyl-diaminopimelate desuccinylase or related deacylase,0,1
2234,"Uncharacterized membrane protein YvlD, DUF360 family",2,3
2235,"ABC-type iron transporter FetAB, ATPase component",2,2
2236,"Ornithine cyclodeaminase/archaeal alanine dehydrogenase, mu-crystallin family",0,1
2237,"Uncharacterized conserved protein, DUF2209 domain",2,1
2238,"Glycine cleavage system protein P (pyridoxal-binding), N-terminal domain",0,2
2239,"P pilus assembly protein, chaperone PapD",3,0
2240,Acetyl esterase/lipase,0,1
2241,"Periplasmic nitrate reductase system, NapE component",0,2
2242,Negative regulator of replication initiation SeqA,0,2
2243,Antitoxin component YwqK of the YwqJK toxin-antitoxin module,2,0
2244,Exopolysaccharide export protein/domain GumC/Wzc1,0,2
2245,"20S proteasome, alpha and beta subunits",0,3
2246,"Uncharacterized conserved protein containing a Zn-ribbon-like motif, possibly RNA-binding",0,1
2247,Uncharacterized conserved protein Alr0986,1,0
2248,"Uncharacterized conserved protein, DUF2281 domain",1,1
2249,Ubiquinone biosynthesis accessory factor UbiK,2,0
2250,"Iron-guanylylpyridinol (FeGP) cofactor biosynthesis protein, fibrillarin family",1,1
2251,Transposase InsA,1,0
2252,"TRAP-type mannitol/chloroaromatic compound transport system, small permease component",1,1
2253,Alpha-tubulin suppressor ATS1 and related RCC1 domain-containing proteins,1,1
2254,"ABC-type phosphate/phosphonate transport system, periplasmic component",1,1
2255,Glyceraldehyde-3-phosphate dehydrogenase/erythrose-4-phosphate dehydrogenase,0,1
2256,Predicted Ser/Thr protein kinase,1,0
2257,Uncharacterized conserved protein YtzB,1,0
2258,"Signal transduction histidine kinase NtrB, nitrogen specific",0,1
2259,Poly-beta-hydroxybutyrate synthase,2,0
2260,"Predicted ATPase, PP-loop superfamily",2,0
2261,"Uncharacterized metal-binding protein, DUF2227 family",2,1
2262,"DNA gyrase/topoisomerase IV, subunit A",0,1
2263,Acyl-CoA thioesterase FadM,1,2
2264,"Predicted membrane glycosyltransferase TK1552, contains 6-pyruvoyl-tetrahydropterin synthase (PTPS)-related domain",1,1
2265,"Uncharacterized conserved protein, DUF2237 family",2,2
2266,Predicted SnoaL-like aldol condensation-catalyzing enzyme,1,0
2267,"Uncharacterized conserved protein, UPF0280 family, ApbE superfamily",0,4
2268,tRNA-Met C34-N4-acetylcytidine synthase TmcAL,2,0
2269,"Glycerol dehydrogenase or related enzyme, iron-containing ADH family",2,1
2270,Preprotein translocase subunit SecE,1,2
2271,"Uncharacterized conserved protein, contains DUF2059 domain",1,1
2272,Acetyl-CoA acetyltransferase,1,1
2273,Predicted phosphoribosyltransferase,2,2
2274,"5S rRNA maturation ribonuclease M5, contains TOPRIM domain",1,4
2275,"Uncharacterized protein, contains DUF1214 domain",0,2
2276,High-affinity Fe2+/Pb2+ permease,0,2
2277,"Uncharacterized protein domain, C-terminal to COG1479 DNAse/DNA nickase",1,0
2278,"Uncharacterized conserved protein, contains CHAT domain",2,1
2279,WD40 repeat,1,0
2280,N-acetylmuramic acid 6-phosphate (MurNAc-6-P) etherase,1,1
2281,Holliday junction resolvasome RuvABC endonuclease subunit RuvC,0,1
2282,Uncharacterized spore protein YtfJ,1,1
2283,Ribosomal protein L7/L12,2,0
2284,tRNA1(Val) A37 N6-methylase TrmN6,0,1
2285,"Uncharacterized conserved protein YcfJ, contains glycine zipper 2TM domain",1,2
2286,"Uncharacterized membrane protein, UPF0136 family",0,1
2287,Phosphopantetheinyl transferase,0,1
2288,Glutamyl- or glutaminyl-tRNA synthetase,2,4
2289,CTP synthase (UTP-ammonia lyase),1,0
2290,Trp operon repressor,4,1
2291,"Predicted transcriptional regulator, contains ribbon-helix-helix (RHH_1) domain",0,1
2292,3-keto-L-gulonate-6-phosphate decarboxylase,1,3
2293,Mevalonate pyrophosphate decarboxylase,1,0
2294,"CRISPR-Cas system type III CMR-effector complex subunit Cmr1, RAMP superfamily Cas7 group",0,1
2295,Phytoene/squalene synthetase,0,1
2296,GTPase involved in cell partioning and DNA repair,2,0
2297,"VapC family ribonuclease, toxin component of the VapBC toxin-antitoxin module, contains PIN domain",2,2
2298,Chloramphenicol 3-O-phosphotransferase,1,0
2299,"Uncharacterized conserved protein AF1278, contains saccharopine dehydrogenase N-terminal (SDHN) domain",1,0
2300,"Uncharacterized conserved protein, DUF2000 domain",0,1
2301,Valyl-tRNA synthetase,1,2
2302,"Uncharacterized protein, contains SRPBCC domain",0,0
2303,"Predicted ribonuclease, toxin component of the YeeF-YezG toxin-antitoxin module",0,1
2304,Urea transporter,0,1
2305,Uncharacterized conserved protein YwgA,0,1
2306,"Hydrogenase maturation factor HybG, HypC/HupF family",1,1
2307,Predicted heme/steroid binding protein,0,0
2308,Formate hydrogenlyase subunit 6/NADH:ubiquinone oxidoreductase 23 kD subunit (chain I),3,1
2309,"Uncharacterized conserved protein YeaC, DUF1315 family",1,2
2310,Panthothenate synthetase,0,3
2311,"Outer membrane lipoprotein LpoA, binds and activates PBP1a",0,2
2312,"Aspartate carbamoyltransferase, catalytic subunit",0,1
2313,Flavoprotein (flavin reductase) subunit CysJ of sulfite and N-hydroxylaminopurine reductases,1,1
2314,Molybdopterin-guanine dinucleotide biosynthesis protein A,0,1
2315,Murein endopeptidase MepA (D-alanyl-D-alanine-endopeptidase),0,1
2316,L-asparagine transporter or related permease,1,0
2317,"Uncharacterized conserved protein YchJ, contains N- and C-terminal SEC-C domains",0,1
2318,Na+(or H+)/acetate symporter ActP,1,0
2319,"Predicted glycosyl hydrolase, GH43/DUF377 family",2,2
2320,"Heme/copper-type cytochrome/quinol oxidase, subunit 1",0,1
2321,"Uncharacterized conserved protein YecT, DUF1311 family",0,2
2322,Glycine cleavage system regulator GcvR,1,1
2323,Predicted secreted protein,1,0
2324,Ribosomal protein L37E,1,3
2325,Glycerol uptake facilitator or related aquaporin (Major Intrinsic protein Family),0,1
2326,"CRISPR-Cas system type III CMR-effector complex subunit Cmr4, RAMP superfamily Cas7 group",1,0
2327,"Lipopolysaccharide biosynthesis protein, LPS:glycosyltransferase",1,2
2328,Cobalamin biosynthesis protein CobD/CbiB,0,2
2329,Scaffold subunit RecC of the DNA repair enzyme RecBCD (exonuclease V),0,1
2330,"Folate-binding protein YgfZ, synthesis and repair of Fe-S clusters",3,1
2331,"DNA-binding response regulator, LytR/AlgR family",1,1
2332,"Flp pilus assembly protein, secretin CpaC",0,1
2333,Tetraacyldisaccharide-1-P 4'-kinase (Lipid A 4'-kinase),0,3
2334,Type IV pilus assembly protein FimT,0,1
2335,Phosphoribosylamine-glycine ligase,1,2
2336,Ribosomal protein S8E,0,5
2337,"DNA-binding transcriptional regulator GbsR, MarR family",0,2
2338,Uncaracterized surface protein containing fasciclin (FAS1) repeats,1,0
2339,"ABC-type sugar transport system, ATPase component",3,1
2340,Dihydrolipoamide dehydrogenase (E3) component of pyruvate/2-oxoglutarate dehydrogenase complex or glutathione oxidoreductase,2,0
2341,"ECF-type riboflavin transporter, membrane (S) component",1,1
2342,Type VI protein secretion system component VasA,0,4
2343,4-hydroxyphenylpyruvate dioxygenase and related hemolysins,2,0
2344,"GTPase Era, involved in 16S rRNA processing",0,1
2345,"rRNA maturation protein Nop10, contains Zn-ribbon domain",2,2
2346,"2-polyprenyl-3-methyl-5-hydroxy-6-metoxy-1,4-benzoquinol methylase",1,0
2347,Ribosomal protein S13,1,0
2348,Arginyl-tRNA synthetase,3,2
2349,Homocysteine/selenocysteine methylase (S-methylmethionine-dependent),1,0
2350,"Uncharacterized conserved protein YneF, UPF0154 family",0,0
2351,"Predicted transglycosylase, contains SLT domain",2,0
2352,Fe-S-cluster formation regulator IscX/YfhJ,0,1
2353,Alanine dehydrogenase (includes sporulation protein SpoVN),0,2
2354,"Competence protein CoiA, contains predicted nuclease domain",0,3
2355,"Trk/Ktr K+ transport system regulatory component TrkA/KtrA/KtrC, RCK domain",0,1
2356,"Predicted acylesterase/phospholipase RssA, containd patatin domain",1,1
2357,"Peptide antibiotic transporter SbmA/BacA, ABC-type permease family",1,0
2358,"ABC-type antimicrobial peptide export system, permease component SapB",0,1
2359,"Uncharacterized membrane protein YbaN, DUF454 family",1,1
2360,"L-lactate utilization protein LutC, contains LUD domain",2,0
2361,"Predicted 5' DNA nuclease, flap endonuclease-1-like, helix-3-turn-helix (H3TH) domain",1,0
2362,Selenocysteine-specific translation elongation factor SelB,1,2
2363,Recombination-promoting DNA endonuclease RpnC/YadD,1,0
2364,"DNA-binding transcriptional regulator, PucR/PutR family",0,1
2365,Glutamate synthase domain 1,1,0
2366,Cobalamin synthase CobS (adenosylcobinamide-GDP ribazoletransferase),1,0
2367,"Aminopropyltransferase BpsA, N(4)-bis(aminopropyl)spermidine biosynthesis",2,0
2368,Ribosomal protein L28,1,1
2369,"Putative sterol carrier protein, contains SCP2 domain",0,1
2370,"Uncharacterized conserved protein, Alpha-E superfamily",1,1
2371,Fe-S-cluster-containing hydrogenase component 2,0,1
2372,Uncharacterized membrane protein YesL,0,4
2373,"Uncharacterized conserved protein, DUF1684 family",1,2
2374,Phosphate uptake regulator PhoU,1,0
2375,"Uncharacterized conserved protein YibQ, putative polysaccharide deacetylase 2 family",1,0
2376,FKBP-type peptidyl-prolyl cis-trans isomerase (trigger factor),1,0
2377,Argininosuccinate synthase,0,0
2378,"Outer membrane protein assembly factor BamD, BamD/ComL family",1,0
2379,Outer membrane receptor for ferrienterochelin and colicins,2,0
2380,"Predicted nucleic-acid-binding protein, contains Zn-ribbon domain",1,1
2381,ESX protein secretion system component YukC,0,1
2382,Selenophosphate synthetase-related protein,1,0
2383,"Uncharacterized conserved protein YutD, DUF1027 family",0,1
2384,"Prophage-encoded protein YbcV, DUF1398 family",0,2
2385,"DNA-directed RNA polymerase specialized sigma subunit, sigma24 family",4,0
2386,"Xanthine/guanine/uracil/vitamin C permease GhxP/GhxQ, nucleobase:cation symporter 2 ( NCS2) family",0,1
2387,"Predicted dehydrogenase related to H2-forming N5,N10-methylenetetrahydromethanopterin dehydrogenase",1,0
2388,"Acetone carboxylase, gamma subunit",1,0
2389,Siroheme synthase (precorrin-2 oxidase/ferrochelatase domain),1,1
2390,Carbamoyl dehydratase HypE (hydrogenase maturation factor),1,0
2391,"Uncharacterized membrane protein AF1626, predicted component of bacteriocin or quorum sensing system, DUF2178 family",3,1
2392,"ABC-type branched-chain amino acid transport system, periplasmic component",1,0
2393,Peptidase E,1,2
2394,"Redox-sensitive bicupin YhaK, pirin superfamily",2,0
2395,Nitric oxide reductase large subunit,0,2
2396,"Ribosomal protein L16 Arg81 hydroxylase, contains JmjC domain",0,2
2397,AraC-type DNA-binding domain and AraC-containing proteins,1,1
2398,Flp pilus assembly protein TadB,3,1
2399,"GMP synthase, glutamine amidotransferase domain",1,0
2400,"Lipid carrier protein ElyC involved in cell wall biogenesis, DUF218 family",0,1
2401,"DNA-binding transcriptional response regulator, NtrC family, contains REC, AAA-type ATPase, and a Fis-type DNA-binding domains",2,0
2402,Molecular chaperone DnaK (HSP70),1,2
2403,Transposase (or an inactivated derivative),2,0
2404,"Fe-S cluster-containing oxidoreductase, includes glycolate oxidase subunit GlcF",1,0
2405,Erythromycin esterase homolog,1,0
2406,Ferredoxin,1,0
2407,"Type IV pilus assembly protein, tip-associated adhesin PilY1",1,0
2408,"ABC-type spermidine/putrescine transport system, permease component II",0,2
2409,"Multimeric flavodoxin WrbA, includes NAD(P)H:quinone oxidoreductase",1,0
2410,"tRNA(Ser,Leu) C12 N-acetylase TAN1, contains THUMP domain",1,1
2411,Type IV pilus assembly protein FimV,0,1
2412,"Two-component response regulator, PleD family, consists of two REC domains and a diguanylate cyclase (GGDEF) domain",0,0
2413,ATP-dependent helicase/DNAse subunit B,1,0
2414,"Mg2+ and Co2+ transporter CorC, contains CBS pair and CorC-HlyC domains",1,1
2415,"Coenzyme F420-reducing hydrogenase, beta subunit",1,0
2416,"Saccharopine dehydrogenase, NADP-dependent",1,1
2417,Fic family protein,0,0
2418,Adenosyl cobinamide kinase/adenosyl cobinamide phosphate guanylyltransferase,1,0
2419,"Trk-type K+ transport system, membrane component",2,0
2420,Formate dehydrogenase maturation protein FdhE,1,0
2421,Ribosomal protein S4 or related protein,2,1
2422,Uncharacterized conserved protein involved in sex pheromone biosynthesis,4,0
2423,"Uncharacterized conserved protein, DUF2117 domain",3,1
2424,"Putative GTP cyclohydrolase 1 type 2, NIF3 family",0,1
2425,"Heme/copper-type cytochrome/quinol oxidase, subunit 4",2,0
2426,Maltose-binding periplasmic protein MalE,0,1
2427,"Tagatose-1,6-bisphosphate aldolase non-catalytic subunit AgaZ/GatZ",0,1
2428,ParA-like ATPase involved in chromosome/plasmid partitioning or cellulose biosynthesis protein BcsQ,0,1
2429,"Redox-regulated molecular chaperone, HSP33 family",1,0
2430,D-lyxose ketol-isomerase,0,1
2431,Predicted metalloprotease,0,1
2432,Stage III sporulation protein SpoIIIAA,0,0
2433,Predicted small metal-binding protein,1,0
2434,"Uncharacterized conserved protein YbjN, helps stabilize unstable proteins",1,0
2435,Antibiotic biosynthesis monooxygenase (ABM) superfamily enzyme,0,2
2436,Protease II,0,2
2437,"Predicted ABC-type sugar transport system, permease component",0,0
2438,Methionyl-tRNA synthetase,0,0
2439,"Uncharacterized periplasmic protein SanA, affects membrane permeability for vancomycin",1,2
2440,"ssDNA-specific exonuclease RecJ, DHH superfamily, may be involved in archaeal DNA replication intiation",1,4
2441,Folate-dependent tRNA-U54 methylase TrmFO/GidA,2,1
2442,"Regulator of PEP synthase PpsR, kinase-PPPase family (combines ADP:protein kinase and phosphorylase activities)",1,0
2443,Uncharacterized conserved protein MJ0452,0,2
2444,Asp/Glu/hydantoin racemase,0,2
2445,"Uncharacterized Tic20-related protein, DUF4870 domain",0,1
2446,"Uncharacterized conserved protein, DUF2096 domain",1,1
2447,Phosphotransferase system sorbitol-specific IIA component,2,0
2448,Tetrahydrodipicolinate N-succinyltransferase,1,1
2449,Cephalosporin hydroxylase,1,1
2450,"Ethanolamine transporter EutH, required for ethanolamine utilization at low pH",1,0
2451,Ribosomal protein S1,3,1
2452,Threonine/homoserine/homoserine lactone efflux protein,1,2
2453,Lipid A disaccharide synthetase,2,1
2454,Uncharacterized Fe-S cluster protein YjdI,3,1
2455,"Uncharacterized conserved protein, DUF2161 domain",0,1
2456,Alanine-alpha-ketoisovalerate (or valine-pyruvate) aminotransferase,2,2
2457,"Fido, protein-threonine AMPylation domain",1,0
2458,Acid phosphatase family membrane protein YuiD,3,1
2459,"Cell division septum initiation protein DivIVA, interacts with FtsZ and MinD",0,2
2460,HPr or related phosphotransfer protein,1,1
2461,Imidazole glycerol phosphate synthase subunit HisF,0,1
2462,Predicted CoA-binding protein,2,1
2463,"Iron only hydrogenase large subunit, C-terminal domain",0,0
2464,"DNA polymerase I, 3'-5' exonuclease and polymerase domains",0,1
2465,"Uncharacterized conserved protein YeaH/YhbH, required for sporulation, DUF444 family",1,1
2466,Predicted extracellular nuclease,1,0
2467,Cell division ATPase FtsE,2,2
2468,"Predicted sugar hydrolase, contains GT1 and HAD domains",3,0
2469,"Succinate dehydrogenase/fumarate reductase, cytochrome b subunit",1,0
2470,"Multisubunit Na+/H+ antiporter, MnhC subunit",0,1
2471,"Isoaspartyl peptidase or L-asparaginase, Ntn-hydrolase superfamily",0,1
2472,Stalled ribosome alternative rescue factor ArfA,3,1
2473,Short-chain dehydrogenase involved in D-alanine esterification of teichoic acids,0,1
2474,"LPS O-antigen chain length determinant protein, WzzB/FepE family",0,1
2475,ERCC4-related helicase,1,1
2476,dsDNA-specific endonuclease/ATPase MutS2,2,0
2477,"Periplasmic chaperone for outer membrane proteins, Skp family",1,0
2478,Extracellular substrate-binding protein,0,2
2479,Formylmethanofuran dehydrogenase subunit E,0,3
2480,"ABC-type proline/glycine betaine transport system, permease component",0,0
2481,Uncharacterized conserved protein with an alpha/beta hydrolase fold,2,1
2482,Ribosomal protein S4E,1,1
2483,"MbtH family protein, regulates adenylation domains of NRPSs",0,2
2484,Membrane protein insertase Oxa1/YidC/SpoIIIJ,0,1
2485,Isopenicillin N synthase and related dioxygenases,0,1
2486,Membrane protein implicated in regulation of membrane protease activity,0,1
2487,"Predicted carbohydrate-binding protein, contains CBM5 and CBM33 domains",0,1
2488,2-C-methyl-D-erythritol 4-phosphate cytidylyltransferase,1,0
2489,"Ethanolamine utilization protein EutP, contains a P-loop NTPase domain",2,0
2490,"Bacillithiol/mycothiol S-transferase BstA/DinB, DinB/YfiT family (unrelated to E. coli DinB)",0,3
2491,"Ni,Fe-hydrogenase I small subunit",1,0
2492,"Uncharacterized membrane protein YtjA, UPF0391 family",2,1
2493,"ABC-type molybdate transport system, ATPase component ModC",1,1
2494,Uncharacterized integral membrane protein YrvD,0,2
2495,FAD-dependent dehydrogenase,1,0
2496,"Carbonic anhydrase or acetyltransferase, isoleucine patch superfamily",3,2
2497,"Anion-transporting ATPase, ArsA/GET3 family",0,1
2498,"Uncharacterized conserved protein, contains SIS (Sugar ISomerase) phosphosugar binding domain",1,1
2499,Flagellar basal body L-ring protein FlgH,0,1
2500,"Xanthine dehydrogenase, molybdopterin-binding subunit XdhB",2,0
2501,Fructosamine-3-kinase,1,2
2502,Citrate lyase beta subunit,0,1
2503,Mu-like prophage tail sheath protein gpL,2,1
2504,"Two-component response regulator, AmiR/NasT family, consists of REC and RNA-binding antiterminator (ANTAR) domains",1,1
2505,"Uncharacterized conserved protein YjcR, contains N-terminal HTH domain",1,0
2506,"ASCH domain, putative RNA-binding protein, DUF365 family",1,0
2507,Outer membrane protein OmpW,0,1
2508,Predicted membrane GTPase TypA/BipA involved in stress response,0,1
2509,"Outer membrane lipoprotein LolB, involved in outer membrane biogenesis",2,1
2510,"Predicted carbamoyl transferase, NodU family",1,0
2511,Dolichol kinase,1,2
2512,NADPH:quinone reductase or related Zn-dependent oxidoreductase,2,1
2513,"Uncharacterized conserved protein YigE, DUF2233 family",0,1
2514,"Nucleoside diphosphatase, GDA1/CD39 family",1,0
2515,"Uncharacterized conserved protein YcgL, UPF0745 family",0,1
2516,Zn-dependent alcohol/formaldehyde dehydrogenase,0,1
2517,"Fermentation-respiration switch esterase FrsA, DUF1100 family",1,1
2518,"Uncharacterized membrane protein, contains DUF996 domain",0,2
2519,"Uncharacterized beta-barrel protein YwiB, DUF1934 family",1,0
2520,Signal recognition particle GTPase,2,0
2521,Glutamate synthase domain 3,0,1
2522,"Archaea-specific RecJ-like exonuclease, contains DnaJ-type Zn finger domain",1,1
2523,Predicted branched-chain amino acid permease (azaleucine resistance),0,1
2524,"Glucoamylase (glucan-1,4-alpha-glucosidase), GH15 family",1,0
2525,"Cell division protein ZapB, interacts with FtsZ",1,1
2526,Pantothenate kinase,1,0
2527,Periplasmic component TolB of the Tol biopolymer transport system,0,1
2528,Ribonuclease HI,1,1
2529,"Pyruvate:ferredoxin oxidoreductase or related 2-oxoacid:ferredoxin oxidoreductase, gamma subunit",1,0
2530,"Uncharacterized membrane protein YecN, MAPEG domain",0,1
2531,"Translation elongation factor EF-4, membrane-bound GTPase",1,1
2532,4-hydroxybenzoate synthetase (chorismate-pyruvate lyase),4,0
2533,"N-acetylglucosaminyl deacetylase, LmbE family",0,1
2534,Uncharacterized conserved protein involved in copper resistance,1,0
2535,Leu/Phe-tRNA-protein transferase,0,3
2536,Predicted lipase,1,1
2537,Ubiquinone/menaquinone biosynthesis C-methylase UbiE/MenG,1,3
2538,"Uncharacterized protein, contains short C-terminal (SHOCT) domain",3,0
2539,Tetratricopeptide (TPR) repeat,1,1
2540,"Mitochondrial translation protein, Rmd1/RMND1/DUF155 family",1,0
2541,"Exosome subunit, RNA binding protein with dsRBD fold",0,1
2542,"Lipopolysaccharide assembly protein YciS/LapA, DUF1049 family",0,2
2543,ppGpp synthetase catalytic domain (RelA/SpoT-type nucleotidyltranferase),0,1
2544,H+/Cl- antiporter ClcA,2,1
2545,Energy-converting hydrogenase Eha subunit H,1,0
2546,"ABC-type glucose/galactose transport system, permease component",3,0
2547,Biotin carboxyl carrier protein,1,0
2548,LPS sulfotransferase NodH,1,1
2549,"DNA-binding TFAR19-related protein, PDSD5 family",0,1
2550,4-hydroxy-tetrahydrodipicolinate synthase/N-acetylneuraminate lyase,3,0
2551,Chloramphenicol O-acetyltransferase,0,0
