,feature_name,cultured_feature_counts,uncultured_feature_counts
1718,"ABC-type phosphate transport system, permease component",1,1
1719,"Glycyl-tRNA synthetase, alpha subunit",0,2
1720,"CRISPR/Cas system CMR subunit Cmr6, Cas7 group, RAMP superfamily",1,0
1721,"Cadmium resistance protein CadD, predicted permease",1,0
1722,"Mannose-6-phosphate isomerase, cupin superfamily",2,0
1723,"Archaeosine tRNA-ribosyltransferase, contains uracil-DNA-glycosylase and PUA domains",1,1
1724,"ABC-type enterochelin transport system, periplasmic component",0,0
1725,"3D (Asp-Asp-Asp) domain, usually in lytic transglycosylases",0,1
1726,"Uncharacterized membrane protein, DUF2061 family",1,0
1727,"Predicted DNA-binding protein with PD1-like DNA-binding motif, PPC/DUF296 domain",0,2
1728,Elongation factor P Arg32-rhamnosyltransferase EarP,1,0
1729,"Uncharacterized conserved protein YgiB, UPF0441/DUF1190 family, involved in bioifilm formation",0,1
1730,"Transcription antitermination factor NusA, contains S1 and KH domains",0,2
1731,Phage regulatory protein Rha,0,0
1732,GTP cyclohydrolase FolE2,1,2
1733,ATP/ADP translocase,0,1
1734,rRNA-processing protein FCF1,1,1
1735,"Uncharacterized conserved protein, contains TOPRIM domain, potential nuclease",1,0
1736,Site-specific recombinase XerC,1,0
1737,Sortase (surface protein transpeptidase),0,1
1738,"NADPH-dependent 7-cyano-7-deazaguanine reductase QueF, N-terminal domain",0,1
1739,Outer membrane protease,1,0
1740,DNA-binding transcriptional regulator ModE (molybdenum-dependent),0,1
1741,"Sugar transporter, SemiSWEET family, contains PQ motif",1,0
1742,Uridine phosphorylase,0,4
1743,"Phosphatidylglycerol kinase, diacylglycerol kinase family",1,2
1744,"Predicted antitoxin, contains HTH domain",1,0
1745,Ribosomal protein S12,0,1
1746,"Predicted transcriptional regulator, lambda repressor-like DNA-binding domain",0,1
1747,Biotin transporter BioY,1,2
1748,Unannotated,0,1
1749,Selenophosphate synthase,3,2
1750,"Putative antitoxin component PasI (RatB) of the RatAB toxin-antitoxin module, ubiquitin-RnfH superfamily",0,2
1751,"tRNA threonylcarbamoyladenosine modification (KEOPS) complex,  Pcc1 subunit",0,0
1752,Small periplasmic lipoprotein YifL (function unknown),0,1
1753,Ornithine carbamoyltransferase,2,0
1754,Cobalamin biosynthesis protein CbiD (cobalt-precorrin-5B C-methyltransferase),0,1
1755,tRNA A58 N-methylase Trm61,0,3
1756,Tellurite resistance protein TerB,1,0
1757,RNA-binding protein YhbY,2,2
1758,PPE-repeat protein,1,0
1759,"Uncharacterized conserved protein YjfI, DUF2170 family",3,1
1760,Na+/proline symporter,0,1
1761,Ribosomal protein L29,3,1
1762,"Uncharacterized conserved protein, DUF1800 family",1,3
1763,Capsular polysaccharide biosynthesis protein YveK,2,1
1764,SAM-dependent methyltransferase,0,1
1765,Bifunctional DNA-binding transcriptional regulator of stationary/sporulation/toxin gene expression and antitoxin component of the YhaV-PrlF toxin-antitoxin module,0,1
1766,Flagellar basal body rod protein FlgF,1,1
1767,16S rRNA G1207 methylase RsmC,2,1
1768,Intermembrane transporter PqiABC subunit PqiA,1,2
1769,Argininosuccinate lyase,0,1
1770,"Uncharacterized conserved protein MTH423, predicted component of type IV pili-like system, DUF2101 family",0,1
1771,"Type IV secretory pathway, VirB4 component",0,2
1772,"Spore dipicolinate transporter SpoVV/YjiH/YlbJ, contains nucleoside recognition GATE domain",0,1
1773,"Archaeosine formation enzyme, radical SAM superfamily",2,2
1774,"Uncharacterized conserved protein, DUF2277 domain",3,0
1775,"Uncharacterized conserved protein, DUF2336 family",1,1
1776,Fucose permease,0,2
1777,"Predicted metal-binding protein, contains CGGC domain",0,0
1778,NCAIR mutase (PurE)-related protein,1,0
1779,NAD dependent epimerase/dehydratase family enzyme,0,1
1780,Dolichyl-phosphate-mannose--protein O-mannosyl transferase,1,0
1781,"Uncharacterized conserved protein YjgD, DUF1641 family",0,1
1782,Predicted ferric reductase,1,2
1783,DNA-binding transcriptional regulator YbjK,1,2
1784,Predicted benzoate:H+ symporter BenE,1,1
1785,"Gamma-glutamyl-gamma-aminobutyrate hydrolase PuuD (putrescine degradation), contains GATase1-like domain",1,0
1786,Nucleoside-diphosphate-sugar epimerase,1,0
1787,Catalase,0,1
1788,DNA replication protein DnaC,0,1
1789,Uncharacterized lipoprotein NlpE involved in copper resistance,0,1
1790,Putative effector of murein hydrolase,0,2
1791,"Predicted Zn-dependent protease YjaZ, DUF2268 family",0,2
1792,ATPase components of ABC transporters with duplicated ATPase domains,0,0
1793,"Uncharacterized membrane-anchored protein YjiN, DUF445 family",3,3
1794,"Predicted RNA-binding protein YhfF, contains PUA-like ASCH domain",0,4
1795,"YycH protein, regulator of the WalKR two-component signal transduction system",0,1
1796,Uncharacterized conserved protein YegI with protein kinase and helix-hairpin-helix DNA-binding domains,1,1
1797,"CRISPR-Cas system type I effector complex subunit Cas7,  RAMP superfamily",2,0
1798,"Glycosylphosphatidylinositol transamidase (GPIT), subunit GPI8",1,0
1799,NADH dehydrogenase/NADH:ubiquinone oxidoreductase 75 kD subunit (chain G),1,1
1800,"Uncharacterized membrane protein YdbT, contains bPH2 (bacterial pleckstrin homology) domain",1,1
1801,Dephospho-CoA kinase,2,1
1802,"Uncharacterized conserved protein RhaS, contains 28 RHS repeats",0,1
1803,Type VI protein secretion system component VasK,1,0
1804,"2C-methyl-D-erythritol 2,4-cyclodiphosphate synthase",2,0
1805,"Ribonuclease HI-related protein, contains viroplasmin and RNaseH domains",1,0
1806,"L-lactate utilization protein LutB, contains a ferredoxin-type domain",0,1
1807,Pyruvoyl-dependent arginine decarboxylase,2,1
1808,Biotin operon repressor,2,1
1809,Anti-sigma regulatory factor (Ser/Thr protein kinase),1,2
1810,Tryptophanase,1,2
1811,LPS assembly outer membrane protein LptD (organic solvent tolerance protein OstA),0,3
1812,Dihydrofolate reductase,2,1
1813,Transcriptional regulators containing an AAA-type ATPase domain and a DNA-binding domain,1,1
1814,"H+/gluconate symporter GntT or related permease, GntP/DsdX family",1,1
1815,Phosphomannomutase,2,0
1816,"Ca2+-binding protein, RTX toxin-related",1,0
1817,"ABC-type Mn2+/Zn2+ transport system, permease component",1,0
1818,Phosphate/sulfate permease,0,1
1819,Extracytoplasmic sensor domain CHASE2 (specificity unknown),3,0
1820,"Predicted secreted protein YlbL, contains PDZ domain",0,1
1821,Deoxyribodipyrimidine photolyase,1,0
1822,4'-phosphopantetheinyl transferase EntD (siderophore biosynthesis),1,0
1823,Prefoldin subunit 5,1,0
1824,Magnesium-transporting ATPase (P-type),2,0
1825,"PMT family glycosyltransferase ArnT/Agl22, involved in glycosylation of proteins and lipid IVA",1,1
1826,"ABC-type cobalamin transport system, ATPase component BtuD",1,0
1827,"Chitinase, GH19 family",1,0
1828,"ACT domain, ACT-3 family",1,0
1829,"GTP-binding protein, GTP1/Obg family",0,0
1830,Cellobiose phosphorylase,1,0
1831,Predicted Zn-dependent protease,1,0
1832,Archaeal ADP-dependent glucokinase/phosphofructokinase,0,3
1833,"ABC-type iron transport system FetAB, permease component",2,0
1834,"Cobyrinic acid a,c-diamide synthase",1,0
1835,Flagellin-specific chaperone FliS,0,1
1836,"Xanthine dehydrogenase, Fe-S cluster and FAD-binding subunit XdhA",2,1
1837,"Predicted phosphotransferase, aminoglycoside/choline kinase (APH/ChoK) family",0,1
1838,Predicted helicase,2,0
1839,rRNA processing protein Gar1,2,2
1840,Cyanate permease,1,1
1841,"Type III secretory pathway, lipoprotein EscJ",1,0
1842,Predicted alpha/beta hydrolase,1,2
1843,"Periplasmic protein TonB, links inner and outer membranes",0,2
1844,Ca2+/Na+ antiporter,0,3
1845,Box C/D ribonucleoprotein Nop56/Prp31/SIK1 subunit,1,2
1846,"Membrane-anchored lipoprotein Tpp15, major membrane immunogen",2,1
1847,Cytochrome c biogenesis protein CcmF,1,0
1848,Permease subunit MlaE of the ABC-type intermembrane phospholipid transporter Mla,1,1
1849,"Uncharacterized membrane protein YqaA, VTT domain",0,1
1850,UDP-N-acetylmuramyl tripeptide synthase,2,0
1851,"Predicted DNA-binding protein, potential antitoxin AbrB/MazE fold",1,0
1852,Aromatic ring hydroxylase,1,0
1853,Aspartate/aromatic aminotransferase,1,0
1854,"Formylglycine-generating enzyme, required for sulfatase activity, contains SUMF1/FGE domain",1,0
1855,Ribosomal protein L31E,1,0
1856,"Predicted N-acyltransferase, GNAT family",2,1
1857,"Sporulation protein YlmC, YlmC/YmxH family, contains PRC-barrel domain",3,0
1858,"Predicted phosphohydrolase, MPP superfamily",1,0
1859,Phosphopentomutase,2,0
1860,"DNA polymerase III, delta subunit",0,1
1861,Antirestriction protein ArdC,0,1
1862,Predicted trehalose synthase,1,1
1863,tRNA U34 5-methylaminomethyl-2-thiouridine-forming methyltransferase MnmC,1,0
1864,23S rRNA pseudoU1915 N3-methylase RlmH,2,1
1865,"Uncharacterized conserved protein, UPF0212 family",1,0
1866,"Uncharacterized membrane protein YfbV, UPF0208 family",4,0
1867,DNA replication protein DnaD,0,2
1868,Adenosine/AMP kinase,0,0
1869,Molybdopterin Mo-transferase (molybdopterin biosynthesis),0,1
1870,"Uncharacterized conserved protein, DUF2345 family",0,1
1871,Actin-related protein,1,2
1872,"Predicted ribonuclease YlaK, contains NYN-type RNase and PhoH-family ATPase domains",1,2
1873,Ketol-acid reductoisomerase,1,0
1874,"Flavodoxin NrdI, NrdF-interacting activator of class Ib ribonucleotide reductase",2,0
1875,"Cyclopropanoid cyclopropyl hydrolase, GyrI-like domain",2,2
1876,Trehalose-6-phosphate phosphatase,2,0
1877,Periplasmic ligand-binding sensor domain,0,0
1878,Soluble P-type ATPase,0,1
1879,"Integrase/recombinase, includes phage integrase",2,0
1880,"DNA-binding transcriptional regulator, CsgD family",2,0
1881,Homospermidine synthase,0,1
1882,"Uncharacterized conserved protein, DUF302 family",1,0
1883,Spore germination protein YkwD and related proteins with CAP (CSP/antigen 5/PR1) domain,2,1
1884,Outer membrane beta-barrel protein assembly factor BamC,1,0
1885,"Uncharacterized conserved protein, contains a C-terminal beta-barrel porin domain",0,2
1886,Septation ring formation regulator EzrA,1,0
1887,Predicted restriction endonuclease,2,1
1888,Glutamate synthase domain 2,3,0
1889,dGTP triphosphohydrolase,1,0
1890,Extracellular (periplasmic) sensor domain CHASE (specificity unknown),1,0
1891,"DNA helicase TIP49, TBP-interacting protein",0,2
1892,"Glucosamine 6-phosphate synthetase, contains amidotransferase and phosphosugar isomerase domains",0,0
1893,N-formylglutamate amidohydrolase,2,1
1894,Adenosine deaminase,0,4
1895,"N-methylhydantoinase B/oxoprolinase/acetone carboxylase, alpha subunit",2,1
1896,Glycine cleavage system protein T (aminomethyltransferase),0,2
1897,"Uncharacterized conserved protein YafD, endonuclease/exonuclease/phosphatase (EEP) superfamily",1,1
1898,Fe-S cluster assembly ATPase SufC,0,0
1899,Mg/Co/Ni transporter MgtE (contains CBS domain),0,1
1900,Ribosomal protein L44E,1,1
1901,"1-aminocyclopropane-1-carboxylate deaminase/D-cysteine desulfhydrase, PLP-dependent ACC family",1,1
1902,Uncharacterized membrane protein YhdT,0,0
1903,tRNA U34 5-carboxymethylaminomethyl modifying enzyme MnmG/GidA,1,0
1904,"Polynucleotide 5'-kinase, involved in rRNA processing",0,1
1905,N-acetyl-gamma-glutamylphosphate reductase,0,1
1906,"Predicted protein kinase regulating ubiquinone biosynthesis, AarF/ABC1/UbiB family",1,1
1907,Phosphoribosylformimino-5-aminoimidazole carboxamide ribonucleotide (ProFAR) isomerase,0,1
1908,"1,6-Anhydro-N-acetylmuramate kinase",0,2
1909,"Electron transfer flavoprotein, alpha subunit FixB",1,0
1910,Ankyrin repeat,0,2
1911,UDP-3-O-[3-hydroxymyristoyl] glucosamine N-acyltransferase,1,0
1912,Chorismate synthase,0,5
1913,"Uncharacterized membrane protein YdbS, contains bPH2 (bacterial pleckstrin homology) domain",0,0
1914,5-oxoprolinase subunit C/Allophanate hydrolase subunit 2,1,0
1915,"Neuraminidase (sialidase) NanH, contains C-terminal autotransporter domain",0,0
1916,"Uncharacterized conserved protein, DUF971 family",3,2
1917,Nucleoside diphosphate kinase,1,0
1918,Periplasmic Zn/Cd-binding protein ZinT,0,2
1919,Prophage maintenance system killer protein,1,1
1920,"Uncharacterized conserved protein, DUF2256 family",0,1
1921,"Uncharacterized conserved protein YegJ, DUF2314 family",1,1
1922,"Tyramine-glutamate ligase MfnD (methanofuran biosynthesis), ATP-grasp superfamily",1,1
1923,"Type IV secretory pathway, VirD2 component (relaxase)",0,1
1924,"Periplasmic serine protease, ClpP class",0,0
1925,2-keto-3-deoxy-L-rhamnonate aldolase RhmA,1,2
1926,Ribosomal protein S3AE,2,1
1927,"Intracellular sulfur oxidation protein, DsrE/DsrF family",0,0
1928,"Uncharacterized conserved protein, DUF2239 domain",2,0
1929,Mu-like prophage protein gp36,2,0
1930,Acetyl-CoA carboxylase beta subunit,1,0
1931,"Uncharacterized protein, contains PD-(D/E)XK nuclease domain",0,1
1932,"Phosphotransferase system, mannose/fructose/N-acetylgalactosamine-specific IIC component",1,0
1933,L-fucose isomerase or related protein,1,1
1934,D-aminopeptidase,1,1
1935,"Predicted nuclease of restriction endonuclease-like (RecB) superfamily,  DUF1016 family",2,0
1936,"Exo-beta-1,3-glucanase,  GH17 family",1,2
1937,"Na+-transporting NADH:ubiquinone oxidoreductase, subunit NqrF",0,2
1938,Phosphopantetheine adenylyltransferase,3,0
1939,F420-dependent methylenetetrahydromethanopterin dehydrogenase,2,1
1940,"ATPase/GTPase, AAA15 family",0,3
1941,Transcriptional accessory protein Tex/SPT6,0,0
1942,"DNA topoisomerase VI, subunit A",0,1
1943,"Alkyl sulfatase BDS1 and related hydrolases, metallo-beta-lactamase superfamily",1,0
1944,"Translation initiation factor 2B subunit, eIF-2B alpha/beta/delta family",0,0
1945,sRNA-binding regulator protein Hfq,0,0
1946,"Uncharacterized conserved protein YdgA, DUF945 family",1,2
1947,"Translation elongation factor EF-Tu, a GTPase",1,1
1948,Predicted amino acid racemase,1,0
1949,"Succinate dehydrogenase, hydrophobic anchor subunit",0,1
1950,"Uncharacterized conserved protein AF1501, DUF2226 family",2,0
1951,"Endo-1,4-beta-D-glucanase Y",1,1
1952,3-phosphoglycerate kinase,1,0
1953,Archaeal/vacuolar-type H+-ATPase subunit C/Vma6,0,3
1954,"Uncharacterized metal-binding protein MJ0455, DUF1847 family",1,1
1955,"ABC-type hemin transport system, ATPase component",1,0
1956,Sigma54-dependent transcription regulator containing an AAA-type ATPase domain and a DNA-binding domain,0,1
1957,Anaerobic ribonucleoside-triphosphate reductase,0,3
1958,Deoxyribose-phosphate aldolase,1,0
1959,D-ribose pyranose/furanose isomerase RbsD,4,0
1960,BRCT domain type II,0,3
1961,"Predicted RNA binding protein YcfA, dsRBD-like fold, HicA-like mRNA interferase family",2,0
1962,"Cytoplasmic potassium-binding protein Kbp/XkdP/YgaU, contains LysM domain",2,0
1963,"Type VI protein secretion system component TssA1/VasJ/EvfE, contains ImpA_N domain",1,1
1964,"Uncharacterized conserved protein, DUF2304 domain",2,2
1965,Mu-like prophage protein gp46,0,1
1966,"K+-transporting ATPase, KdpA subunit",1,4
1967,Bifunctional PLP-dependent enzyme with beta-cystathionase and maltose regulon repressor activities,0,1
1968,Protoheme ferro-lyase (ferrochelatase),1,2
1969,Exopolyphosphatase/pppGpp-phosphohydrolase,1,3
1970,"CMP-N-acetylneuraminic acid synthetase, NeuA/PseF family",2,1
1971,"Predicted ABC-type exoprotein transport system, permease component",2,1
1972,Antitoxin component MazE of the MazEF toxin-antitoxin module,0,3
1973,Aspartate oxidase,1,0
1974,Peptide methionine sulfoxide reductase MsrA,1,0
1975,"ABC-type phosphate transport system, periplasmic component",0,2
1976,"Type II secretory pathway, pseudopilin PulG",1,1
1977,Translation elongation factor EF-Ts,0,0
1978,"Stereoselective (R,S)-S-adenosylmethionine hydrolase (adenosine-forming)",1,1
1979,Putative N-acetylmannosamine-6-phosphate epimerase,3,0
1980,"Uncharacterized conserved protein YqjF, DUF2071 family",1,0
1981,"ATP-utilizing enzyme, PP-loop superfamily",0,1
1982,"VapC family ribonuclease, contains PIN domain",1,4
1983,Cytidylate kinase,1,0
1984,Predicted amidohydrolase,0,1
1985,"Predicted transcriptional regulator, contains an XRE-type HTH domain (archaeal members contain CBS pair)",2,0
1986,"ABC-type phosphate transport system, ATPase component",1,0
1987,"Predicted archaeal serine protease, S18 family",3,3
1988,3-methyladenine DNA glycosylase Tag,2,2
1989,N-acetylmuramoyl-L-alanine amidase,0,4
1990,"Predicted phospholipase, patatin/cPLA2 family",1,1
1991,"Uncharacterized membrane protein YcaP, DUF421 family",1,0
1992,"Tetrahydromethanopterin S-methyltransferase, subunit G",1,1
1993,Transcription-repair coupling factor (superfamily II helicase),0,1
1994,cAMP phosphodiesterase,1,2
1995,"Nitrate reductase assembly protein NarJ, required for insertion of molybdenum cofactor",1,2
1996,"Putative cell wall-binding domain (amidase enhancer), LytB superfamily",0,2
1997,Phage P2 baseplate assembly protein gpV,2,1
1998,Predicted dioxygenase of extradiol dioxygenase family,0,1
1999,"Uncharacterized conserved protein MJ1470, contains DUF2341 domain, predicted component of type IV pili-like system",0,1
2000,Circularly permuted ATP-grasp protein,1,0
2001,"Sensor histidine kinase, LytS/YehU family",2,0
2002,"ATP-dependent Clp protease, ATP-binding subunit ClpA",0,1
2003,Acyl carrier protein/domain,0,3
2004,"ABC-type transport system involved in cytochrome c biogenesis, ATPase component",0,1
2005,"Formate hydrogenlyase subunit 3/Multisubunit Na+/H+ antiporter, MnhD subunit",1,3
2006,Cell shape-determining protein MreD,2,1
2007,"Ferredoxin-thioredoxin reductase, catalytic subunit",0,4
2008,sRNA-binding carbon storage regulator CsrA,2,1
2009,"Cold shock protein, CspA family",1,0
2010,"Glycyl-tRNA synthetase, class II",0,2
2011,Hydrogenase maturation factor HypE,0,1
2012,"Predicted triphosphatase or cyclase YjbK, contains CYTH domain",0,1
2013,Wobble nucleotide-excising tRNase,2,1
2014,Methyl-accepting chemotaxis protein (MCP),0,2
2015,"5,10-methylenetetrahydrofolate reductase",1,0
2016,2-succinyl-5-enolpyruvyl-6-hydroxy-3-cyclohexene-1-carboxylate synthase,0,1
2017,Chemotaxis receptor (MCP) glutamine deamidase CheD,1,0
2018,"Signal-transduction protein containing cAMP-binding, CBS, and nucleotidyltransferase domains",1,2
2019,"Uncharacterized protein, contains Zn-finger domain",1,0
2020,Serine protease inhibitor,1,0
2021,"Phosphoenolpyruvate carboxykinase, ATP-dependent",0,2
2022,Uncharacterized conserved protein YdaT,0,0
2023,Lhr-like helicase,0,1
2024,Ketopantoate reductase,1,3
2025,"Uncharacterized conserved protein, DUF1365 family",1,0
2026,Sarcosine oxidase delta subunit,1,1
2027,Ribosomal protein L7Ae or related RNA K-turn-binding protein,0,1
2028,Bacterioferritin-associated ferredoxin,2,1
2029,Anaerobic selenocysteine-containing dehydrogenase,1,0
2030,HPt (histidine-containing phosphotransfer) domain,1,1
2031,"Uncharacterized conserved protein, DUF2087 family",1,0
2032,"Predicted metal-binding transcription factor, methanogenesis marker domain 9",2,2
2033,"Cbb3-type cytochrome oxidase, subunit 3",1,0
2034,Nitrogen fixation protein FixH,3,2
2035,NADH:ubiquinone oxidoreductase NDUFA12 subunit (Leigh syndrome),1,2
2036,Polyprenyltransferase (heme O synthase),1,0
2037,"Uncharacterized conserved protein, DUF1013 family",1,0
2038,Dethiobiotin synthetase,0,1
2039,"ABC-type xylose transport system, permease component",0,2
2040,"Formate-dependent nitrite reductase, periplasmic cytochrome c552 subunit",1,0
2041,"mRNA-degrading endonuclease (mRNA interferase) HigB, toxic component of the HigAB toxin-antitoxin module",0,1
2042,"Uncharacterized conserved protein, contains TadX/Tad_C domain",1,0
2043,"Predicted RNA repair component, a phosphatase of H2Macro superfamily, DUF2263 family",1,0
2044,Predicted dinucleotide-binding enzyme,1,0
2045,Peptidoglycan-binding (PGRP) domain of peptidoglycan hydrolases,0,0
2046,"Polyphosphate kinase 2, PPK2 family",0,1
2047,ATP phosphoribosyltransferase regulatory subunit HisZ,2,4
2048,"Uncharacterized membrane-anchored protein YhcB, DUF1043 family",1,2
2049,"Predicted RNA binding protein with dsRBD fold, UPF0201 family",2,0
2050,Di- or tripeptidase,2,1
2051,Single-stranded DNA-binding protein,0,1
2052,"Predicted component of the type VI protein secretion system, contains a FHA domain",1,0
2053,"Curved DNA-binding protein CbpA, contains a DnaJ-like domain",1,0
2054,"Methanofuran synthetase MfnF, hydantoinase/oxoprolinase family",3,1
2055,"tRNA 2-selenouridine synthase SelU, contains rhodanese domain",0,1
2056,Methanogenic corrinoid protein MtbC1,0,1
2057,Acyl-CoA reductase or other NAD-dependent aldehyde dehydrogenase,0,2
2058,Ribosomal protein L20A (L18A),0,1
2059,Cell division ATPase FtsA,0,1
2060,"Membrane integrity protein DedA, putative transporter, DedA/Tvp38 family",0,0
2061,Acetylornithine/succinyldiaminopimelate/putrescine aminotransferase,1,0
2062,NADH:ubiquinone oxidoreductase 24 kD subunit (chain E),1,1
2063,"Phosphotransferase system, mannose/fructose/N-acetylgalactosamine-specific component IIB",0,3
2064,Deoxycytidylate deaminase,1,0
2065,"Sulfur transfer protein SufE, Fe-S cluster assembly",0,0
2066,"Uncharacterized conserved protein YbaP, TraB family",2,1
2067,"tRNA/tmRNA/rRNA uracil-C5-methylase, TrmA/RlmC/RlmD family",1,0
2068,General stress protein CsbA (function unknown),0,2
2069,Cu/Zn superoxide dismutase,0,1
2070,Biopolymer transport protein ExbB/TolQ,0,1
2071,Phenylalanyl-tRNA synthetase beta subunit,1,0
2072,"Phosphoethanolamine transferase for periplasmic glucans OpgE, AlkP superfamily",1,1
2073,"Putative Ca2+/H+ antiporter, TMEM165/GDT1 family",1,2
2074,Archaellum component ArlC/FlaC,0,1
2075,"Na+-translocating ferredoxin:NAD+ oxidoreductase RNF, RnfA subunit",0,1
2076,Co/Zn/Cd efflux system component,2,1
2077,tRNA splicing ligase,1,1
2078,"Predicted membrane-bound mannosyltransferase, involved in protein glycosylation",2,0
2079,Proteasome assembly chaperone (PAC2) family protein,0,3
2080,Fe-S cluster biosynthesis and repair protein YggX,0,3
2081,"Predicted regulator of Ras-like GTPase activity, Roadblock/LC7/MglB family",0,2
2082,Regulatory P domain of the subtilisin-like proprotein convertases and other proteases,0,1
2083,Flagellar biosynthesis regulator FlaF,0,1
2084,"Zn-dependent oligopeptidase, M3 family",0,1
2085,Inactivated superfamily I helicase,2,1
2086,Phosphoenolpyruvate synthase/pyruvate phosphate dikinase,0,1
2087,"Predicted transcriptional regulator MJ0558, contains a CRP-type HTH domain",0,0
2088,"Predicted  nucleic acid-binding protein, contains Zn-ribbon domain",0,1
2089,Ribosomal protein L21,0,2
2090,"Uncharacterized conserved protein, DUF952 family",1,0
2091,Low temperature requirement protein LtrA (function unknown),4,1
2092,"Uncharacterized membrane protein, Fun14 family",4,1
2093,"Uncharacterized conserved protein, DUF1326 domain",0,1
2094,"Archaeal flagellin (archaellin), FlaG/FlaF family",1,0
2095,Glutamine amidotransferase related to the GATase domain of CobQ,0,1
2096,Succinylglutamate desuccinylase,1,0
2097,"Adenylate cyclase class IV, CYTH domain (includes archaeal enzymes of unknown function)",0,1
2098,"Uncharacterized conserved protein YbaA, DUF1428 family",2,1
2099,Anaerobic glycerol-3-phosphate dehydrogenase,1,2
2100,"mRNA-degrading endonuclease MazF, toxin component of the MazEF toxin-antitoxin module",2,2
2101,"Type IV secretory pathway, protease TraF",0,1
2102,Methionine synthase II (cobalamin-independent),1,1
2103,"NADH:ubiquinone oxidoreductase, NADH-binding 51 kD subunit (chain F)",1,0
2104,"Uncharacterized stationary-phase protein YicC, UPF0701 family",1,1
2105,"ABC-type nickel/cobalt efflux system, permease component RcnA",2,0
2106,"Archaeal DNA polymerase II, small subunit/DNA polymerase delta, subunit B",1,2
2107,Sarcosine oxidase gamma subunit,3,0
2108,7-cyano-7-deazaguanine synthase (queuosine biosynthesis),1,1
2109,"N-hydroxylaminopurine reductase subunit YcbX, contains MOSC domain",0,2
2110,Mg2+/citrate symporter,1,1
2111,Glycerol-1-phosphate heptaprenyltransferase,0,1
2112,"mRNA-degrading endonuclease YafQ (mRNA interferase), toxin component of the YafQ-DinJ toxin-antitoxin module",0,1
2113,"Predicted transciptional regulator, contains HTH domain",2,1
2114,Preprotein translocase subunit SecY,1,0
2115,"Predicted ssDNA annealing protein, contains HHH motif, Rad42/Rad22/RecT/erf family",1,2
2116,"Asparagine N-glycosylation enzyme, membrane subunit Stt3",0,3
2117,"Predicted transcriptional regulator, contains XRE-type HTH domain",2,0
2118,"Pyruvate:ferredoxin oxidoreductase or related 2-oxoacid:ferredoxin oxidoreductase, delta subunit",0,0
2119,"Endogenous inhibitor of DNA gyrase, YacG/DUF329 family",1,1
2120,"Lipid-binding SYLF domain, Ysc84/FYVE family",1,0
2121,Chorismate mutase,0,1
2122,"Uncharacterized conserved protein YjaG, DUF416 family",1,2
2123,Ribosomal protein L34,1,1
2124,Anaerobic C4-dicarboxylate transporter,1,0
2125,Periplasmic deferrochelatase/peroxidase EfeB,0,0
2126,Anthranilate/para-aminobenzoate synthases component I,2,3
2127,"Vancomycin resistance protein YoaR (function unknown), contains peptidoglycan-binding and VanW domains",0,2
2128,"Tetrahydromethanopterin S-methyltransferase, subunit D",1,0
2129,Ribosomal protein L39E,0,1
2130,BioD-like N-terminal domain of phosphotransacetylase,0,1
2131,Ribosome-binding factor RbfA,2,0
2132,"Uncharacterized protein, contains DUF3084 domain",0,1
2133,L-2-hydroxyglutarate oxidase LhgO,1,0
2134,Predicted oxidoreductase,3,0
2135,"Type I site-specific restriction-modification system, R (restriction) subunit and related helicases ...",0,1
2136,Putative heme degradation protein,0,3
2137,Ribosomal protein S9,0,2
2138,"Uncharacterized conserved protein, DUF3299 family",4,0
2139,Precorrin-2 methylase,0,1
2140,Serine protease inhibitor ecotin,2,2
2141,"Cell fate regulator YmcA, YheA/YmcA/DUF963 family (controls sporulation, competence, biofilm development)",2,1
2142,"Uncharacterized conserved protein, DUF2264 domain",1,0
2143,Tubulin,2,0
2144,Glutamate-1-semialdehyde aminotransferase,1,1
2145,Replication protein A (RPA) family protein,0,2
