,feature_name,cultured_feature_counts,uncultured_feature_counts
0,STAS domain,1,2
1,"ABC-type microcin C transport system, permease component YejB",1,0
2,"Methionine synthase I (cobalamin-dependent), methyltransferase domain",1,1
3,Precorrin-3B methylase,1,2
4,3-deoxy-D-manno-octulosonic acid (KDO) 8-phosphate synthase,1,0
5,"Uncharacterized conserved protein, DUF1015 family",1,0
6,"Methylphosphotriester-DNA--protein-cysteine methyltransferase (N-terminal fragment of Ada), contains Zn-binding and two AraC-type DNA-binding domains",2,1
7,FMN-dependent NADH-azoreductase,1,0
8,Pilin (type 1 fimbrial protein),1,1
9,"Integral membrane protein YbhL, putative Ca2+ regulator, Bax inhibitor (BI-1)/TMBIM family",0,1
10,"DNA-binding transcriptional regulator, XRE-family HTH domain",0,1
11,"Delta-aminolevulinic acid dehydratase, porphobilinogen synthase",1,1
12,"Predicted RNase MK1237, contains PIN domain, UPF0278 family",1,0
13,"Uncharacterized conserved protein, contains a phytase-like domain",0,1
14,Dienelactone hydrolase,1,1
15,Histidine ammonia-lyase,1,1
16,"Predicted thiol-disulfide oxidoreductase YuxK, DCC family",1,0
17,Maltoporin (phage lambda and maltose receptor),0,2
18,GTP cyclohydrolase I,1,1
19,"UDP-N-acetyl-D-mannosaminuronic acid transferase, WecB/TagA/CpsF family",1,2
20,"Lipoprotein NlpI, contains TPR repeats",1,0
21,"Na+-transporting NADH:ubiquinone oxidoreductase, subunit NqrE",0,1
22,LysM repeat,0,1
23,Glutamine synthetase,1,0
24,"Nucleoside phosphorylase/nucleosidase, includes 5'-methylthioadenosine/S-adenosylhomocysteine nucleosidase MtnN and futalosine hydrolase MqnB",1,0
25,Phosphoglycerate mutase (BPG-dependent),1,1
26,UV DNA damage repair endonuclease,2,1
27,Conjugal transfer/entry exclusion protein,0,1
28,"Cbb3-type cytochrome oxidase, cytochrome c subunit FixO",1,1
29,Hemerythrin,0,2
30,"Uncharacterized membrane protein YgaE, UPF0421/DUF939 family",1,0
31,Cytidine deaminase,0,1
32,"Glycosyltransferase, catalytic subunit of cellulose synthase and poly-beta-1,6-N-acetylglucosamine synthase",0,2
33,Uncharacterized membrane protein YcfT,1,0
34,"Uncharacterized conserved protein YrzB, UPF0473 family",0,0
35,Indole-3-glycerol phosphate synthase,1,0
36,Chemotaxis signal transduction protein CheW,2,2
37,Intermembrane transporter PqiABC subunit PqiB,2,1
38,Muramoyltetrapeptide carboxypeptidase LdcA (peptidoglycan recycling),1,2
39,"Cdc6-related protein, AAA superfamily ATPase",2,1
40,"Uncharacterized conserved protein DfsB/IRC4, DUF1706 (PF08020) domain",1,1
41,"ABC-type transport system, periplasmic component",0,1
42,Formylmethanofuran dehydrogenase subunit C,1,0
43,Predicted P-loop ATPase/GTPase,3,1
44,Anti-sigma-K factor RskA,1,0
45,Outer membrane murein-binding lipoprotein Lpp,0,1
46,Membrane-associated phospholipid phosphatase,2,1
47,"ABC-type thiamine transport system, periplasmic component TbpA",1,0
48,"HD superfamily phosphodieaserase, includes HD domain of RNase Y",1,0
49,"Heme/copper-type cytochrome/quinol oxidase, subunit 3",0,1
50,Alpha-L-arabinofuranosidase,3,0
51,RNase P protein component,1,1
52,Ribosomal protein L14E/L6E/L27E,3,1
53,Adenylate kinase or related kinase,2,0
54,Negative regulator of flagellin synthesis (anti-sigma28 factor),1,1
55,Galactose-1-phosphate uridylyltransferase,2,3
56,"DNA utilization protein ComFC/GntX, contains phosphoribosyltransferase domain",1,1
57,"Anti-sigma factor ChrR, cupin superfamily",1,0
58,Ran GTPase-activating protein (RanGAP) involved in mRNA processing and transport,2,2
59,"Radical SAM superfamily enzyme YgiQ, UPF0313 family",5,0
60,"dTDP-4-amino-4,6-dideoxygalactose transaminase",0,1
61,Putative salt-induced outer membrane protein YdiY,3,1
62,"Uncharacterized conserved protein, DUF2067 domain",1,0
63,Lysine/ornithine N-monooxygenase,1,1
64,Pyridoxal 5'-phosphate synthase subunit PdxS,2,1
65,DNA segregation ATPase FtsK/SpoIIIE or related protein,2,0
66,"NDP-sugar epimerase, includes UDP-GlcNAc-inverting 4,6-dehydratase FlaA1 and capsular polysaccharide biosynthesis protein EpsC",0,2
67,ATP-dependent 26S proteasome regulatory subunit,1,0
68,"Predicted metal-dependent membrane protease YhfC, DUF2324 family",2,1
69,"Uncharacterized membrane protein YqgA, affects biofilm formation",0,1
70,5'(3')-deoxyribonucleotidase,2,0
71,Alpha/beta superfamily hydrolase,1,1
72,"Uncharacterized conserved protein, UPF0160 family",1,0
73,"Beta-phosphoglucomutase, HAD superfamily",0,1
74,"Lipopolysaccharide export LptBFGC system, permease protein LptF",1,0
75,Flagellar biogenesis protein FliO,0,2
76,"Rbosome biogenesis protein Nip4, contains PUA domain",1,0
77,Phage protein U,3,1
78,"Colicin E2 tolerance protein CbrC, UPF0167 family",1,0
79,"Uncharacterized conserved protein, DUF2118 domain",1,0
80,"DNA-directed RNA polymerase, sigma subunit (sigma70/sigma32)",2,0
81,Quinol monooxygenase YgiN,3,2
82,"Cell division protein SepF/YlmF, interacts with FtsZ",0,2
83,Dihydroorotate dehydrogenase,0,1
84,Restriction endonuclease S subunit,3,0
85,"Sulfur transfer complex TusBCD TusC component, DsrF family",1,0
86,Cytochrome b involved in lipid metabolism,1,0
87,"Fimbrial subunit ScuA/B, ScuA/B/SCPU domain",0,2
88,"Ribonuclease BN, tRNA processing enzyme",1,2
89,Phosphate-selective porin,0,1
90,Flagellar hook-basal body complex protein FliE,0,1
91,CTP:molybdopterin cytidylyltransferase MocA,1,0
92,"AAA+-type ATPase, SpoVK/Ycf46/Vps4 family",0,3
93,GTP:adenosylcobinamide-phosphate guanylyltransferase,1,0
94,Ribosomal protein L27,2,1
95,"Protease, Ulp1 family",1,2
96,"Uncharacterized conserved protein, DUF2236 family",0,1
97,"Type II secretory pathway, PulJ/GspJ component",0,1
98,Pectin methylesterase and related acyl-CoA thioesterases,2,1
99,"ABC-type arginine transport system, permease component",1,1
100,Cyanophycinase and related exopeptidases,0,3
101,"Predicted DNA-binding protein AF1194, contains HTH domain, DUF2240 family",1,1
102,DNA primase (bacterial type),1,0
103,"Uncharacterized conserved protein, DUF2460 domain",0,1
104,3-phytase (myo-inositol-hexaphosphate 3-phosphohydrolase),4,1
105,"ABC-type Fe3+ transport system, permease component",0,1
106,"Predicted transcriptional regulator, contains C-terminal CBS domains",2,1
107,"Flagellar motility protein MotE, a chaperone for MotC folding",0,1
108,"Exosome complex RNA-binding protein Rrp4, contains S1 and KH domains",1,0
109,"Uncharacterized conserved protein, DUF452 domain",1,0
110,Type VI protein secretion system component Hcp (secreted cytotoxin),1,1
111,"Uncharacterized HEPN domain protein YutE, UPF0331/DUF86 family",0,1
112,"3-Methyladenine DNA glycosylase, HhH-GPD/Endo3 superfamily",1,1
113,Formate-dependent phosphoribosylglycinamide formyltransferase (GAR transformylase),0,1
114,Seryl-tRNA synthetase,1,1
115,"ABC-type lipopolysaccharide export system, ATPase component",0,1
116,Glycosidase/amylase (phosphorylase),2,3
117,Endo-beta-N-acetylglucosaminidase D,4,0
118,Aminoglycoside N3'-acetyltransferase,1,2
119,Hemin uptake protein HemP,1,2
120,Uncharacterized N-terminal domain of the transcription elongation factor GreA,0,1
121,"Uncharacterized conserved protein YebE, UPF0316/DUF2179 family",2,2
122,Superfamily II DNA or RNA helicase,0,1
123,"RseB, negative regulator of sigma E activity",3,1
124,"HD-GYP domain, c-di-GMP phosphodiesterase class II (or its inactivated variant)",2,0
125,"Na+-translocating ferredoxin:NAD+ oxidoreductase  RNF, RnfD subunit",0,1
126,"Ni,Fe-hydrogenase III component G",1,0
127,Archaeal IMP cyclohydrolase,1,0
128,"Uncharacterized protein, contains DUF2461 domain",1,1
129,"Uncharacterized conserved protein, DUF1810 family",1,1
130,Uncharacterized membrane protein YfhO,1,1
131,Protein-L-isoaspartate O-methyltransferase,1,0
132,Uncharacterized conserved protein MTH_862,1,0
133,"NADPH-dependent 7-cyano-7-deazaguanine reductase QueF, C-terminal domain, T-fold superfamily",0,1
134,Dipeptide/tripeptide permease,1,1
135,"Uncharacterized conserved protein, DUF1850 family",1,0
136,"Uncharacterized protein, contains phage Mu head morphogenesis gpF-like domain",1,2
137,"Predicted protease, Abi (CAAX) family",1,2
138,"Oxidoreductase (NAD-binding), involved in siderophore biosynthesis",1,1
139,"WGR domain, predicted DNA-binding domain in MolR",0,1
140,"GTP 3',8-cyclase (molybdenum cofactor biosynthesis protein MoaA)",1,0
141,Dihydroorotase or related cyclic amidohydrolase,1,2
142,tRNA (Thr-GGU) A37 N6-methylase,0,1
143,Predicted archaeal methyltransferase,0,3
144,"Xanthosine utilization system component, XapX domain",1,0
145,"NADH pyrophosphatase NudC, Nudix superfamily",1,1
146,Ribosomal protein L11 methylase PrmA,1,0
147,"Uncharacterized conserved protein YozE, UPF0346 family",2,2
148,Fe2+ transporter FeoB,0,1
149,Chitodextrinase,1,2
150,Ribonucleotide reductase alpha subunit,1,0
151,3'->5' ssDNA/RNA exonuclease TatD,0,2
152,"Hemolysin-related protein, contains CBS domains, UPF0053 family",1,0
153,"Na+-dependent transporter, SNF family",0,1
154,Choline-glycine betaine transporter,0,2
155,Superfamily I DNA and/or RNA helicase,1,0
156,Heme-binding NEAT domain,0,0
157,Phosphodiesterase/alkaline phosphatase D,1,0
158,"Transcriptional regulator of competence genes, TfoX/Sxy family",0,0
159,23S rRNA maturation mini-RNase III,2,0
160,Epoxyqueuosine reductase QueH (tRNA modification),2,0
161,Cell division protein FtsX,0,1
162,Adenine-specific DNA N6-methylase,2,0
163,Myo-inositol-1-phosphate synthase,1,1
164,"TRAP-type uncharacterized transport system, fused permease components",1,1
165,"Ras-like GTP-binding stress-induced protein YcjX,  DUF463 family",2,1
166,"Uncharacterized conserved protein, contains GBA2_N and DUF608 domains",0,1
167,Dihydropteroate synthase,0,1
168,"Uncharacterized conserved protein, contains PIN-related Mut7-C RNAse domain",1,1
169,"Zn/Ni/Co-binding GTPase YjiA, predicted metallochaperone, CobW/Nha3/YciC family",0,1
170,"2',3'-cyclic-nucleotide 2'-phosphodiesterase/5'- or 3'-nucleotidase, 5'-nucleotidase family",1,0
171,Predicted CDP-diglyceride synthetase/phosphatidate cytidylyltransferase,0,1
172,"Uncharacterized conserved protein, PKD repeat domain",1,3
173,"ABC-type Mn2+/Zn2+ transport system, ATPase component",0,1
174,"Uncharacterized conserved protein, DUF2125 domain",1,1
175,"Predicted membrane anchor for polysulfide/nitrite-type reductase, PsrC/NrfD syperfamily",0,1
176,"Lysyl-tRNA synthetase, class I",2,1
177,Chitinase,0,3
178,"Lipoprotein Med, regulator of KinD/Spo0A, PBP1-ABC superfamily, includes NupN",0,1
179,"Predicted hydrocarbon binding protein, contains 4VR domain",2,2
180,"Type IV secretory pathway, component VirB8",0,0
181,Crotonobetainyl-CoA:carnitine CoA-transferase CaiB and related acyl-CoA transferases,2,0
182,"ABC-type branched-chain amino acid transport system, ATPase component LivF",0,1
183,"Uncharacterized conserved protein, contains restriction enzyme R protein N terminal (HSDR_N) domain",1,1
184,"Uncharacterized conserved protein, DUF1430 domain",1,0
185,"Uncharacterized protein, contains ACT and PBP-like DUF5612 domains, MJ1458 family",2,0
186,"Glyoxalase ElbB, DJ-1 superfamily",2,1
187,Homoaconitase/3-isopropylmalate dehydratase large subunit,2,2
188,Ni/Fe-hydrogenase 2 integral membrane subunit HybB,2,1
189,Fumarylacetoacetate (FAA) hydrolase family protein,2,0
190,"D-alanyl-lipoteichoic acid acyltransferase DltB, MBOAT superfamily",0,1
191,"ACT domain-containing protein, UPF0735 family",0,1
192,"L-ascorbate lactonase UlaG, metallo-beta-lactamase superfamily",1,1
193,Nucleoside-specific outer membrane channel protein Tsx,3,1
194,Ribosomal protein L40E,2,2
195,Ribosomal protein S17,1,0
196,Urease accessory protein UreF,0,3
197,"Transcription elongation factor Elf1, contains Zn-ribbon domain",0,1
198,"PIN domain nuclease, a component of toxin-antitoxin system (PIN domain)",3,1
199,"Na+-transporting NADH:ubiquinone oxidoreductase, subunit NqrD",1,0
200,Cytosine/uracil/thiamine/allantoin permease,0,1
201,Ribosomal protein S7,0,1
202,Transcriptional regulator TyrR of aromatic amino acids metabolism,0,3
203,"LD-carboxypeptidase LdcB, LAS superfamily",1,0
204,"Regulator of sirC expression, contains transglutaminase-like and TPR domains",1,0
205,Small-conductance mechanosensitive channel MscK,0,3
206,"DNA-binding transcriptional regulator DnrI/AfsR/EmbR, SARP family, contains BTAD domain",1,0
207,TPP-dependent pyruvate or acetoin dehydrogenase subunit alpha,1,0
208,Adenylosuccinate synthase,1,1
209,tmRNA-binding protein,0,0
210,"Glycerol-3-phosphate cytidylyltransferase, cytidylyltransferase family",1,1
211,Phosphotransferase system sorbitol-specific IIB component,1,0
212,"Ribonuclease/mRNA interferase VapC, contains PIN domain",0,1
213,Stage 0 sporulation-control protein Spo0M,0,4
214,"DNA-binding transcriptional regulator, LacI/PurR family",1,1
215,Anthranilate/para-aminobenzoate synthase component II (glutamine amidotransferase),0,0
216,Alpha-D-ribose 1-methylphosphonate 5-triphosphate synthase subunit PhnH,1,0
217,"Uncharacterized conserved protein, DUF2267 family",2,0
218,"Uncharacterized conserved protein MTH_811, UPF0305 family",1,0
219,"Archaeal ribosome-binding protein aMBF1, putative translation factor, contains Zn-ribbon and HTH domains",0,1
220,"Translation initiation factor 2, gamma subunit (eIF-2gamma; GTPase)",0,1
221,"Cytochrome oxidase Cu insertion factor, SCO1/SenC/PrrC family",1,0
222,"Formaldehyde-activating enzyme (5,6,7,8-tetrahydromethanopterin hydrolyase)",3,1
223,"Na+-transporting oxaloacetate/methylmalonyl-CoA decarboxylase, gamma subunit",0,1
224,Preprotein translocase subunit Sss1,1,1
225,"Uncharacterized conserved protein Veg, DUF1021 family",0,4
226,Cytochrome c oxidase assembly protein CtaG,2,0
227,Primase-polymerase (Primpol) domain protein,0,1
228,"Uncharacterized conserved protein, DUF1674 domain",0,1
229,Pyridoxal 5'-phosphate synthase subunit PdxT (glutamine amidotransferase),1,3
230,"Ferritin-like DNA-binding protein, DPS (DNA Protection under Starvation) family",0,3
231,Translation elongation factor EF-1alpha (GTPase),2,2
232,2-hydroxy fatty acid dioxygenase MPO1 (alpha-oxidation of fatty acids),3,2
233,Type II secretory pathway ATPase component GspA/ExeA/MshM,0,2
234,Archaeal/vacuolar-type H+-ATPase catalytic subunit A/Vma1,0,0
235,"Mannose-6-phosphate isomerase, class I",1,1
236,Glycopeptide antibiotics resistance protein,0,1
237,Tryptophan synthase alpha chain,1,1
238,GTPase,0,1
239,"Uncharacterized conserved protein, contains DUF2130 domain",2,1
240,"ABC-type molybdate transport system, periplasmic Mo-binding protein ModA",0,1
241,Type IV pilus assembly protein PilN,3,2
242,Glycine/serine hydroxymethyltransferase,1,1
243,Predicted N-acyltransferase,1,2
244,"Transglutaminase-like enzyme, putative cysteine protease",2,0
245,"nanoRNase/pAp phosphatase, hydrolyzes c-di-AMP and oligoRNAs",1,2
246,"Ethanolamine utilization protein EutJ, possible chaperonin",0,1
247,"Phenylacetate-coenzyme A ligase PaaK, adenylate-forming domain family",2,0
248,Lantibiotic modifying enzyme,1,2
249,ABC-type polysaccharide/teichoic acid/polyol phosphate export permease,2,0
250,"Uncharacterized conserved protein, DUF2075 family",0,1
251,Endonuclease I,1,1
252,Flagellar biosynthesis/type III secretory pathway ATPase FliI,2,0
253,Ribosomal protein L11,2,0
254,"5,10-methenyltetrahydromethanopterin hydrogenase",1,1
255,Putative heme-binding protein PhuW,3,0
256,"Ni,Fe-hydrogenase I cytochrome b subunit",0,1
257,Phosphohistidine swiveling domain of PEP-utilizing enzymes,1,1
258,NADH:ubiquinone oxidoreductase 20 kD subunit (chain B) or related Fe-S oxidoreductase,0,1
259,"Uncharacterized conserved protein, DUF721 domain",0,2
260,Predicted neuraminidase (sialidase),0,0
261,Urease beta subunit,2,0
262,Uncharacterized FlgJ-related protein,0,1
263,"Lyzozyme M1 (1,4-beta-N-acetylmuramidase), GH25 family",1,0
264,"Cytoskeletal protein RodZ, contains Xre-like HTH and DUF4115 domains",1,1
265,Phage head maturation protease,0,1
266,Ribosomal protein L33,0,2
267,Spore coat protein CotF,0,1
268,"Uncharacterized conserved protein YdaU, DUF1376 family",0,3
269,Formylmethanofuran:tetrahydromethanopterin formyltransferase,2,0
270,Uncharacterized membrane protein,0,1
271,Excinuclease UvrABC ATPase subunit,1,0
272,"Chromosome condensin MukBEF, ATPase and DNA-binding subunit MukB",0,2
273,Nitrous oxide reductase,1,0
274,"Predicted oxidoreductase, contains short-chain dehydrogenase (SDR) and DUF2520 domains",0,1
275,"Type III secretory pathway, EscS/YscS component",0,2
276,Chromosome segregation and condensation protein ScpB,0,1
277,Uncharacterized phage protein gp47/JayE,3,1
278,"Uncharacterized conserved protein, DUF1415 family",0,1
279,"Pyruvate:ferredoxin oxidoreductase or related 2-oxoacid:ferredoxin oxidoreductase, beta subunit",1,0
280,"Cytochrome oxidase maturation protein, CcoS/FixS family",2,2
281,Amino acid permease,1,0
282,RecB family exonuclease,1,0
283,"Stage II sporulation protein SpoIIM, component of the engulfment complex",1,1
284,Imidazolonepropionase or related amidohydrolase,1,0
285,"TRAP-type C4-dicarboxylate transport system, large permease component",2,1
286,"Uncharacterized conserved protein YkvS, DUF2187 family",0,1
287,Putative Mn2+ efflux pump MntP,0,1
288,Type IV pilus assembly protein PilE,1,0
289,ssDNA-specific exonuclease RecJ,1,2
290,Spore germination protein GerM,0,1
291,Ribosomal protein L2,0,1
292,Protein tyrosine/serine phosphatase Oca4,1,2
293,Thymidine kinase,0,1
294,"Phosphoglycerol transferase MdoB/OpgB, AlkP superfamily",0,1
295,"DNA-binding transcriptional regulator, MurR/RpiR family, contains HTH and SIS domains",0,1
296,Flagellar biosynthesis chaperone FliJ,1,0
297,"Predicted Zn-dependent protease, minimal metalloprotease (MMP)-like domain",2,0
298,Streptomycin 6-kinase,1,0
299,NAD-specific glutamate dehydrogenase,1,2
300,"Serine transporter YbeC, amino acid:H+ symporter family",1,1
301,"Protein/nucleotide deglycase, PfpI/YajL/DJ-1 family (repair of methylglyoxal-glycated proteins and nucleic acids)",2,0
302,"DNA repair protein RadA/Sms, contains AAA+ ATPase domain",0,1
303,"Predicted acetyltransferase, GNAT superfamily",1,0
304,"ABC-type transport system involved in Fe-S cluster assembly, permease and ATPase components",0,1
305,"Glucose/arabinose dehydrogenase, beta-propeller fold",0,0
306,"Uncharacterized membrane protein YqiK, contains Band7/PHB/SPFH domain",1,0
307,Archaeal histone H3/H4,2,0
308,tRNA G18 (ribose-2'-O)-methylase SpoU,0,1
309,NaMN:DMB phosphoribosyltransferase,1,1
310,tRNA(His) 5'-end guanylyltransferase,0,1
311,"mRNA-degrading endonuclease RelE, toxin component of the RelBE toxin-antitoxin system",0,2
312,ATPase/5’-3’ helicase helicase subunit RecD of the DNA repair enzyme RecBCD (exonuclease V),1,1
313,Flagellar hook-associated protein FlgK,0,3
314,Uncharacterized membrane protein YqhA,3,0
315,Thioredoxin reductase,0,1
316,Plastocyanin,0,4
317,"Predicted RNA methylase MTH1, SPOUT superfamily",0,1
318,"Uncharacterized conserved protein, DUF1465 domain",1,0
319,Predicted 2-oxoglutarate- and Fe(II)-dependent dioxygenase YbiX,0,2
320,Predicted transcriptional regulator YtfJ,0,3
321,"Flp pilus assembly ATPase CpaE/TadZ, contains N-terminal REC/TadZ_N domain",1,3
322,"Excinuclease UvrABC, nuclease subunit",0,3
323,Recombinational DNA repair protein RecR,1,2
324,"CTP-dependent cyclometallase, nickel-pincer nucleotide (NPN) cofactor biosynthesis",2,0
325,"Protein kinase association domain CaMKII_AD, NTF2-like superfamily",1,0
326,"Na+-translocating membrane potential-generating system subunit MpsC, DUF2294 family",0,1
327,Phage terminase large (ATPase) subunit and inactivated derivatives,1,0
328,"Lysylphosphatidylglycerol synthetase MprF, lysyl-tRNA-binding C-terminal domain",0,4
329,"Uncharacterized protein, contains DUF2185 domain",0,2
330,4-hydroxy-tetrahydrodipicolinate reductase,2,0
331,"Stalled ribosome rescue protein Dom34, pelota family",0,0
332,Multidrug efflux pump subunit AcrA (membrane-fusion protein),1,0
333,"General stress protein YciG, contains tandem KGG domains",0,4
334,Guanyl-specific ribonuclease Sa,0,1
335,"CYTH domain, found in class IV adenylate cyclase and various triphosphatases",0,4
336,"Uncharacterized conserved protein YlbG, UPF0298 family",4,2
337,"MinD superfamily P-loop ATPase, contains an inserted ferredoxin domain",1,3
338,"Limonene-1,2-epoxide hydrolase LimA/EphG",1,0
339,"Uncharacterized conserved protein, contains GYD domain",0,2
340,"Translation elongation factor EF-G, a GTPase",0,1
341,Uncharacterized membrane protein YjdF,1,0
342,"L-fucose mutarotase/ribose pyranase, RbsD/FucU family",0,1
343,Enoyl-[acyl-carrier-protein] reductase FabI,0,1
344,PduX protein involved in propanediol utilization and related proteins,0,2
345,Cell division protein FtsN,1,1
346,"RseA, negative regulator of sigma E activity",2,1
347,"Predicted aminopeptidase, Iap family",2,0
348,HrpA-like RNA helicase,1,2
349,Mannosyltransferase related to Gpi18,2,0
350,Ribose 5-phosphate isomerase RpiB,1,0
351,"Type IV pilus assembly protein, ATPase PilU",0,3
352,Replication-associated recombination protein RarA (DNA-dependent ATPase),2,0
353,Transaldolase/fructose-6-phosphate aldolase,0,2
354,N-terminal domain of the PTS fructose-specific IIB component,1,0
355,Archaeal S-adenosylmethionine synthetase,1,0
356,L-alanine-DL-glutamate epimerase or related enzyme of enolase superfamily,0,1
357,Putative flippase GtrA (transmembrane translocase of bactoprenol-linked glucose),1,0
358,"Two-component response regulator, YesN/AraC family, consists of REC and AraC-type DNA-binding domains",2,1
359,Aminoglycoside phosphotransferase,2,0
360,"Uncharacterized conserved protein, contains SnoaL-like domain",1,2
361,Phosphatidylserine synthase,1,1
362,"Riboflavin biosynthesis protein RibD, pyrimidine deaminase domain",0,1
363,Phenylalanine-4-hydroxylase,1,4
364,"DNAse/DNA nickase specific for phosphorothioated or glycosylated phage DNA, GmrSD/DndB/SspE family, contains DUF262 and HNH nuclease domains",1,2
365,"ABC-type taurine transport system, periplasmic component",1,3
366,Predicted Fe-S cluster biosynthesis protein YqkB,0,1
367,"ATP-dependent protease ClpP, protease subunit",1,1
368,"Type III secretory pathway, EscT/YscT component",1,0
369,Outer membrane lipoprotein SlyB,1,3
370,Polyisoprenoid-binding periplasmic protein YceI,0,2
371,Homoserine O-succinyltransferase,1,0
372,"Uncharacterized conserved protein, DUF4810 domain",1,0
373,Flagellum-specific peptidoglycan hydrolase FlgJ,1,0
374,Cyclic di-AMP receptor DarA/PstA,1,0
375,Thymidylate kinase,2,0
376,AICAR transformylase/IMP cyclohydrolase PurH,0,1
377,Phosphotransferase system cellobiose-specific component IIC,1,2
378,"Predicted metalloprotease, contains C-terminal PDZ domain",0,2
379,Predicted 3'-5' exonuclease related to the exonuclease domain of PolB,2,1
380,"Predicted kinase, contains AAA domain",1,0
381,3-methyladenine DNA glycosylase Mpg,0,2
382,"Glycyl-tRNA synthetase, beta subunit",1,0
383,Trehalose utilization protein,1,0
384,N6-adenosine-specific RNA methylase IME4,1,0
385,"Usg protein (tryptophan operon, function unknown)",1,0
386,GTPase-interacting Yip1 domain,0,1
387,Exoribonuclease R,0,1
388,"Uncharacterized conserved protein, DUF934 family",1,2
389,"Uncharacterized conserved protein, DUF2112 domain",0,1
390,Signal peptidase I,4,0
391,"ABC-type spermidine/putrescine transport system, permease component I",2,1
392,Cell division protein YtfB/OapA (opacity-associated protein A),0,1
393,"ABC-type cobalamin/Fe3+-siderophores transport system, ATPase component",2,0
394,Periplasmic subunit MlaC of the ABC-type intermembrane phospholipid transporter Mla,0,2
395,"Uncharacterized conserved protein Smg, DUF494 family",1,0
396,"DNA-directed RNA polymerase, subunit H, RpoH/RPB5",1,1
397,"Uncharacterized conserved protein YhaN, contains AAA domain",3,1
398,"ABC-type cobalamin transport system, permease component BtuC",0,1
399,"Transketolase, C-terminal subunit",0,1
400,"5-methylcytosine-specific restriction endonuclease McrBC, regulatory subunit McrC",2,0
401,"Pseudouridylate synthase RsuA, specific for 16S rRNA U516  and 23S rRNA U2605",0,1
402,High-affinity nickel/cobalt permease,0,1
403,tRNA A37 threonylcarbamoyladenosine synthetase subunit TsaC/SUA5/YrdC,1,2
404,"Phosphotransferase system, mannitol-specific IIBC component",2,2
405,Cytochrome c2,0,1
406,"Barstar, RNAse (barnase) inhibitor",0,1
407,"3'-5' exoribonuclease YhaM, can participate in 23S rRNA maturation,  HD superfamily",0,2
408,50S ribosomal subunit-associated GTPase HflX,4,1
409,"Patatin-like phospholipase/acyl hydrolase, includes sporulation protein CotR",1,1
410,Translation initiation factor IF-1,1,0
411,"Predicted RNase H-related nuclease YkuK, DUF458 family",0,1
412,Nitroreductase,0,3
413,"Uncharacterized conserved protein YfeS, contains WGR domain",1,1
414,Muconolactone delta-isomerase,0,3
415,3-hydroxyisobutyrate dehydrogenase or related beta-hydroxyacid dehydrogenase,0,1
416,"Na+-transporting NADH:ubiquinone oxidoreductase, subunit NqrB",2,1
417,"NurA-like predicted nuclease, RNAse H fold",1,0
418,"Pilus assembly protein, ATPase of CpaF family",2,1
419,Folylpolyglutamate synthase/Dihydropteroate synthase,1,1
420,"Uncharacterized membrane protein YeaQ/YmgE, transglycosylase-associated protein family",2,1
421,"Predicted  kinase, aminoglycoside phosphotransferase (APT) family",1,2
422,CDP-diglyceride synthetase,1,1
423,Heat shock protein HspQ,1,2
424,Orotate phosphoribosyltransferase homolog,1,1
425,Large exoprotein involved in heme utilization or adhesion,0,3
426,Membrane protein AmpE required for beta-lactamase induction,1,1
427,Acylphosphatase,2,0
428,L-aminopeptidase/D-esterase,2,0
429,"Predicted membrane-associated lipid hydrolase, neutral ceramidase superfamily",2,1
430,Membrane-bound inhibitor of C-type lysozyme,0,2
431,"Heterodisulfide reductase, subunit A (polyferredoxin)",1,1
432,"1,2-phenylacetyl-CoA epoxidase, catalytic subunit",1,0
433,"Uncharacterized conserved protein, YiaAB domain",0,3
434,Mitochondrial FoF1-type ATP synthase assembly chaperone ATP12,1,1
