,feature_name,cultured_feature_counts,uncultured_feature_counts
2335,"Predicted acetyltransferase, GNAT superfamily (YidJ) (PDB:1R57)",0,1
2336,Ribosomal protein S3 (RpsC) (PDB:1VS6),2,2
2337,"Uncharacterized membrane protein YcgQ,  UPF0703/DUF1980 family (YcgQ)",1,3
2338,Cell shape-determining protein MreD (MreD),0,2
2339,"TRAP-type uncharacterized transport system, fused permease components",0,1
2340,NADH:ubiquinone oxidoreductase subunit 11 or 4L (chain K) (NuoK) (PDB:4HE8),1,1
2341,Dipicolinate synthase subunit A (sporulation protein SpoVFA) (DpaA) (PDB:2RIR) (PUBMED:8098035;8345520),3,2
2342,Predicted dienelactone hydrolase,0,1
2343,"Type IV secretory pathway, TrbD component (TrbD)",0,2
2344,Histidine ammonia-lyase (HutH) (PDB:1B8F),2,0
2345,"Bacillopeptidase F, M6 metalloprotease family",0,2
2346,Holliday junction resolvasome RuvABC endonuclease subunit RuvC (RuvC) (PDB:1HJR),1,0
2347,Thioredoxin-related protein SoxW (SoxW) (PDB:4FYB),2,1
2348,Recombination-promoting DNA endonuclease RpnC/YadD (RpnC) (PUBMED:28096446),0,1
2349,Ribosomal protein L7/L12 (RplL) (PDB:1CTF),1,0
2350,3-dehydroquinate dehydratase (AroD) (PDB:1GQN),0,1
2351,Maltoporin (phage lambda and maltose receptor) (LamB) (PDB:1MPR),1,0
2352,"Phosphoaspartate phosphatase CheZ, dephosphorylates CheY~P (CheZ) (PDB:1KMI)",2,0
2353,Box C/D ribonucleoprotein Nop56/Prp31/SIK1 subunit (SIK1) (PDB:6ND4) (PUBMED:22496443),0,1
2354,Diadenosine tetraphosphatase YqeK or a related HD superfamily phosphohydrolase (YqeK) (PDB:2OGI) (PUBMED:32152217),1,2
2355,Beta-xylosidase (XynB) (PDB:1PX8),3,1
2356,"Uncharacterized conserved protein, contains restriction enzyme R protein N terminal (HSDR_N) domain",1,4
2357,tRNA G18 (ribose-2'-O)-methylase SpoU (SpoU) (PDB:1GZ0),1,2
2358,"Stage V sporulation protein SpoVS, predicted DNA-binding, AlbA superfamily (SpoVS) (PDB:2EH1) (PUBMED:7559352;18562273)",2,1
2359,"Uncharacterized conserved protein YihD, DUF1040 family (YihD) (PDB:2KO6)",2,1
2360,Cytochrome P450 (CypX) (PDB:3A4Z),0,3
2361,"TRAP-type C4-dicarboxylate transport system, small permease component YiaM (DctM)",1,0
2362,"Signal-transduction protein containing cAMP-binding, CBS, and nucleotidyltransferase domains",3,0
2363,TPR repeat (TPR) (PDB:1KLX),2,1
2364,Archaeal pantoate kinase (PDB:6JBC) (PUBMED:22865846),2,1
2365,"Uncharacterized conserved protein YfbU, UPF0304 family (YfbU) (PDB:1WPB)",0,1
2366,Poly-beta-hydroxyalkanoate depolymerase (DepA),1,1
2367,"Stalled ribosome rescue protein Dom34, pelota family (PelA) (PDB:2VGM)",1,1
2368,Lactate dehydrogenase or related 2-hydroxyacid dehydrogenase (LdhA) (PDB:1DXY),1,3
2369,"Outer membrane lipoprotein LpoB, binds and activates PBP1b (LpoB) (PDB:4Q6L)",0,1
2370,"Phosphotransferase system, mannose/fructose/N-acetylgalactosamine-specific IID component (ManZ) (PDB:6K1H)",1,0
2371,Acetyl esterase/lipase (Aes) (PDB:1EVQ),0,1
2372,"Uncharacterized conserved protein YbaP, TraB family (TraB)",0,2
2373,"Uncharacterized conserved protein YcfJ, contains glycine zipper 2TM domain (YcfJ)",1,1
2374,Alpha-L-arabinofuranosidase (AbfA) (PDB:1PZ2),1,0
2375,Predicted transcriptional regulator YtfJ (YtfJ),1,1
2376,"Uncharacterized conserved protein, DUF1178 domain",0,1
2377,Alpha-glucuronidase (AguA2) (PDB:1GQI),0,1
2378,"Thioredoxin/glutathione peroxidase BtuE, reduces lipid peroxides (BtuE) (PDB:2P5Q) (PUBMED:22931285)",0,2
2379,Spore coat protein CotO/YjbX (CotO) (PUBMED:16321932),1,0
2380,Acetyl-CoA carboxylase beta subunit (AccD) (PDB:2F9I),2,3
2381,"CRISPR-Cas system-associated protein Csm6, contains CARF domain (Csm6) (PDB:3QYF)",0,2
2382,"Uncharacterized conserved protein YfaQ, DUF2300 domain (YfaQ)",0,1
2383,Cytoplasmic chaperone NapD for the signal peptide of periplasmic nitrate reductase NapAB (NapD) (PDB:2JSX) (PUBMED:24314029),0,2
2384,"S-ribosylhomocysteine lyase LuxS, autoinducer biosynthesis (LuxS) (PDB:5E68)",4,0
2385,Phosphoglucomutase/phosphomannomutase (Pgm) (PDB:1C47) (PUBMED:30938049),1,2
2386,Mg2+/citrate symporter (CitM),2,0
2387,Archaeal S-adenosylmethionine synthetase (MetK2) (PDB:4HPV),0,1
2388,"Transketolase, C-terminal subunit (TktA2)",2,1
2389,"ABC-type enterochelin transport system, permease component (CeuB)",1,1
2390,Riboflavin transporter FmnP (FmnP) (PDB:3P5N),1,1
2391,2-hydroxy fatty acid dioxygenase MPO1 (alpha-oxidation of fatty acids) (MPO1) (PUBMED:30530523),1,0
2392,NADH:ubiquinone oxidoreductase subunit 6 (chain J) (NuoJ) (PDB:4HE8),0,1
2393,Copper-binding protein CopC (methionine-rich) (CopC) (PDB:1IX2),1,0
2394,Holliday junction resolvasome RuvABC DNA-binding subunit (RuvA) (PDB:1BDX),2,1
2395,Adenosine/AMP kinase (PDB:1RLH),1,2
2396,"Predicted metal-dependent hydrolase, phosphotriesterase family (Php) (PDB:1BF6)",3,0
2397,"DNA-directed RNA polymerase, alpha subunit/40 kD subunit (RpoA) (PDB:4KN7)",1,1
2398,Hydrogenase maturation factor HypD (HypD) (PDB:2Z1D),1,0
2399,Glycosyltransferase involved in cell wall bisynthesis (RfaB) (PDB:2IV7),1,1
2400,Predicted dinucleotide-binding enzyme (PDB:2VNS),0,1
2401,Glutamine phosphoribosylpyrophosphate amidotransferase (PurF) (PDB:1ECB),1,0
2402,Threonine synthase (ThrC) (PDB:1VB3),2,0
2403,"Uncharacterized conserved protein, DUF1285 family (PDB:2RA9)",1,1
2404,"PASTA domain, binds beta-lactams (PASTA)",1,2
2405,Chemotaxis signal transduction protein CheW (CheW) (PDB:2QDL),2,0
2406,"ABC-type enterobactin transport system, permease component (FepG)",0,2
2407,"DNA-binding response regulator, LytR/AlgR family (LytT) (PDB:3BS1)",1,0
2408,"Tetrahydromethanopterin S-methyltransferase, subunit C (MtrC)",3,0
2409,Formylmethanofuran dehydrogenase subunit C (FwdC) (PDB:5T5I),1,0
2410,"Predicted restriction endonuclease, Mrr-cat superfamily",1,0
2411,"Propanediol dehydratase, small subunit (PduE) (PDB:5YRT)",1,1
2412,Energy-converting hydrogenase Eha subunit B (EhaB) (PUBMED:19495416),1,1
2413,23S rRNA U2552 (ribose-2'-O)-methylase RlmE/FtsJ (RlmE) (PDB:1EIZ) (PUBMED:10769117),0,1
2414,Xylose isomerase (XylA) (PDB:1A0C),2,1
2415,DNA-binding winged helix-turn-helix (wHTH) domain (CadC1),2,1
2416,Surfactin synthase thioesterase subunit (GrsT) (PDB:6VAP),2,0
2417,"Uncharacterized conserved protein, DUF2247 domain",1,1
2418,"UTP pyrophosphatase, metal-dependent hydrolase family (YgjP) (PDB:4JIU) (PUBMED:27941785)",3,1
2419,"FoF1-type ATP synthase, gamma subunit (AtpG) (PDB:3OAA) (PUBMED:15326535)",0,1
2420,"ABC-type transport system involved in cytochrome bd biosynthesis, ATPase and permease components (CydD)",1,0
2421,Mannitol-1-phosphate/altronate dehydrogenases (MtlD) (PDB:1LJ8),1,2
2422,"Propanediol dehydratase, large subunit (PduC) (PDB:1DIO)",0,2
2423,3-deoxy-D-arabino-heptulosonate 7-phosphate (DAHP) synthase (AroG1) (PDB:6U8J),0,2
2424,Uncharacterized conserved protein YcfL (YcfL),2,1
2425,"Uncharacterized membrane protein YobD, UPF0266 family (YobD)",1,2
2426,"ABC-type guanosine uptake system NupNOPQ, permease component NupP (NupP) (PUBMED:21926227)",2,1
2427,Outer membrane receptor for Fe3+-dicitrate (FecA) (PDB:1KMP),0,1
2428,Ribosomal protein L20A (L18A) (RPL20A) (PDB:2JXT),0,1
2429,"Predicted membrane glycosyltransferase AF0583, Arch_YYY/DUF2298 family",1,1
2430,"Uncharacterized conserved protein, DUF962 domain",3,1
2431,UDP-N-acetylglucosamine pyrophosphorylase (QRI1) (PDB:1JV1),0,2
2432,"Type III secretory pathway, EscR/YscR component (EscR) (PDB:6R6B)",1,1
2433,"N-acetylglutamate synthase or related acetyltransferase, GNAT family (ArgA) (PDB:2R98)",0,1
2434,"c-di-AMP synthetase, contains DisA_N domain (DisA) (PDB:2FB5)",0,1
2435,"Uncharacterized conserved protein YfkK, UPF0435 family (YfkK)",1,0
2436,Predicted proteasome-type protease,1,1
2437,Uncharacterized conserved protein (PDB:4XGR),1,0
2438,Pterin-4a-carbinolamine dehydratase (PhhB) (PDB:1DCH),1,1
2439,"Uncharacterized conserved protein YqcC, DUF446 family (YqcC) (PDB:2HGK)",1,1
2440,"Uncharacterized conserved protein YhaN, contains AAA domain (YhaN)",0,2
2441,"Uncharacterized conserved protein, DUF1244 family (PDB:2O35)",1,1
2442,Pyridoxine 5'-phosphate synthase PdxJ (PdxJ) (PDB:1HO1),1,0
2443,"Uncharacterized conserved protein, DUF3820 family",1,1
2444,Ureidoglycine aminohydrolase (AllE) (PDB:1RC6) (PUBMED:19935661),1,0
2445,"Uncharacterized membrane protein AbrB, regulator of aidB expression (AbrB)",0,1
2446,"Pyridoxal 5'-phosphate homeostasis protein YggS, UPF0001 family (YggS) (PDB:3SY1) (PUBMED:26872910)",2,1
2447,"Predicted transcriptional regulator YdeE, contains AraC-type DNA-binding domain (YdeE)",0,1
2448,"Exosome complex RNA-binding protein Rrp4, contains S1 and KH domains (Rrp4) (PDB:2Z0S) (PUBMED:12496312)",0,1
2449,HrpA-like RNA helicase (HrpA) (PDB:5N8R),1,3
2450,Flagellar biosynthesis GTPase FlhF (FlhF) (PDB:3SYN),1,1
2451,Anaerobic ribonucleoside-triphosphate reductase (NrdD) (PDB:4COI),2,1
2452,"Predicted protein-disulfide isomerase, contains CxxC motif (PDB:5HFG) (PUBMED:24314029)",3,1
2453,"Phosphotransferase system, galactitol-specific IIB component (SgaB) (PDB:5GQS)",1,1
2454,"Iron-guanylylpyridinol (FeGP) cofactor biosynthesis protein, fibrillarin family (HcgG) (PUBMED:25882909)",1,0
2455,Flagellar hook-length control protein FliK (FliK) (PDB:2RRL),2,1
2456,"CRISPR-associated protein Csa3, CARF domain (Csa3) (PDB:2WTE) (PUBMED:21093452)",2,0
2457,"Predicted nucleic-acid-binding protein, contains Zn-ribbon domain",0,2
2458,"Uncharacterized conserved protein, Ntn-hydrolase superfamily (PDB:2IMH)",1,0
2459,"Uncharacterized conserved protein YjaG, DUF416 family (YjaG) (PDB:2Q9R)",0,1
2460,"Ethanolamine utilization protein EutJ, possible chaperonin (EutJ)",1,1
2461,Kynureninase (Bna5),1,1
2462,IMP dehydrogenase/GMP reductase (GuaB) (PDB:1B3O),0,3
2463,"20S proteasome, alpha and beta subunits (PRE1) (PDB:1FNT)",2,1
2464,"ABC-type phosphate/phosphonate transport system, ATPase component (PhnC)",1,1
2465,Glucose-6-phosphate 1-dehydrogenase (Zwf) (PDB:5B7W) (PUBMED:18950999),1,0
2466,"Transcriptional regulatory protein LevR, contains PRD, AAA+ and EIIA domains (LevR)",1,1
2467,Predicted ATPase of the ABC class (PDB:4YIX),1,0
2468,Cytochrome b subunit of the bc complex (QcrB/PetB) (PDB:1VF5),2,3
2469,Tetraheme cytochrome c subunit NapC of nitrate or TMAO reductase (NapC),0,2
2470,Predicted cation transporter,1,0
2471,Hemerythrin domain-containing protein,0,1
2472,"Predicted glycosyl hydrolase, alpha amylase family (PDB:4S1A)",2,1
2473,ATP-dependent helicase/DNAse subunit B (AddB) (PDB:3U44),1,2
2474,"FxsA protein affecting phage T7 exclusion by the F plasmid, UPF0716 family (FxsA)",1,1
2475,"Uncharacterized protein, contains DUF2185 domain",0,3
2476,Lysozyme family protein (ZliS) (PDB:2IKB),1,2
2477,Na+-NQR maturation protein NqrM (NqrM) (PUBMED:26644436),1,2
2478,tRNA A-37 threonylcarbamoyl transferase component Bud32 (Bud32) (PDB:2VWB),2,1
2479,"Citrate lyase, alpha subunit (CitF) (PDB:1XR4)",2,0
2480,Ribosomal protein L13 (RplM) (PDB:1VS6),1,0
2481,"Predicted esterase YcpF, UPF0227 family (YcfP) (PDB:4FLE)",2,1
2482,"Predicted metal-binding protein, contains CGGC domain (CGGC)",1,0
2483,GDP-D-mannose dehydratase (Gmd) (PDB:1DB3),0,1
2484,"Acetyl/propionyl-CoA carboxylase, alpha subunit (PccA) (PDB:3U9S)",1,0
2485,Predicted periplasmic protein,1,1
2486,Alkylated DNA repair dioxygenase AlkB (AlkB) (PDB:3KHC),3,0
2487,"Ethanolamine utilization protein EutT, cobalamin adenosyltransferase (EutT)",1,0
2488,"Succinate dehydrogenase flavin-adding protein, antitoxin component of the CptAB toxin-antitoxin module (SdhE) (PDB:1PUZ)",3,1
2489,Nicotinamide riboside transporter PnuC (PnuC) (PDB:4QTN),0,1
2490,"Predicted phage recombinase, RecA/RadA family",1,3
2491,Predicted type IV restriction endonuclease,0,1
2492,"Uncharacterized conserved protein, DUF2125 domain",2,2
2493,"Regulator of protease activity HflC, stomatin/prohibitin superfamily (HflC)",0,1
2494,"ABC-type polysaccharide/polyol phosphate transport system, ATPase component (TagH) (PDB:6JBH)",0,2
2495,"Usg protein (tryptophan operon, function unknown) (Usg)",0,2
2496,Ascorbate-specific PTS system IIC component UlaA (UlaA) (PDB:4RP8),0,4
2497,"Uncharacterized membrane protein YagU, involved in acid resistance, DUF1440 family (YagU)",2,1
2498,mRNA degradation ribonuclease J1/J2 (RnjA) (PDB:3T3N),2,0
2499,"Imelysin-like iron-regulated protein IrpA, duplicated M75 peptidase-like domain (IrpA2) (PUBMED:21799754)",1,1
2500,Large-conductance mechanosensitive channel (MscL) (PDB:2OAR),1,2
2501,"Predicted DNA-binding protein with PD1-like DNA-binding motif, PPC/DUF296 domain (AF0104) (PDB:2DT4)",1,1
2502,Molecular chaperone GrpE (heat shock protein HSP-70) (GrpE) (PDB:1DKG),1,1
2503,Histidyl-tRNA synthetase (HisS) (PDB:1KMM),1,1
2504,"Transposase and inactivated derivatives, IS30 family (Tra8)",2,0
2505,Uracil-DNA glycosylase (Udg4) (PDB:3IKB),1,2
2506,"ABC-type maltose transport system, permease component MalG (MalG) (PDB:2R6G)",1,1
2507,Phage-related minor tail protein,1,0
2508,Permease of the drug/metabolite transporter (DMT) superfamily (RhaT) (PDB:5I20),1,1
2509,"Uncharacterized conserved protein YrzB, UPF0473 family (YrzB)",2,0
2510,Outer membrane phospholipase A (PldA) (PDB:1FW2),1,0
2511,Soluble P-type ATPase,1,1
2512,Glutamate formiminotransferase (GluFT) (PDB:1QD1),1,1
2513,"Membrane-associated serine protease, rhomboid family (GlpG) (PDB:2IC8)",0,1
2514,"RNase adaptor protein RapZ for GlmZ sRNA degradation, contains a P-loop ATPase domain (RapZ) (PDB:5O5O) (PUBMED:23475961)",0,2
2515,Disulfide oxidoreductase YuzD (YuzD) (PDB:1XG8),1,1
2516,Plasmid maintenance system killer protein (HigB),0,1
2517,"Predicted DNA modification or repair protein, contains radical SAM and helix-hairpin-helix domains",0,1
2518,Lysine/ornithine N-monooxygenase (IucD) (PDB:3S5W),0,1
2519,Predicted dinucleotide-utilizing enzyme of the ThiF/HesA family,2,0
2520,Cytochrome c2 (Cyc7) (PDB:1YEA),1,1
2521,Thioredoxin reductase (TrxB) (PDB:3FBS),0,2
2522,Starvation-inducible outer membrane lipoprotein Slp (Slp),1,1
2523,CRISPR-Cas system type-II protein Cas9 (Cas9) (PDB:4OGC),1,1
2524,Outer membrane protein OmpA and related peptidoglycan-associated (lipo)proteins (OmpA) (PDB:1OAP),2,1
2525,Epoxyqueuosine reductase QueG (queuosine biosynthesis) (QueG) (PDB:5D08) (PUBMED:2150253),0,1
2526,Predicted exporter,1,0
2527,"Acetolactate synthase, small subunit (IlvH) (PDB:2F1F)",2,3
2528,"Uncharacterized conserved protein YccT, UPF0319 family (YccT)",1,0
2529,Asp/Glu/hydantoin racemase (Dcg1),1,0
2530,Phosphoserine aminotransferase (SerC) (PDB:1BJN),0,1
2531,Predicted metal-dependent enzyme of the double-stranded beta helix superfamily,1,1
2532,Class II terpene cyclase family protein AF1543 (AF1543),1,0
2533,"Sugar transferase involved in LPS biosynthesis (colanic, teichoic acid) (WcaJ) (PDB:5W7L)",1,1
2534,Formate-dependent phosphoribosylglycinamide formyltransferase (GAR transformylase) (PurT) (PDB:1KJ8),1,0
2535,Phosphoribosyl-dephospho-CoA transferase (holo-ACP synthetase) (CitX),0,1
2536,Amino acid permease (LysP),1,2
2537,Putative heme degradation protein (HemS) (PDB:1U9T),0,1
2538,Uncharacterized membrane protein YwzB (YwzB),0,1
2539,"DNA-binding protein SpoVG, cell septation regulator (SpoVG) (PDB:2I9X) (PUBMED:23818957)",0,1
2540,"Oxidoreductase (NAD-binding), involved in siderophore biosynthesis (PchG) (PDB:4GMG)",0,1
2541,"Regulator of phage lambda lysogenization HflD, binds to CII and stimulates its degradation (HflD) (PDB:1QZ4)",2,1
2542,"L-cystine transporter TcyP, sodium:dicarboxylate symporter family (TcyP)",0,1
2543,"ABC-type iron transporter FetAB, ATPase component (FetA)",2,0
2544,"Periplasmic serine protease, S1-C subfamily, contain C-terminal PDZ domain (DegQ) (PDB:2HGA) (PUBMED:29686141)",1,0
2545,Flagellar basal body P-ring protein FlgI (FlgI),2,2
2546,"5,10-methenyltetrahydromethanopterin hydrogenase (Mth) (PDB:2B0J)",0,1
2547,3-methyladenine DNA glycosylase Tag (Tag) (PDB:1LMZ),0,1
2548,"Uncharacterized conserved protein, DUF2304 domain",2,0
2549,"Mg-protoporphyrin IX monomethyl ester cyclase BchE, aerobic (=Ycf59) (Ycf59) (PUBMED:21388705)",1,1
2550,"Pyruvate:ferredoxin oxidoreductase or related 2-oxoacid:ferredoxin oxidoreductase, beta subunit (PorB) (PDB:1B0P)",1,1
2551,"ABC-type phosphate/phosphonate transport system, periplasmic component (PhnD) (PDB:3S4U)",2,0
2552,Uncharacterized membrane protein YhdT (YhdT),1,1
2553,Na+/glutamate symporter (GltS),2,1
2554,"Uncharacterized conserved protein YktA, UPF0223 family (YktA) (PDB:2OY9)",0,1
2555,VanZ-like family protein (function unknown) (VanZ),1,0
2556,"Mannose or cellobiose epimerase, N-acyl-D-glucosamine 2-epimerase family (YihS) (PDB:2ZBL)",2,0
2557,Thermostable 8-oxoguanine DNA glycosylase (ENDO3c) (PDB:3FHF),1,1
2558,"2-oxoglutarate dehydrogenase complex, dehydrogenase (E1) component, and related enzymes (SucA) (PDB:2JGD)",1,0
2559,"Zn/Ni/Co-binding GTPase YjiA, predicted metallochaperone, CobW/Nha3/YciC family (YjiA) (PUBMED:24449932)",0,1
2560,Nitrogen regulatory protein PII (GlnK) (PDB:2GW8) (PUBMED:24610711),1,0
2561,"Stereoselective (R,S)-S-adenosylmethionine hydrolase (adenosine-forming) (PDB:2F4N) (PUBMED:32776704)",1,0
2562,Lysozyme inhibitor LprI (LprI) (PUBMED:18369469;26589796),1,2
2563,Flavorubredoxin (NorV) (PDB:4JHC),1,1
2564,Kynurenine formamidase (PDB:1R61),1,0
2565,"GTP 3',8-cyclase (molybdenum cofactor biosynthesis protein MoaA) (MoaA) (PDB:1TV7)",0,1
2566,Spermidine/putrescine-binding periplasmic protein (PotD) (PDB:1POT),1,0
2567,"Zinc metallochaperone YeiR/ZagA and related GTPases, G3E family (YejR) (PDB:1NIJ) (PUBMED:19822009;31132310)",1,0
2568,"Predicted transcriptional regulator, contains CW (cell wall-binding) repeats and an HTH domain",0,1
2569,"ABC-type microcin C transport system, permease component YejB (YejB) (PUBMED:17873039)",1,1
2570,"CRISPR-Cas system type III CSM-effector complex subunit Csm5, RAMP superfamily Cas7 group (Csm5)",1,4
2571,Dipeptidyl aminopeptidase/acylaminoacyl peptidase (DAP2) (PDB:2JBW),2,1
2572,"Uncharacterized conserved protein, DUF2184 domain",0,1
2573,Protein chain release factor PrfB (PrfB) (PDB:1GQE),2,2
2574,Ligand-binding SRPBCC domain (SRPBCC),0,1
2575,"Uncharacterized conserved protein YdcH, DUF465 family (YdcH) (PDB:1ZHC)",0,1
2576,"Zn-dependent peptidase ImmA, M78 family (ImmA) (PDB:3DTE)",0,1
2577,"VapC family ribonuclease, contains PIN domain (VapC) (PDB:4XGQ)",1,0
2578,"NAD(P)-dependent dehydrogenase, short-chain alcohol dehydrogenase family (FabG) (PDB:6L1H)",1,0
2579,Ribosome maturation factor RimP (RimP) (PDB:1IB8),2,0
2580,Predicted ferric reductase,2,2
2581,Pseudouridine-5'-phosphate glycosidase (pseudoU degradation) (PsuG) (PDB:1VKM) (PUBMED:18591240),0,1
2582,"Phage-related protein, predicted endonuclease",3,0
2583,Nitrogen fixation protein NifT (NifT),1,2
2584,tRNA A37 threonylcarbamoyladenosine synthetase subunit TsaC/SUA5/YrdC (TsaC) (PDB:1HRU),0,1
2585,Uncharacterized sporulation protein YtrI (YtrI),0,2
2586,"Ethanolamine utilization protein EutQ, cupin superfamily (function unknown) (EutQ) (PDB:2PYT)",1,0
2587,"Poly-gamma-glutamate biosynthesis protein CapA/YwtB (capsule formation), metallophosphatase superfamily (CapA)",0,1
2588,Glutathione S-transferase (GstA) (PDB:1A0F),1,1
2589,Flagellar biosynthesis protein FliR (FliR) (PDB:6S3R),2,0
2590,Ni/Fe-hydrogenase 2 integral membrane subunit HybB (HybB),0,1
2591,Putative Zn-dependent protease,0,1
2592,Transposase InsA (InsA),1,1
2593,"Outer membrane protein assembly factor BamB, contains PQQ-like beta-propeller repeat (PQQ) (PDB:6TJG)",0,1
2594,NCAIR mutase (PurE)-related protein,2,1
2595,Membrane-bound lytic murein transglycosylase B (MltB) (PDB:1D0K),1,0
2596,"Stage V sporulation protein SpoVAEB, subunit of dipicolinate uptake complex (SpoVAEB)",2,0
2597,Predicted acyl esterase (PDB:1JU3),0,1
2598,"Predicted RNA repair component, a phosphatase of H2Macro superfamily, DUF2263 family (PDB:5ZDA)",1,3
2599,sRNA-binding regulator protein Hfq (Hfq) (PDB:1HK9),1,1
2600,"Pyrrolysine biosynthesis ligase PylC and related enzymes, ATP-grasp superfamily (PylC) (PUBMED:22985965)",0,1
2601,"Uncharacterized conserved protein YjbJ, UPF0337 family (yjbJ) (PDB:1RYK)",2,1
2602,"Uncharacterized conserved protein, DUF3299 family (PDB:4HSP) (PUBMED:21378183)",0,1
2603,Superfamily II RNA helicase (Dob10) (PDB:4A4Z),1,1
2604,"Spore germination receptor GerABC, GerA subunit (L-alanine receptor) (GerAA)",1,1
2605,"Uncharacterized conserved protein, DUF763 domain",1,1
2606,Galactokinase (GalK) (PDB:1PIE),1,1
2607,"DNA-binding transcriptional regulator YhcF, GntR family (YhcF) (PDB:4R1H)",2,1
2608,"Uncharacterized conserved protein YoaH, UPF0181 family (yoaH) (PUBMED:20729861;23239623;22706199)",0,2
2609,Peptidyl-tRNA hydrolase (Pth2) (PDB:1Q7S),0,2
2610,Ribosomal protein L32 (RpmF) (PDB:1VS6) (PUBMED:17114934),1,2
2611,Preprotein translocase subunit SecG (Sec61beta) (SBH1),0,1
2612,Nicotinamide riboside kinase (NadR3) (PDB:1LW7),1,1
2613,Ribosomal protein S16 (RpsP) (PDB:4V4H),0,1
2614,"ATP-dependent helicase YprA,  contains C-terminal metal-binding DUF1998 domain (YprA)",2,1
2615,"Type VI protein secretion system component TssA1/VasJ/EvfE, contains ImpA_N domain (TssA1) (PDB:6RIU)",1,0
2616,"Uncharacterized conserved protein YpbB, contains C-terminal HTH domain (YpbB)",2,1
2617,"Cell division protein DamX, binds to the septal ring, contains C-terminal SPOR domain (DamX)",1,2
2618,"Type I restriction-modification system, DNA methylase subunit (HsdM) (PDB:2AR0) (PUBMED:26872910)",1,1
2619,"Invasion protein IalB, involved in pathogenesis (IalB) (PDB:3DTD)",2,0
2620,"rRNA maturation protein Rpf1, contains Brix/IMP4 (anticodon-binding) domain (IMP4) (PDB:5O9E) (PUBMED:15654320)",2,0
2621,"ABC-type polar amino acid transport system, ATPase component (GlnQ) (PDB:4YMS)",0,1
2622,Uncharacterized membrane protein YeiB (YeiB),0,2
2623,Lipoate synthase (LipA) (PDB:4U0O) (PUBMED:27941785),0,1
2624,Glyceraldehyde-3-phosphate dehydrogenase/erythrose-4-phosphate dehydrogenase (GapA) (PDB:3ZDF),2,2
2625,"C-terminal processing protease CtpA/Prc, contains a PDZ domain (CtpA) (PDB:6IQU)",0,1
2626,Anthranilate/para-aminobenzoate synthase component II (glutamine amidotransferase) (PabA) (PDB:1I1Q),1,1
2627,"ATP-, maltotriose- and DNA-dependent transcriptional regulator MalT (MalT)",1,3
2628,Na+-translocating membrane ATPase (N-ATPase) assembly subunit AtpR (AtpR) (PUBMED:20472544),2,0
2629,"RNA-splicing ligase RtcB, repairs tRNA damage (RtcB) (PDB:1UC2)",1,3
2630,"Radical SAM superfamily maturase, SkfB/NifB/PqqE family (SkfB) (PDB:6Q2P) (PUBMED:23282011)",2,0
2631,"DNA polymerase III, gamma/tau subunits (DnaX) (PDB:1A5T)",1,1
2632,"Curved DNA-binding protein CbpA, contains a DnaJ-like domain (CbpA)",0,1
2633,"ABC-type glycerol-3-phosphate transport system, periplasmic component (UgpB) (PDB:2Z8D)",0,1
2634,"Uncharacterized membrane protein, DUF1361 domain",1,0
2635,Ribosome modulation factor (Rmf) (PDB:2JRM),2,3
2636,"5-chloro-2-hydroxyhydroquinone dehydrochlorinase TtfG, YCII superfamily (YCII) (PDB:1S7I) (PUBMED:23955343)",2,1
2637,Flagellar biosynthesis/type III secretory pathway chaperone FlgN (FlgN) (PDB:2FUP),2,1
2638,"Predicted RNA-binding protein Jag (SpoIIIJ-associated), conains KH and R3H domains (Jag) (PDB:3GKU)",1,0
2639,"Oligoribonuclease NrnA/c-di-AMP phosphodiesterase DhhP, DHH superfamily (DhhP) (PDB:6MTZ) (PUBMED:19553197)",1,0
2640,"Predicted methyltransferase, contains TPR repeat",0,2
2641,NADH dehydrogenase/NADH:ubiquinone oxidoreductase 75 kD subunit (chain G) (NuoG) (PDB:1C4A),2,0
2642,DNA repair exonuclease SbcCD nuclease subunit (SbcD) (PDB:6S85),1,2
2643,Predicted transcriptional regulator,1,2
2644,"Uncharacterized conserved protein, DUF849 family (PDB:3C6C)",1,1
2645,Aminoglycoside phosphotransferase (Aph) (PDB:1J7I),3,2
2646,"Uncharacterized conserved protein, DUF2075 family (BH3996) (PUBMED:15547281)",1,1
2647,"ABC-type uncharacterized transport system, ATPase component (YhaQ)",2,0
2648,Cytochrome c biogenesis protein ResB (ResB),2,2
2649,Alpha-D-ribose 1-methylphosphonate 5-triphosphate synthase subunit PhnL (PhnL),2,0
2650,"Type II secretory pathway, component PulF (PulF) (PDB:2VMA)",0,1
2651,"Putative GTP cyclohydrolase 1 type 2, NIF3 family (NIF3) (PDB:3SY1) (PUBMED:24435797;26385509)",1,1
2652,"DNA-binding protein, stimulates sugar fermentation (SfsA) (PDB:4DA2)",1,0
2653,"Uncharacterized conserved protein, DUF736 family",2,3
2654,Septum site-determining protein MinC (MinC) (PDB:1HF2),1,0
2655,"Thiazole synthase ThiGH, ThiG subunit (thiamin biosynthesis) (ThiG) (PDB:1TYG)",2,0
2656,GAF domain (GAF),1,1
2657,"Stage IV sporulation protein SpoIVFA, regulates SpoIVFB (SpoIVFA) (PUBMED:10464210;11959848)",1,0
2658,"ABC-type nitrate/sulfonate/bicarbonate transport system, permease component (TauC)",1,1
2659,"Glucosamine 6-phosphate synthetase, contains amidotransferase and phosphosugar isomerase domains (GlmS) (PDB:2J6H)",0,1
2660,Nicotinamide mononucleotide adenylyltransferase (NadR) (PDB:1LW7),2,1
2661,Spore germination protein GerPA/GerPF (inner spore coat) (GerPA) (PUBMED:10715007),1,1
2662,DNA recombination-dependent growth factor RdgC (RdgC) (PDB:2OWL),1,1
2663,Fe2+ transport protein FeoA (FeoA) (PDB:2GCX),0,1
2664,Antibiotic biosynthesis monooxygenase (ABM) superfamily enzyme,1,1
2665,Superfamily II DNA helicase RecQ (RecQ) (PDB:1OYW),1,1
2666,"Type II secretory pathway, PulJ/GspJ component (PulJ)",1,0
2667,Type IV pilus assembly protein PilX (PilX),0,1
2668,Peroxiredoxin (Bcp) (PDB:5IPH),2,2
2669,"Ni,Fe-hydrogenase III component G (HycE1)",1,0
2670,Cell division ATPase FtsE (FtsE),1,0
2671,Uncharacterized conserved protein (PDB:2HWJ),1,0
2672,"5-Methylthioribose/5-deoxyribose kinase, methionine salvage pathway (MthN) (PDB:2OLC) (PUBMED:31950558)",1,1
2673,"Tetrahydromethanopterin S-methyltransferase, subunit F (MtrF) (PUBMED:16647082)",1,0
2674,"Predicted DNA-binding protein MJ1475, contains C-terminal HTH domain (MJ1475)",0,1
2675,CO dehydrogenase/acetyl-CoA synthase alpha subunit (CdhA) (PDB:3CF4),1,0
