,feature_name,cultured_feature_counts,uncultured_feature_counts
1336,Type IV pilus assembly protein FimT (FimT) (PUBMED:17322192;28771515),2,0
1337,RNA recognition motif (RRM) domain (RRM) (PDB:1HL6),2,1
1338,"DNA-nicking endonuclease, Smr domain (SmrA) (PDB:3QD7) (PUBMED:12730195)",3,1
1339,Predicted glycosyl transferase,1,0
1340,"Uncharacterized conserved protein, DUF1430 domain",0,1
1341,"Zn-dependent peptidase, M16 (insulinase) family (Cym1) (PDB:2FGE)",1,0
1342,"Uncharacterized membrane protein YqaA, VTT domain (YgaA)",1,0
1343,Signal transduction histidine kinase (PDB:2QHK),2,0
1344,Predicted alpha/beta hydrolase,2,1
1345,Uncharacterized N-terminal coiled-coil domain of peptidoglycan hydrolase CwlO (CwlO1) (PDB:4CGK),1,1
1346,Spore coat protein CotF (CotF),2,1
1347,"Predicted acylesterase/phospholipase RssA, containd patatin domain (RssA) (PDB:5FQU)",0,2
1348,D-aminopeptidase (DppA) (PDB:1HI9),0,1
1349,Uncharacterized conserved protein Alr0986 (PUBMED:17567742),0,1
1350,"Homogentisate 1,2-dioxygenase (HmgA) (PDB:1EY2)",1,0
1351,"Iron-guanylylpyridinol (FeGP) cofactor biosynthesis protein HcgB, guanylyltransferase (HcgB) (PDB:3BRC) (PUBMED:25882909)",0,3
1352,Translation initiation factor IF-1 (InfA) (PDB:5FIM),1,0
1353,"Nitrite/polysulfide reductase, membrane component NrfD/PsrC (NrfD) (PUBMED:11856339;22040142)",0,3
1354,"N-methylhydantoinase A/oxoprolinase/acetone carboxylase, beta subunit (HyuA)",1,0
1355,"Predicted ABC-type transport system involved in lysophospholipase L1 biosynthesis, permease component (YbbP)",1,0
1356,"CRISPR/Cas system-associated protein Cas5, RAMP superfamily (Cas5)",2,2
1357,Prophage maintenance system killer protein (Doc),1,0
1358,"RNA interferase (RNase) VapC, contains PIN domain (VapC) (PDB:1V8O) (PUBMED:22539524)",1,1
1359,NAD/NADP transhydrogenase alpha subunit (PntA) (PDB:1F8G),2,0
1360,"DNA primase, phage- or plasmid-associated",1,1
1361,"D-alanyl-lipoteichoic acid acyltransferase DltB, MBOAT superfamily (DltB) (PDB:6BUG)",0,1
1362,Predicted enzyme of the cupin superfamily (PDB:1LKN),0,1
1363,"Uncharacterized protein, contains predicted SAM-dependent methyltransferase domain (PDB:4PIM)",2,1
1364,Glutamyl- or glutaminyl-tRNA synthetase (GlnS) (PDB:1EUQ),2,0
1365,Na+/proline symporter (PutP) (PDB:5NVA),0,1
1366,"Uncharacterized conserved protein YpiB, UPF0302 family (YpiB)",2,1
1367,"Dessication stress tolerance protein, LEA/WHy domain (LEA) (PUBMED:15598830;29802195)",1,1
1368,"Predicted phosphohydrolase, protein tyrosine phosphatase (PTP) superfamily, DUF442 family (PDB:2F46)",0,2
1369,"Uncharacterized conserved protein, DUF2000 domain (PDB:2GAX)",0,1
1370,Molybdopterin biosynthesis enzyme MoaB/MogA (MoaB) (PDB:1DI6) (PUBMED:32239579),0,1
1371,Predicted secreted endonuclease distantly related to archaeal Holliday junction resolvase,2,1
1372,dGTP triphosphohydrolase (Dgt) (PDB:6OI7),3,1
1373,Ribonuclease HII (RnhB) (PDB:1EKE),2,0
1374,"DNA-binding transcriptional regulator, FadR family (FadR) (PDB:1E2X)",1,1
1375,"CRISPR-Cas system type III CMR-effector complex subunit Cmr3, RAMP superfamily Cas5 group (Cmr3)",2,0
1376,Isopentenyl phosphate kinase (PDB:3LKK) (PUBMED:16621811),0,2
1377,"Type II secretory pathway, component PulL (PulL) (PDB:2W7V) (PUBMED:11679764)",2,0
1378,"Cell division protein FtsL, interacts with FtsB and FtsQ (FtsL)",0,1
1379,Ribosomal protein S9 (RpsI) (PDB:4V4H),4,0
1380,Secreted protein containing C-terminal beta-propeller domain distantly related to WD-40 repeats,0,1
1381,Chaperonin GroEL (HSP60 family) (GroEL) (PDB:1AON),0,1
1382,Translation initiation factor IF-3 (InfC) (PDB:2IFE),2,1
1383,"Uncharacterized conserved protein, DUF447 domain (PDB:2IML)",0,1
1384,"Type II secretory pathway, component PulC (PulC) (PDB:2LNV)",3,1
1385,Amino acid permease (SdaC),1,0
1386,"Sulfatase maturation enzyme AslB, radical SAM superfamily (AslB) (PDB:4K37)",1,0
1387,"ABC-type tungstate transport system, periplasmic component (TupA)",2,0
1388,"Translation initiation factor RLI1, contains Fe-S and AAA+ ATPase domains (Rli1) (PDB:3J16)",0,1
1389,"Stage VI sporulation protein SpoVID (LysM domain), required for assembly of the spore coat (SpoVID) (PUBMED:8449878)",2,3
1390,Cytidylyltransferase family enzyme (PUBMED:25583072),1,0
1391,"Uncharacterized protein, contains NAD-binding domain and a Fe-S cluster (PDB:5MOG)",0,2
1392,Transposase and inactivated derivatives (PUBMED:22399070),2,1
1393,Alpha-D-ribose 1-methylphosphonate 5-triphosphate synthase subunit PhnI (PhnI),2,0
1394,Cell division septal protein FtsQ (FtsQ) (PDB:1YR1),2,1
1395,Aspartyl/asparaginyl-tRNA synthetase (AsnS) (PDB:3KFU),2,0
1396,"Uncharacterized conserved protein YpbQ, isoprenylcysteine carboxyl methyltransferase (ICMT) family (YpbQ)",1,2
1397,"Uncharacterized membrane protein, DUF2243 domain",1,1
1398,"Glycine cleavage system protein P (pyridoxal-binding), C-terminal domain (GcvP2) (PDB:4LGL)",2,1
1399,Cystathionine beta-lyase/cystathionine gamma-synthase (MetC) (PDB:1CL1),0,1
1400,Mitochondrial DNA-directed RNA polymerase (RPO41),1,1
1401,"NTP pyrophosphatase, house-cleaning of non-canonical NTPs (MazG) (PDB:1VMG)",0,1
1402,"Regulator of sirC expression, contains transglutaminase-like and TPR domains (SirB1)",3,1
1403,"Predicted Zn-dependent peptidase, M16 family (PqqL) (PDB:6OFS)",1,0
1404,N-acetylglutamate kinase (ArgB) (PDB:3S6G),0,1
1405,Transcriptional regulator of heat shock response (HrcA) (PDB:1STZ),1,0
1406,"Spore coat protein CotJA, required for the assembly of CotJC (CotJA) (PUBMED:7768848)",2,0
1407,"Predicted component of the type VI protein secretion system, contains a FHA domain (PDB:1DMZ) (PUBMED:16698547)",1,0
1408,Chromate resistance protein ChrB1 (ChrB1),1,1
1409,"Uncharacterized conserved protein MJ0802, methanogenesis marker protein 17, contains DUF2113 domain",1,2
1410,"Chitooligosaccharide deacetylase ChbG, YdjC/CelG family (ChbG) (PDB:2I5I) (PUBMED:18177738;22797760)",2,1
1411,"RNA 2',3'-cyclic phosphodiesterase (2'-5' RNA ligase) (ThpR) (PDB:1IUH) (PUBMED:25239919)",0,1
1412,Phosphopantetheinyl transferase (Sfp) (PDB:1QR0),3,0
1413,Cysteine synthase (CysK) (PDB:1FCJ),0,1
1414,Threonine/homoserine/homoserine lactone efflux protein (RhtB),3,1
1415,"ABC-type anion transport system, duplicated permease component",0,1
1416,"DNA-binding transcriptional regulator YdaS, prophage-encoded, Cro superfamily (YdaS)",1,1
1417,"Uncharacterized secreted protein, contains LVIVD repeats, choice-of-anchor domain",0,1
1418,"5S rRNA maturation ribonuclease M5, contains TOPRIM domain (RnmV) (PDB:2FCJ)",1,3
1419,GTP cyclohydrolase II (RibA) (PDB:2BZ0),0,1
1420,"Phosphoglycerol transferase MdoB/OpgB, AlkP superfamily (MdoB) (PDB:3LXQ)",1,1
1421,UDP-3-O-[3-hydroxymyristoyl] glucosamine N-acyltransferase (LpxD) (PDB:6P83),1,1
1422,"Uncharacterized conserved protein, contains ferredoxin domain",2,0
1423,MoxR-like ATPase (MoxR) (PDB:2R44),1,0
1424,tRNA-Met C34-N4-acetylcytidine synthase TmcAL (TmcAL) (PDB:5Y0T) (PUBMED:30150682),1,1
1425,"DNA-directed RNA polymerase specialized sigma subunit, sigma24 family (RpoE) (PDB:2Q1Z)",0,1
1426,Flagellar basal body L-ring protein FlgH (FlgH),1,2
1427,Glycerol-3-phosphate O-acyltransferase (PlsB),2,1
1428,"DNA-binding response regulator, FixJ family, consists of REC and HTH domains (FixJ) (PDB:1YIO)",0,3
1429,Glutamate synthase domain 1 (GltB1) (PDB:1EA0),0,3
1430,Flagellar biosynthesis/type III secretory pathway ATPase FliI (FliI) (PDB:5B0O),1,1
1431,Uncharacterized sporulation protein YunB (YunB) (PUBMED:12662922),1,1
1432,Translation initiation factor 1 (eIF-1/SUI1) (SUI1) (PDB:1D1R),0,2
1433,Phosphatidylglycerophosphate synthase (PgsA) (PDB:4MND),0,1
1434,Cell shape-determining protein MreC (MreC) (PDB:2J5U),0,1
1435,Siderophore synthetase component IucA/IucC/SbnC (IucA) (PDB:2W02) (PUBMED:19775248),0,1
1436,"Nitric oxide synthase, oxygenase domain (PDB:4D3V)",1,2
1437,RecB family exonuclease (Slr0479),0,1
1438,"Beta-phosphoglucomutase, HAD superfamily (YcjU) (PDB:3E58) (PUBMED:29684280)",2,0
1439,Signal transduction protein containing GAF and PtsI domains (PtsP),1,1
1440,Low temperature requirement protein LtrA (function unknown) (LtrA) (PUBMED:8534098;24422886),0,1
1441,Acetaldehyde dehydrogenase (acetylating) (MhpF) (PDB:4JN6),0,1
1442,Septation ring formation regulator EzrA (EzrA) (PDB:4UXV),1,0
1443,Membrane protein TolA involved in colicin uptake (TolA) (PDB:1S62),2,0
1444,Ribosomal protein S18 acetylase RimI and related acetyltransferases (RimI) (PDB:1GHE),1,1
1445,"Phage tail tape-measure protein, controls tail length (HI1514)",1,0
1446,"Archaeal aspartate aminotransferase or a related aminotransferase, includes purine catabolism protein PucG (PucG) (PDB:3NNK)",0,2
1447,NADH:ubiquinone oxidoreductase subunit 4 (chain M) (NuoM) (PDB:6HUM),1,2
1448,"Uncharacterized conserved protein Veg, DUF1021 family (PDB:3FB9)",2,0
1449,rRNA maturation endonuclease Nob1 (Nob1) (PDB:2CON),1,0
1450,16S rRNA C1402 (ribose-2'-O) methylase RsmI (RsmI) (PDB:3KWP) (PUBMED:24078611),0,2
1451,Dihydroneopterin aldolase (FolB) (PDB:1B9L),1,2
1452,Glutamate synthase domain 3 (GltB3) (PDB:1EA0),1,3
1453,"Uncharacterized conserved protein YfdQ, DUF2303 family (yfdQ)",0,1
1454,"Outer membrane protein VirK/YbjX involved in antimicrobial peptide resistance, DUF535 family (VirK)",0,1
1455,"Uncharacterized conserved protein, DUF1415 family",0,1
1456,Spore germination protease Gpr (Gpr) (PUBMED:1840582;8478323),0,1
1457,"Translation elongation factor EF-G, a GTPase (FusA) (PDB:1DAR)",3,0
1458,"Uncharacterized conserved protein, contains N-terminal Zn-finger domain",1,3
1459,"Sporulation sigma factor SigG (forespore-specific, SpoIIIG) (SigG) (PUBMED:25092033)",2,1
1460,N6-adenosine-specific RNA methylase IME4 (IME4) (PDB:5IL0),1,0
1461,Rod binding protein domain (FlgJ1),0,2
1462,tRNA A37 methylthiotransferase MiaB (MiaB) (PDB:4JC0) (PUBMED:17407324;20472640;20584901),2,0
1463,Uncharacterized integral membrane protein YrvD (YrvD) (PUBMED:16737961),0,1
1464,"Uncharacterized conserved protein YozE, UPF0346 family (YozE) (PDB:2FJ6)",1,0
1465,NADPH:quinone reductase or related Zn-dependent oxidoreductase (Qor) (PDB:2VCY),2,0
1466,Na+/H+-dicarboxylate symporter (GltP) (PDB:1XFH),1,0
1467,Phosphohistidine phosphatase SixA (SixA) (PDB:1UJB),3,0
1468,"16S rRNA C967 or C1407 C5-methylase, RsmB/RsmF family (RsmB) (PDB:2FRX)",1,0
1469,NAD-specific glutamate dehydrogenase (Gdh2),1,0
1470,Small acid-soluble spore protein SspH/YfjU (SspH) (PUBMED:9852018;10333516),2,0
1471,"Ethanolamine ammonia-lyase, large subunit (EutB) (PDB:3ABO)",0,1
1472,GTPase-interacting Yip1 domain (Yip1) (PUBMED:25702751;31417902),2,0
1473,"Uncharacterized conserved protein YloU, alkaline shock protein (Asp23) family (YloU)",0,2
1474,"Uncharacterized conserved protein YfcZ, UPF0381/DUF406 family (YfcZ) (PDB:2JZ5)",1,1
1475,S-adenosylhomocysteine hydrolase (SAM1) (PDB:1A7A),1,1
1476,CRISPR-Cas system type I-B effector complex large subunit Cas8b1 (Cas8b1),2,1
1477,RNA-binding protein YhbY (YhbY) (PDB:1JO0),1,1
1478,Dienelactone hydrolase (DLH) (PDB:4ZV9),0,1
1479,Nitrate reductase gamma subunit (NarI) (PDB:1Y5L),4,1
1480,Ornithine carbamoyltransferase (ArgF) (PDB:1A1S),0,1
1481,Methylglyoxal synthase (MgsA) (PDB:1S8A) (PUBMED:9665712),1,1
1482,DNA repair exonuclease SbcCD ATPase subunit (SbcC) (PDB:3QKR),0,1
1483,RecA-family ATPase (RepA),0,2
1484,Flagellar biosynthesis protein FliQ (FliQ) (PDB:6F2D),0,1
1485,"Predicted nuclease of restriction endonuclease-like (RecB) superfamily, implicated in nucleotide excision repair (PUBMED:15972856)",2,1
1486,Glutamate racemase (MurI) (PDB:1B73),1,1
1487,"Uncharacterized conserved protein, DUF2062 family",0,1
1488,"Excinuclease UvrABC, nuclease subunit (UvrC) (PDB:2NRT) (PUBMED:24513124)",0,2
1489,"Uncharacterized conserved protein, DUF1326 domain",0,1
1490,Soluble lytic murein transglycosylase or regulatory protein s ( may contain LysM/invasin domain) (MltE) (PDB:153L),1,1
1491,Transglutaminase (Tgl) (PDB:4PA5),1,0
1492,"Uncharacterized conserved protein, contains Extensin-like_C domain",1,0
1493,"Predicted metal-binding protein, contains two cysteine clusters, UPF0179 family (PUBMED:18675376)",1,0
1494,Anti-sigma regulatory factor (Ser/Thr protein kinase) (RsbW) (PDB:1TIL),0,1
1495,"Mannitol/fructose-specific phosphotransferase system, IIA domain (MtlA2) (PDB:1A3A)",1,0
1496,Signal transduction histidine kinase NtrY involved in nitrogen fixation and metabolism regulation (NtrY),1,1
1497,Fe-S cluster assembly iron-binding protein IscA (IscA) (PDB:1R94),2,1
1498,Carboxypeptidase C (cathepsin A) (Kex1) (PDB:1AC5),1,1
1499,"Xanthine/guanine/uracil/vitamin C permease GhxP/GhxQ, nucleobase:cation symporter 2 ( NCS2) family (NCS2) (PUBMED:24169576;24214977)",1,0
1500,Ribosomal protein L5 (RplE) (PDB:1VS6),1,1
1501,"Putative cell wall-binding domain (amidase enhancer), LytB superfamily (LytB) (PDB:5J6Q)",1,0
1502,Predicted ATPase,0,1
1503,"Uncharacterized conserved protein, UPF0280 family, ApbE superfamily (PDB:2O34)",0,1
1504,"DNA-binding protein, AcrR family, includes nucleoid occlusion protein SlmA (AcrR) (PDB:2QOP)",1,0
1505,Predicted component of the type VI protein secretion system (PDB:3RX9),0,1
1506,Cytidine deaminase (Cdd) (PDB:1AF2),1,0
1507,"Uncharacterized conserved protein, DUF2345 family (PDB:6SJL)",0,3
1508,Alpha-D-ribose 1-methylphosphonate 5-phosphate C-P lyase PhnJ (PhnJ) (PDB:4XB6),0,1
1509,"Uncharacterized conserved protein, DUF1476 domain (PUBMED:16468998)",2,1
1510,"Hydroxyethylthiazole kinase, sugar kinase family (ThiM) (PDB:1C3Q)",2,1
1511,Primosomal replication protein N'' (PriC) (PDB:2NCJ),0,1
1512,1-phosphofructokinase or 6-phosphofructokinase II (FruK) (PDB:2ABQ),1,0
1513,"Iron-sulfur cluster repair protein YtfE, RIC family, contains ScdAN and hemerythrin domains (RIC) (PDB:5FNN)",2,0
1514,Phosphoenolpyruvate carboxylase (Ppc) (PDB:1FIY),0,1
1515,"Stage IV sporulation protein SpoIVB, serine protease, degrades SpoIIQ, SpoIVFA (SpoIVB) (PUBMED:12940997;15292188)",2,2
1516,"Metal-dependent phosphatase/phosphodiesterase, HD supefamily",1,0
1517,Protein-S-isoprenylcysteine O-methyltransferase Ste14 (STE14) (PDB:5V7P),3,1
1518,D-alanyl-D-alanine carboxypeptidase (DacB) (PDB:1W5D),1,1
1519,Zn-dependent protease (includes sporulation protein SpoIVFB) (SpoIVFB) (PDB:3B4R),2,0
1520,Uncharacterized membrane protein YqjE (YqjE),1,1
1521,DNA-binding beta-propeller fold protein YncE (YncE) (PDB:3VGZ) (PUBMED:22120742;28628661),1,1
1522,"Uncharacterized conserved protein YpmB, contains C-terminal PepSY domain (YpmB) (PDB:2GU3)",2,0
1523,Phage tail sheath protein FI (PDB:3J9Q) (PUBMED:18586829),2,0
1524,"rRNA maturation protein Nop10, contains Zn-ribbon domain (Nop10) (PDB:1Y2Y)",1,2
1525,"Uncharacterized conserved protein, DUF4810 domain",1,2
1526,"ATP-dependent RNA circularization protein, DNA/RNA ligase (PAB1020)  family (PDB:2VUG) (PUBMED:18511537)",2,1
1527,Mevalonate pyrophosphate decarboxylase (MVD1) (PDB:1FI4),1,1
1528,"Integrase/recombinase, includes phage integrase (FimB)",2,3
1529,Fe-S-cluster-containing hydrogenase component 2 (HycB),1,0
1530,"Ni,Fe-hydrogenase III large subunit (HycE2) (PDB:6CFW)",0,1
1531,Pyridoxal 5'-phosphate synthase subunit PdxT (glutamine amidotransferase) (PdxT) (PDB:2NV0) (PUBMED:18801996;24083939),0,2
1532,DNA-binding transcriptional regulator ModE (molybdenum-dependent) (ModE) (PDB:1B9M) (PUBMED:19779461),1,0
1533,"Uncharacterized conserved protein YeeX, DUF496 family (YeeX)",0,1
1534,Abortive infection bacteriophage resistance protein (AbiF),0,1
1535,"Ribonuclease HI-related protein, contains viroplasmin and RNaseH domains (Rnh1) (PDB:1QHK)",2,0
1536,DNA primase (bacterial type) (DnaG) (PDB:3B39) (PUBMED:28128549),0,2
1537,"C-terminal domain of the GTP 3',8'-cyclase MoaA, radical SAM superfamily (molybdenum cofactor biosynthesis) (MoaA2) (PUBMED:25941396)",3,1
1538,Uncharacterized FlgJ-related protein (Bax),2,0
1539,Glutamine synthetase (GlnA) (PDB:1F1H),0,1
1540,"Uncharacterized conserved protein, DUF2112 domain",2,1
1541,"ABC-type uncharacterized transport system, permease component",1,0
1542,"Predicted ATP-dependent carboligase, ATP-grasp superfamily",1,2
1543,"Type III secretory pathway, EscT/YscT component (EscT) (PDB:6R6B)",0,2
1544,"Uncharacterized conserved protein YqgC, DUF456 family (YqgC)",2,2
1545,"L-aspartate dehydrogenase, NAD(P)-dependent (AspD) (PDB:1H2H) (PUBMED:12496312)",2,2
1546,Periplasmic component TolB of the Tol biopolymer transport system (TolB) (PDB:1C5K),0,2
1547,"Uncharacterized conserved protein CPn0794, contains PKD-like HAF repeats",0,1
1548,"Ras-like GTP-binding stress-induced protein YcjX,  DUF463 family (YcjX) (PDB:6NZ4) (PUBMED:31202886)",0,2
1549,"Exo-beta-1,3-glucanase,  GH17 family (Scw11)",2,2
1550,"ABC-type methionine transport system, permease component (MetP) (PDB:6CVL)",1,0
1551,PhoPQ-activated pathogenicity-related protein (PqaA),1,0
1552,"Uncharacterized conserved protein, contains SnoaL-like domain (SnoaL) (PDB:2K54)",1,0
1553,Repressor of nif and glnA expression (PDB:3NEK),1,0
1554,Cation (Ca2+/Na+/K+)/H+ antiporter ChaA (ChaA) (PDB:4KJS) (PUBMED:18801996),0,1
1555,Beta-ribofuranosylaminobenzene 5'-phosphate synthase (methanopterin biosynthesis) (bRFAP) (PDB:6YQQ) (PUBMED:16817932),1,1
1556,Predicted ABC-type ATPase or kinase,0,1
1557,"Fido, protein-threonine AMPylation domain (FIDO) (PDB:2F6S) (PUBMED:19503829)",1,0
1558,Fumarylacetoacetate (FAA) hydrolase family protein (PDB:2Q18),1,1
1559,Predicted phage phi-C31 gp36 major capsid-like protein (gp36),1,1
1560,6-pyruvoyl-tetrahydropterin synthase (QueD) (PDB:1B66) (PUBMED:14660578;17384645),0,1
1561,Trp operon repressor (TrpR) (PDB:1CO0),0,1
1562,Sporulation protein YabP (YabP) (PUBMED:11283287;15231775),0,1
1563,Primosomal protein N' (replication factor Y) - superfamily II helicase (PriA) (PDB:6DCR),4,0
1564,Uncharacterized membrane protein YeiH (YadS) (PDB:5WUC),1,1
1565,"Alpha-amylase/alpha-mannosidase, GH57 family (PDB:1K1W)",0,1
1566,Isoleucyl-tRNA synthetase (IleS) (PDB:1FFY),1,1
1567,Heat shock protein HspQ (HspQ) (PDB:5YCQ),1,2
1568,"Mn-dependent transcriptional regulator MntR, DtxR family (MntR) (PDB:1B1B)",1,0
1569,"1,4-dihydroxy-2-naphthoate polyprenyltransferase (MenA)",0,1
1570,"Uncharacterized membrane protein YqgA, affects biofilm formation (YqgA)",1,0
1571,"Delta-aminolevulinic acid dehydratase, porphobilinogen synthase (HemB) (PDB:1I8J)",2,0
1572,"2',3'-cyclic-nucleotide 2'-phosphodiesterase/5'- or 3'-nucleotidase, 5'-nucleotidase family (UshA) (PDB:1HO5)",0,1
1573,Proteasome assembly chaperone (PAC2) family protein (PDB:3VR0),1,1
1574,Peptidase E (PepE) (PDB:1FY2),0,2
1575,Aconitase B (AcnB) (PDB:1L5J),1,3
1576,Lipid II:glycine glycyltransferase (Peptidoglycan interpeptide bridge formation enzyme) (FmhB) (PDB:1LRZ),0,1
1577,"Riboflavin transporter RibN, EamA domain (RibN) (PUBMED:23935051)",1,3
1578,Phosphoribulokinase (PrkB) (PDB:1A7J),1,1
1579,"Formate/nitrite transporter FocA, FNT family (FocA) (PDB:3KCU)",1,1
1580,"Purine nucleoside phosphoramidase/Ap4A hydrolase, histidine triade (HIT) family (HinT) (PDB:1AV5) (PUBMED:20934431)",1,2
1581,"ABC-type sulfate transport system, periplasmic component (CysP)",0,2
1582,Type II secretory pathway ATPase component GspA/ExeA/MshM (ExeA) (PUBMED:21378198),0,1
1583,cAMP phosphodiesterase (PDE1) (PDB:4OJV),1,2
1584,"Periplasmic serine protease, ClpP class (SppA) (PDB:3BEZ)",1,1
1585,"DNA-binding transcriptional regulator, XRE-family HTH domain (XRE) (PDB:1UTX)",2,0
1586,"DNA-directed RNA polymerase, beta' subunit/160 kD subunit (RpoC) (PDB:1NT9)",1,0
1587,"Putative Ca2+/H+ antiporter, TMEM165/GDT1 family (Gdt1) (PUBMED:23569283)",2,0
1588,Lysophospholipase L1 or related esterase. Includes spore coat protein LipC/YcsK (TesA) (PDB:1BWP),1,2
1589,Carboxylesterase type B (PnbA) (PDB:1K4Y),1,1
1590,Divalent cation tolerance protein CutA (CutA1) (PDB:1NAQ),1,2
1591,"Uncharacterized conserved protein, contains TadX/Tad_C domain (TadX) (PUBMED:26686616)",1,2
1592,"Uncharacterized conserved protein YecM, predicted metalloenzyme (YecM) (PDB:1K4N) (PUBMED:12660999)",1,1
1593,tRNA-binding EMAP/Myf domain (EMAP) (PDB:1MKH),0,1
1594,Nitrogenase ATPase subunit NifH/coenzyme F430 biosynthesis subunit CfbC (NifH/CfbC) (PDB:1CP2) (PUBMED:28225763),1,0
1595,Disulfide bond formation protein DsbB (DsbB) (PDB:2LTQ),1,0
1596,"MFS family permease, includes anhydromuropeptide permease AmpG (ProP) (PUBMED:12426329)",0,2
1597,"Predicted anti-virus defense system component AQ645, contains DUF2357 and  PD-(D/E)xK nuclease domains (AQ645)",1,2
1598,Predicted hydrolase of the alpha/beta superfamily (YbbA) (PDB:3GFF),1,0
1599,"Uncharacterized conserved protein, DUF1919 family (PDB:2G6T)",2,0
1600,"Uncharacterized conserved protein YbgA, DUF1722 family (YbgA)",3,0
1601,Peptide chain release factor 1 (eRF1) (eRF1) (PDB:3E1Y),1,1
1602,Chromosome segregation and condensation protein ScpB (ScpB) (PDB:1T6S),2,2
1603,Urea transporter (Utp),0,2
1604,Superoxide dismutase (SodA) (PDB:1AP5),2,0
1605,Uncharacterized integral membrane protein,0,1
1606,REP element-mobilizing transposase RayT (RAYT) (PDB:4ER8),1,0
1607,G:T/U-mismatch repair DNA glycosylase (Mug) (PDB:1MTL),1,0
1608,L-arabinose isomerase (AraA) (PDB:2AJT),1,1
1609,Predicted transcriptional regulator (PDB:1R7J),0,1
1610,4-diphosphocytidyl-2C-methyl-D-erythritol kinase (IspE) (PDB:1OJ4),0,1
1611,Glutamine cyclotransferase (PDB:2FAW),1,1
1612,"Predicted nucleotide-binding protein, sugar kinase/HSP70/actin superfamily",1,0
1613,Predicted GTPase (YeeP),1,0
1614,"Uncharacterized protein, contains ACT and PBP-like DUF5612 domains, MJ1458 family (AF1403) (PDB:1Y7P)",0,2
1615,Malate synthase (AceB) (PDB:1D8C),2,0
1616,"TPP-dependent 2-oxoacid decarboxylase, includes indolepyruvate decarboxylase (PDC1) (PDB:1PYD)",1,0
1617,"Predicted acetyltransferase, GNAT superfamily",1,2
1618,"Translation initiation factor IF-2, a GTPase (InfB) (PDB:5ME0)",0,1
1619,"Predicted nuclease, contains PIN domain",3,2
1620,Uncharacterized coiled-coil protein SlyX (sensitive to lysis X) (SlyX) (PDB:3EFG),1,1
1621,"Zn-binding Pro-Ala-Ala-Arg (PAAR) domain, involved in Type VI secretion (PAAR) (PDB:4JIV)",0,1
1622,2-methylcitrate dehydratase PrpD (PrpD) (PDB:1SZQ),0,1
1623,Phosphotransferase system sorbitol-specific IIB component (SrlE),0,1
1624,L-rhamnose isomerase (PDB:3M0Y),0,2
1625,Polyisoprenoid-binding periplasmic protein YceI (YceI) (PDB:1WUB) (PUBMED:15741337;20236316),1,1
1626,"Uncharacterized membrane protein YoaK, UPF0700 family (YoaK)",1,3
1627,"Predicted RNA-binding protein YlqC, contains KH domain, UPF0109 family (YlqC)",0,1
1628,Adenine-specific DNA methylase,2,0
1629,"ACT domain-containing protein, UPF0735 family (PheB)",3,1
1630,"tRNA G26 N,N-dimethylase Trm1 (TRM1) (PDB:2DUL)",1,0
1631,Phage-related protein (PblB),2,0
1632,Cytochrome b561 (CybB) (PDB:5OC0),1,0
1633,"1,6-Anhydro-N-acetylmuramate kinase (AnmK) (PDB:3CQY) (PUBMED:15901686)",1,0
1634,NADP-dependent 3-hydroxy acid dehydrogenase YdfG (YdfG) (PDB:3P19),1,0
1635,"Heterodisulfide reductase, subunit B (HdrB) (PDB:5ODC)",2,0
1636,Ribosomal protein L37AE/L43A (RPL43A) (PDB:1JJ2),0,1
1637,Energy-converting hydrogenase Eha subunit F (EhaF) (PUBMED:19495416),1,1
1638,Phosphosulfolactate phosphohydrolase or related enzyme (ComB) (PDB:1VR0),2,0
1639,Predicted component of the type VI protein secretion system (PDB:6N38),1,1
1640,Methionyl-tRNA formyltransferase (Fmt) (PDB:1FMT),1,2
1641,Outer membrane lipoprotein-sorting protein (LolA) (PDB:1IWL),3,0
1642,"L,D-peptidoglycan transpeptidase YkuD, ErfK/YbiS/YcfS/YnhG family (PUBMED:16647082)",1,2
1643,Glutamate N-acetyltransferase (ornithine transacetylase) (ArgJ) (PDB:1VRA),0,1
1644,"Light-independent protochlorophyllide reductase subunit  B, BchB (= ChlB) (BchB) (PDB:2XDQ)",0,1
1645,"ABC-type branched-chain amino acid transport system, ATPase component LivF (LivF) (PDB:1JI0) (PUBMED:26527648;32250026)",2,1
1646,"ABC-type proline/glycine betaine transport system, periplasmic component (ProX) (PDB:1R9L)",1,1
1647,Sugar phosphate isomerase/epimerase (YcjR) (PDB:3KTC) (PUBMED:30742415),0,1
1648,Antitoxin component YwqK of the YwqJK toxin-antitoxin module (YwqK),1,2
1649,"HEPN domain protein, predicted toxin of MNT-HEPN system (HEPN) (PDB:1O3U) (PUBMED:26112399)",0,2
1650,"Uncharacterized conserved protein YifE, UPF0438 family (YifE)",0,2
1651,Prolipoprotein diacylglyceryltransferase (Lgt) (PDB:5AZB),1,1
1652,Methyl-accepting chemotaxis protein (MCP) (Tar) (PDB:1QU7),2,0
1653,"Heterodisulfide reductase, subunit A (polyferredoxin) (HdrA) (PDB:5ODC)",1,0
1654,5-keto 4-deoxyuronate isomerase (KduI) (PDB:1X8M),1,1
1655,"Uncharacterized conserved protein YaiI, UPF0178 family (YaiI)",1,1
1656,5'(3')-deoxyribonucleotidase (YorC) (PDB:1MH9),0,2
1657,Ribonuclease HIII (RnhC) (PDB:2D0A),2,2
1658,"ABC-type molybdate transport system, permease component ModB (ModB)",0,1
1659,Molybdenum cofactor biosynthesis enzyme MoaC (MoaC) (PDB:1EKR) (PUBMED:32239579),2,0
1660,"ABC-type sulfate transport system, permease component (CysU) (PDB:3D31)",1,1
1661,"Sulfur carrier protein TusA (tRNA thiolation, molybdenum cofactor biosynthesis) (TusA) (PDB:1DCJ) (PUBMED:23894086)",0,1
1662,"Predicted transcriptional regulator, contains C-terminal CBS domains",0,1
1663,Site-specific recombinase,1,2
1664,Uncharacterized sporulation protein YfkD (YfkD) (PUBMED:8969503;19543710),1,1
1665,"Uncharacterized conserved protein, DUF2236 family",0,1
1666,"RseB, negative regulator of sigma E activity (RseB) (PDB:2P4B)",1,1
1667,Periplasmic glucan biosynthesis protein OpgG (MdoG) (PDB:1TXK),1,1
1668,"Stage II sporulation protein SpoIIP, required for dissolution of the septal cell wall (SpoIIP)",0,1
1669,"ABC-type proline/glycine betaine transport system, ATPase component (ProV)",0,3
1670,CMP-2-keto-3-deoxyoctulosonic acid synthetase (KdsB) (PDB:1VH1),0,2
1671,"Predicted nucleotidyltransferase, MJ0604 family (MJ0604) (PDB:5YEP)",3,1
