,feature_name,cultured_feature_counts,uncultured_feature_counts
2004,Isocitrate lyase (AceA) (PDB:1DQU),6,2
2005,"Na+-translocating ferredoxin:NAD+ oxidoreductase RNF, RnfG subunit (RnfG)",7,0
2006,Sporulation sensor histidine kinase E (KinE) (PUBMED:11069677;11886552),8,0
2007,"Aspartyl/asparaginyl beta-hydroxylase, cupin superfamily (LpxO2)",5,0
2008,"ACT domain-containing protein, UPF0735 family (PheB)",5,1
2009,"Predicted lipid transporter YdfJ, MMPL/SSD domain, RND superfamily (YdfJ) (PUBMED:10694977;15941986)",8,0
2010,"Uncharacterized conserved protein YjdB, contains Ig-like domain (YjdB)",8,0
2011,"Antitoxin component HigA of the HigAB toxin-antitoxin module, contains an N-terminal HTH domain (HigA)",7,0
2012,"Archaea-specific RecJ-like exonuclease, contains DnaJ-type Zn finger domain (PDB:5YH1)",5,0
2013,Beta- N-acetylglucosaminidase (LytD) (PDB:6FXO),7,0
2014,Formylmethanofuran dehydrogenase subunit C (FwdC) (PDB:5T5I),7,0
2015,"Na+-translocating membrane potential-generating system subunit MpsC, DUF2294 family (MpsC) (PUBMED:25448817)",6,1
2016,"Pyruvate:ferredoxin oxidoreductase or related 2-oxoacid:ferredoxin oxidoreductase, beta subunit (PorB) (PDB:1B0P)",5,0
2017,Multidrug efflux pump subunit AcrB (AcrB) (PDB:1IWG),4,0
2018,"Uncharacterized conserved protein, DUF465 domain",8,0
2019,"Uncharacterized conserved protein, DUF1013 family",8,0
2020,Undecaprenyl pyrophosphate phosphatase (UppP) (PDB:5OON),7,0
2021,"CRISPR-Cas system endoribonuclease Cas6e, RAMP superfamily (Cas6e)",6,0
2022,"Uncharacterized conserved protein, DUF427 family (PDB:3DJM)",8,0
2023,"Predicted phosphohydrolase, protein tyrosine phosphatase (PTP) superfamily, DUF442 family (PDB:2F46)",8,0
2024,Flagellar hook-capping protein FlgD (FlgD) (PDB:6IEF),6,0
2025,DNA-binding ferritin-like protein (Dps family) (GINS) (PDB:2HH6),6,0
2026,"Uncharacterized membrane protein, YccA/Bax inhibitor family",8,0
2027,"ABC-type molybdate transport system, periplasmic Mo-binding protein ModA (ModA) (PDB:1AMF)",3,1
2028,"Na+-transporting oxaloacetate/methylmalonyl-CoA decarboxylase, gamma subunit (OadG)",7,0
2029,Uncharacterized Fe-S cluster protein YjdI (YjdI),6,0
2030,"Chromatin segregation and condensation protein Rec8/ScpA/Scc1, kleisin family (ScpA) (PDB:3W6J)",4,1
2031,High-affinity Fe2+/Pb2+ permease (FTR1),8,0
2032,"Uncharacterized conserved protein, contains TOPRIM domain, potential nuclease",7,0
2033,"Metal-binding trascriptional regulator, contains Fe-S cluster and ArsR family DNA binding domain",7,1
2034,Plastocyanin (PetE) (PDB:3BQV),7,0
2035,Small acid-soluble spore protein SspA/SspB/SspC/SspD (alpha/beta-type) (SspA/SspB/SspC/SspD) (PUBMED:3009398;9387221),8,0
2036,Outer membrane murein-binding lipoprotein Lpp (Lpp) (PDB:1EQ7),8,0
2037,"RNA-binding protein YlmH, contains S4-like domain (YlmH)",5,0
2038,Type IV pilus assembly protein PilV (PilV),6,0
2039,Uncharacterized sporulation protein YozQ,8,0
2040,"Pyrimidine reductase, riboflavin biosynthesis (RibD) (PDB:2O7P)",8,0
2041,Leucine-rich repeat (LRR) protein (LRR) (PDB:4OW2),5,0
2042,16S rRNA A1518 and A1519 N6-dimethyltransferase RsmA/KsgA/DIM1 (may also have DNA glycosylase/AP lyase activity) (RsmA) (PDB:1QYR),6,0
2043,Primosomal replication protein N'' (PriC) (PDB:2NCJ),6,1
2044,Predicted Fe-S cluster biosynthesis protein YqkB (YqkB),6,0
2045,Adenine deaminase (AdeC) (PDB:3NQB),8,0
2046,"Predicted antitoxin, contains HTH domain",6,0
2047,"Predicted RNA-binding protein, contains C-terminal EMAP domain (PDB:2E8G) (PUBMED:17114934)",7,0
2048,Spore coat protein CotV/CotX (outer spore coat) (CotV) (PUBMED:8509331),4,0
2049,"Zn-binding Pro-Ala-Ala-Arg (PAAR) domain, involved in Type VI secretion (PAAR) (PDB:4JIV)",3,0
2050,"Spore cortex hydrolase SleL/YaaH, N-acetylglucosaminidase of GH18 family (SleL) (PDB:4S3J)",8,0
2051,Predicted kinase (PDB:4GP6),8,0
2052,Seryl-tRNA synthetase (SerS) (PDB:1SER),6,1
2053,"Stage V sporulation protein SpoVAB, subunit of dipicolinate uptake complex (SpoVAB)",7,0
2054,"Chitooligosaccharide deacetylase ChbG, YdjC/CelG family (ChbG) (PDB:2I5I) (PUBMED:18177738;22797760)",8,0
2055,"RseA, negative regulator of sigma E activity (RseA) (PDB:1OR7)",8,0
2056,"ABC-type transport system involved in cytochrome c biogenesis, permease component (CcmB)",7,0
2057,"ABC-type dipeptide/oligopeptide/nickel transport system, ATPase component (DppD) (PDB:4FWI)",8,0
2058,Transcriptional accessory protein Tex/SPT6 (Tex) (PDB:2OCE),7,0
2059,Putative heme iron utilization protein (HugX) (PDB:2HQV),5,1
2060,Uncharacterized lipoprotein YajG (YajG),6,1
2061,"Spore coat protein YsxE, aminoglycoside phosphotransferase family (YsxE) (PUBMED:8449878)",5,0
2062,Glycerol kinase (GlpK) (PDB:2ZF5),8,0
2063,Cytochrome c-type biogenesis protein CcmH/NrfF (NrfF) (PDB:2HL7),5,0
2064,Maltose-binding periplasmic protein MalE (MalE) (PDB:1T0K),8,0
2065,Phosphatidylglycerophosphate synthase (PgsA) (PDB:4MND),4,0
2066,"Uncharacterized membrane protein YadS, UPF0324 family (YeiH)",5,1
2067,Type IV pilus biogenesis protein CpaD/CtpE (CpaD) (PUBMED:10880436),5,1
2068,Pullulanase/glycogen debranching enzyme (PulA) (PDB:2WSK),8,0
2069,Phosphoribosyl-dephospho-CoA transferase (holo-ACP synthetase) (CitX),5,2
2070,Signal recognition particle GTPase (Ffh) (PDB:2V3C),8,0
2071,Na+/citrate or Na+/malate symporter (CitS) (PDB:5A1S),6,0
2072,"Predicted ABC-type transport system involved in lysophospholipase L1 biosynthesis, permease component (YbbP)",6,0
2073,"WGR domain, predicted DNA-binding domain in MolR (WGR) (PDB:2CR9)",3,2
2074,"Uncharacterized conserved protein MJ0802, methanogenesis marker protein 17, contains DUF2113 domain",6,1
2075,CRISPR-Cas system type-V protein Cas12a (Cas12a),4,0
2076,Chlorophyllide a oxygenase/letal leaf spot protein (PobA) (PUBMED:14657372;22366162),7,1
2077,"ABC-type thiamine/hydroxymethylpyrimidine transport system, permease component (YkoE) (PDB:5EDL)",6,1
2078,"DNA-binding transcriptional regulator WhiA, involved in cell division (WhiA) (PDB:3HYI)",4,0
2079,"Uncharacterized conserved protein TM0948, MoaA-related, radical SAM superfamily (TM0948)",8,0
2080,Flagellin-specific chaperone FliS (FliS) (PDB:1ORJ),6,2
2081,MoxR-like ATPase (MoxR) (PDB:2R44),6,0
2082,"Uncharacterized conserved protein, DUF736 family",8,0
2083,Stress response protein YsnF (function unknown) (YsnF),6,0
2084,"Ribosomal 30S subunit maturation factor RimM, required for 16S rRNA processing (RimM) (PDB:2QGG)",7,0
2085,"Stage V sporulation protein SpoVAEB, subunit of dipicolinate uptake complex (SpoVAEB)",7,0
2086,Trans-aconitate methyltransferase (Tam) (PDB:2P35),5,1
2087,tRNA A37 threonylcarbamoyladenosine dehydratase (TcdA) (PDB:4D7A) (PUBMED:27913733),6,0
2088,"Lysophospholipase, alpha-beta hydrolase superfamily (PldB) (PDB:5O7G)",8,0
2089,"DNA polymerase III, delta subunit (HolA) (PDB:3ZH9)",8,0
2090,"ABC-type enterochelin transport system, ATPase component (CeuD)",5,0
2091,Outer membrane protein OmpA and related peptidoglycan-associated (lipo)proteins (OmpA) (PDB:1OAP),6,1
2092,Abortive infection bacteriophage resistance protein (AbiF),6,0
2093,5-oxoprolinase subunit B/Allophanate hydrolase subunit 1 (PxpB) (PDB:2KWA) (PUBMED:28830929),5,1
2094,"Proteasome lid subunit RPN8/RPN11, contains Jab1/MPN domain metalloenzyme (JAMM) motif (Rri1) (PDB:2O95)",4,1
2095,DNA replication protein DnaD (DnaD) (PDB:2I5U),6,1
2096,Superfamily I DNA and RNA helicases,5,0
2097,Monomeric isocitrate dehydrogenase (IcdM) (PDB:1ITW),8,0
2098,Ureidoglycine aminohydrolase (AllE) (PDB:1RC6) (PUBMED:19935661),6,1
2099,Flavodoxin (FldA) (PDB:1AG9),8,0
2100,"Peptidyl-prolyl cis-trans isomerase, FKBP type (SlpA) (PDB:2M2A)",7,1
2101,PAS domain (PAS) (PDB:2MWG),4,2
2102,"Thiazole synthase ThiGH, ThiG subunit (thiamin biosynthesis) (ThiG) (PDB:1TYG)",6,0
2103,Ubiquitin C-terminal hydrolase,8,0
2104,Hydroxymethylpyrimidine/phosphomethylpyrimidine kinase (ThiD) (PDB:1Y9X) (PUBMED:17351295),5,1
2105,"Na+-dependent transporter, SNF family (YocR) (PDB:2A65)",8,0
2106,Mitochondrial DNA-directed RNA polymerase (RPO41),8,0
2107,"HEPN domain protein, predicted toxin of MNT-HEPN system (HEPN) (PUBMED:26112399)",7,0
2108,"Predicted component TssB of the type VI protein secretion system, VipA/VipB/TssB family (PDB:5MYU)",6,1
2109,"Uncharacterized conserved protein, DUF1653 family (PDB:3BE3)",8,0
2110,"Uncharacterized conserved protein YccT, UPF0319 family (YccT)",6,0
2111,"Archaeal aspartate aminotransferase or a related aminotransferase, includes purine catabolism protein PucG (PucG) (PDB:3NNK)",4,0
2112,"Uncharacterized conserved protein, DUF917 family (PDB:2O3I)",6,0
2113,Ribosomal protein L18E (RPL18A),8,0
2114,"Trk/Ktr K+ transport system regulatory component TrkA/KtrA/KtrC, RCK domain (TrkA) (PDB:4XTT) (PUBMED:23815639;25957408;31868587;32095817)",4,1
2115,"K+-transporting ATPase, KdpC subunit (KdpC) (PDB:5MRW)",6,0
2116,Chloramphenicol O-acetyltransferase (CatA) (PDB:1CIA),6,0
2117,"Uncharacterized conserved protein, contains TadX/Tad_C domain (TadX) (PUBMED:26686616)",8,0
2118,"Uncharacterized conserved protein, UPF0548 family",7,0
2119,"Spore coat polysaccharide biosynthesis protein SpsG, predicted glycosyltransferase (SpsG)",4,0
2120,"Uncharacterized conserved protein YcnI, contains cohesin/reeler-like domain (YcnI) (PDB:3ESM)",8,0
2121,2-phosphoglycerate kinase/Mevalonate-3-phosphate 5-kinase (Pgk2),8,0
2122,"ABC-type glucose/galactose transport system, permease component (MglC)",6,1
2123,Tetraheme cytochrome c subunit NapC of nitrate or TMAO reductase (NapC),7,0
2124,"Preprotein translocase subunit SecA (ATPase, RNA helicase) (SecA) (PDB:2FSF)",8,0
2125,"Predicted  nucleic acid-binding protein, contains Zn-ribbon domain",8,0
2126,Fe-S cluster biosynthesis and repair protein YggX (YggX) (PDB:1T07) (PUBMED:24421039),7,1
2127,"Uncharacterized conserved protein, DUF356 domain",7,0
2128,"Acetyl/propionyl-CoA carboxylase, alpha subunit (PccA) (PDB:3U9S)",7,0
2129,"Pyruvate/2-oxoglutarate/acetoin dehydrogenase complex, dehydrogenase (E1) component, beta subunit (AcoB) (PDB:2OZL)",8,0
2130,"Uncharacterized conserved protein, DUF1284 domain",5,1
2131,tRNA uridine 5-carbamoylmethylation protein Kti12 (Killer toxin insensitivity protein) (Kti12) (PDB:3A4L),7,0
2132,"Uncharacterized conserved protein YqeY, may have tRNA amino acid amidase activity (YqeY) (PDB:1NG6)",7,0
2133,Phosphoenolpyruvate-protein kinase (PTS system EI component in bacteria) (PtsA) (PDB:1EZA),6,0
2134,"ABC-type lipopolysaccharide export system, ATPase component (LptB) (PDB:5L75) (PUBMED:12029038)",8,0
2135,"Phage tail protein, TP901-1 family (LmaA)",7,0
2136,B3/B4 domain (DNA/RNA-binding domain of Phe-tRNA-synthetase) (B3/B4),7,0
2137,"Benzoyl-CoA reductase/2-hydroxyglutaryl-CoA dehydratase subunit, BcrC/BadD/HgdB (HgdB) (PDB:3O3M)",8,0
2138,"Predicted ATPase, PP-loop superfamily",8,0
2139,Autotransporter translocation and assembly protein TamB (TamB) (PDB:5VTG),6,0
2140,"Uncharacterized protein, contains GIY-YIG domain",8,0
2141,Predicted phage phi-C31 gp36 major capsid-like protein (gp36),4,0
2142,"Uncharacterized membrane protein YfbV, UPF0208 family (YfbV)",8,0
2143,Proline dehydrogenase (PutA) (PDB:5KF6),4,1
2144,Terpene cyclase SqhC (SqhC) (PDB:1GSZ) (PUBMED:21627333),7,1
2145,Muconolactone delta-isomerase (CatC1) (PDB:1MLI),6,0
2146,Nucleotidyltransferase/DNA polymerase DinP involved in DNA repair (DinP) (PDB:4R8U) (PUBMED:16544291),6,0
2147,Bacterioferritin (cytochrome b1) (Bfr) (PDB:4E6K),8,0
2148,Pyridoxine/pyridoxamine 5'-phosphate oxidase (PdxH) (PDB:1CI0),7,0
2149,Copper oxidase (laccase) domain (YfiH) (PDB:1RV9),7,0
2150,"Cytochrome oxidase maturation protein, CcoS/FixS family (FixS)",6,0
2151,Uncharacterized archaeal Zn-finger protein,6,1
2152,Arylamine N-acetyltransferase (NhoA) (PDB:1E2T),7,0
2153,Superfamily I DNA and/or RNA helicase (DNA2) (PDB:2GJK),4,1
2154,Tyrosine-protein phosphatase YwqE (YwqE) (PDB:3QY6),6,0
2155,ESX protein secretion system component YukD (YukD) (PDB:2BPS) (PUBMED:24798022),6,0
2156,"Tagatose-1,6-bisphosphate/sulfofructosephosphate aldolase (LacD) (PDB:3MYO) (PUBMED:20427286;24463506)",8,0
2157,"DNA polymerase III, epsilon subunit or related 3'-5' exonuclease (DnaQ) (PDB:1J53)",8,0
2158,"Intracellular sulfur oxidation protein, DsrE/DsrF family (PDB:1L1S) (PUBMED:9695921)",8,0
2159,Twin-arginine protein secretion pathway component TatC (TatC) (PDB:4B4A),6,0
2160,Uncharacterized conserved protein YraI (YraI) (PDB:2E52),8,0
2161,"Uncharacterized conserved protein YjfI, DUF2170 family (YjfI) (PUBMED:15972856)",4,2
2162,"Microcystin degradation protein MlrC, contains DUF1485 domain (PDB:3IUU)",7,0
2163,Serine protease inhibitor (SERPIN),8,0
2164,"Uncharacterized conserved protein YoxC, contains an MCP-like domain",8,0
2165,"Predicted membrane glycosyltransferase AF0583, Arch_YYY/DUF2298 family",7,1
2166,"ABC-type phosphate/phosphonate transport system, ATPase component (PhnC)",8,0
2167,"FhlA-type transcriptional regulator, contains GAF, AAA-type ATPase, and DNA-binding Fis domains (FhlA)",7,0
2168,"Glycine cleavage system protein P (pyridoxal-binding), N-terminal domain (GcvP1) (PDB:4LGL)",7,1
2169,"Uncharacterized conserved protein YunC, DUF1805 family (YunC) (PDB:1QW2)",4,0
2170,Predicted naringenin-chalcone synthase (BH0617) (PDB:1BI5),4,0
2171,Co/Zn/Cd efflux system component (CzcD),6,0
2172,Lipopolysaccharide export system protein LptA (LptA) (PDB:2R19),8,0
2173,"Formate dehydrogenase assembly factor FdhD, a sulfurtransferase (FdhD) (PDB:2PW9)",8,0
2174,"Putative antitoxin component PasI (RatB) of the RatAB toxin-antitoxin module, ubiquitin-RnfH superfamily (PasI) (PDB:2HJ1) (PUBMED:23055930)",8,0
2175,Poly-beta-hydroxyalkanoate depolymerase (DepA),7,0
2176,Predicted regulatory domain of a methyltransferase (PDB:5DNK),6,0
2177,Asp-tRNAAsn/Glu-tRNAGln amidotransferase A subunit or related amidase (GatA) (PDB:3H0L),6,0
2178,Homoserine O-succinyltransferase (MetA) (PDB:2GHR),8,0
2179,DNA/RNA-binding protein AlbA/Ssh10b (AlbA) (PDB:1H0X) (PUBMED:18821773),7,0
2180,Lipid A disaccharide synthetase (LpxB) (PDB:5W8N),8,0
2181,Peptidyl-prolyl cis-trans isomerase (rotamase) - cyclophilin family (PpiB) (PDB:4DGD),8,0
2182,"Membrane-anchored protein YidD, putatitve component of membrane protein insertase Oxa1/YidC/SpoIIIJ (YidD)",6,2
2183,Threonyl-tRNA synthetase (ThrS) (PDB:1NYQ),4,2
2184,Permease subunit MlaE of the ABC-type intermembrane phospholipid transporter Mla (MlaE) (PDB:6IC4),6,1
2185,"tRNA 2-selenouridine synthase SelU, contains rhodanese domain (SelU)",7,0
2186,"Uncharacterized membrane protein YvlD, DUF360 family (YvlD)",6,0
2187,"Spore germination receptor GerABC, GerC subunit (GerAC) (PUBMED:19748359)",5,0
2188,Uncharacterized phage protein gp47/JayE (JayE),7,0
2189,"Uncharacterized membrane protein YqaA, VTT domain (YgaA)",7,0
2190,"2-keto-4-pentenoate hydratase/2-oxohepta-3-ene-1,7-dioic acid hydratase (catechol pathway) (YcgM) (PDB:1GTT)",7,0
2191,Polyphosphate kinase (Ppk) (PDB:1XDO),6,0
2192,"Uncharacterized conserved protein, DUF2239 domain",6,0
2193,Rieske Fe-S protein (QcrA/PetC) (PDB:5CXM) (PUBMED:27663073),8,0
2194,Flagellar biosynthesis protein FliQ (FliQ) (PDB:6F2D),7,0
2195,Urease accessory protein UreF (UreF) (PDB:3SF5),6,1
2196,"Stage VI sporulation protein SpoVID (LysM domain), required for assembly of the spore coat (SpoVID) (PUBMED:8449878)",5,0
2197,Ribosome-binding factor RbfA (RbfA) (PDB:1JOS),8,0
2198,Cysteinyl-tRNA synthetase (CysS) (PDB:1LI5),8,0
2199,Ribosomal protein L31 (RpmE) (PDB:1VS6),7,0
2200,"Sterol desaturase/sphingolipid hydroxylase, fatty acid hydroxylase superfamily (ERG3) (PDB:4ZR0)",6,0
2201,Ribosomal protein L13 (RplM) (PDB:1VS6),7,0
2202,Preprotein translocase subunit SecG (Sec61beta) (SBH1),8,0
2203,"Predicted class III extradiol dioxygenase, MEMO1 family (Mho1) (PDB:3BCZ)",6,0
2204,Acyl carrier protein/domain (AcpA) (PDB:2FQ1) (PUBMED:8759840;20663952),7,1
2205,Ribosomal protein L1 (RplA) (PDB:3J65),8,0
2206,"Predicted nucleic acid-binding protein, contains Zn-finger domain (PUBMED:22120742)",8,0
2207,Heme oxygenase (PDB:1DVE),7,0
2208,"Outer membrane scaffolding protein for murein synthesis, MipA/OmpV family (OmpV)",7,0
2209,"Ethanolamine utilization protein EutL, microcompartment shell protein (EutL) (PDB:3GFH)",8,0
2210,"Spore cortex protein CoxA (YrbB), YhcN/YlaJ family (CoxA) (PUBMED:9770294)",8,0
2211,"Uncharacterized Fe-S cluster-containing enzyme, radical SAM superfamily",7,0
2212,"Uncharacterized conserved protein YaiL, DUF2058 family (YaiL)",8,0
2213,"Uncharacterized conserved protein YuzB, UPF0349 family (YuzB)",7,0
2214,Large exoprotein involved in heme utilization or adhesion (FhaB) (PDB:4RM6),6,0
2215,Formamidopyrimidine-DNA glycosylase (Nei) (PDB:1EE8),5,0
2216,"Ethanolamine transporter EutH, required for ethanolamine utilization at low pH (EutH) (PUBMED:15466042)",7,0
2217,Uncharacterized membrane protein YfhO (YfhO),4,1
2218,Serine/threonine protein kinase (SPS1) (PDB:6G4J),5,0
2219,Stage 0 sporulation initiation response regulator Spo0F (Spo0F) (PUBMED:19234443;21760923),8,0
2220,Bacteriochlorophyllide reductase subunit BchX (BchX) (PUBMED:21886856),8,0
2221,Cytochrome b subunit of the bc complex (QcrB/PetB) (PDB:1VF5),8,0
2222,Uncharacterized lipoprotein NlpE involved in copper resistance (CutF) (PDB:2Z4H),2,0
2223,"CMP-N-acetylneuraminic acid synthetase, NeuA/PseF family (NeuA) (PDB:1EYR)",4,0
2224,"Uncharacterized protein, contains NAD-binding domain and a Fe-S cluster (PDB:5MOG)",7,1
2225,Uncharacterized conserved protein (PDB:6C4L),8,0
2226,Peroxiredoxin (AHP1) (PDB:1H4O),8,0
2227,Long-chain acyl-CoA synthetase (AMP-forming) (FAA1),8,0
2228,"Lipid carrier protein ElyC involved in cell wall biogenesis, DUF218 family (ElyC) (PDB:3CA8) (PUBMED:24391520)",7,0
2229,Peptide methionine sulfoxide reductase MsrB (MsrB) (PDB:1L1D),7,0
2230,"ABC-type uncharacterized transport system, permease component (YpjD)",8,0
2231,Pyrroline-5-carboxylate reductase (ProC) (PDB:3GT0) (PUBMED:22125496;26507882),4,0
2232,"Fermentation-respiration switch esterase FrsA, DUF1100 family (FrsA)",6,0
2233,"1,4-dihydroxy-6-naphtoate synthase (menaquinone biosynthesis, futalosine pathway) (MqnD) (PDB:2CZL)",6,1
2234,"Phosphotransferase system, galactitol-specific IIB component (SgaB) (PDB:5GQS)",8,0
2235,Phosphoribosylaminoimidazole-succinocarboxamide synthase (PurC) (PDB:1A48),6,0
2236,"Phosphotransferase system, mannose/fructose/N-acetylgalactosamine-specific IID component (ManZ) (PDB:6K1H)",8,0
2237,"Predicted phosphoesterase YmaB, NUDIX family (YmaB) (PDB:3E57)",8,0
2238,"Sulfite reductase, beta subunit (hemoprotein) (CysI) (PDB:1AOP)",5,0
2239,"TRAP-type C4-dicarboxylate transport system, periplasmic component (DctP) (PDB:2CEX)",7,0
2240,"Na+-translocating ferredoxin:NAD+ oxidoreductase  RNF, RnfC subunit (RnfC)",5,1
2241,"Phospholipid biosynthesis protein PlsY, probable glycerol-3-phosphate acyltransferase (PlsY) (PDB:5XJ5) (PUBMED:29684280)",6,0
2242,"Tryptophan 2,3-dioxygenase (vermilion) (TDO2) (PDB:2NOX)",6,0
2243,"Na+-transporting NADH:ubiquinone oxidoreductase, subunit NqrC (NqrC) (PDB:4P6V)",7,0
2244,"Uncharacterized OB-fold protein, contains Zn-ribbon domain (PDB:3IRB)",7,0
2245,Mu-like prophage FluMu protein gp41 (gp41),8,0
2246,Uncharacterized membrane protein (PUBMED:15101977),6,0
2247,"Archaeal DNA helicase HerA or a related bacterial ATPase, contains HAS-barrel and ATPase domains (HerA) (PDB:4D2I)",6,1
2248,"Aryl-phospho-beta-D-glucosidase BglC, GH1 family (BglC)",7,0
2249,Malate synthase (AceB) (PDB:1D8C),7,0
2250,3-methyladenine DNA glycosylase/8-oxoguanine DNA glycosylase (AlkA) (PDB:1DIZ),8,0
2251,Transcriptional antiterminator (BglG) (PDB:1AUU),4,1
2252,"Uncharacterized conserved protein, DUF2164 family",4,1
2253,"Non-homologous end joining protein Ku, dsDNA break repair (YkoV)",7,1
2254,"Uncharacterized conserved protein, DUF2193 domain",6,1
2255,"Transposase, IS1182 family",6,1
2256,"CRISPR-associated protein Csa3, CARF domain (Csa3) (PDB:2WTE) (PUBMED:21093452)",7,0
2257,"Uncharacterized conserved protein, UPF0297 family (PDB:5US5)",7,0
2258,Septum site-determining ATPase MinD (MinD) (PDB:4V02),8,0
2259,Crotonobetainyl-CoA:carnitine CoA-transferase CaiB and related acyl-CoA transferases (CaiB) (PDB:1P5H),5,2
2260,Asparagine synthetase B (glutamine-hydrolyzing) (AsnB) (PDB:2ETD) (PUBMED:25951518),4,0
2261,Beta-xylosidase (XynB2) (PDB:1Y7B),8,0
2262,Spore maturation protein SpmB (function unknown) (SpmB),8,0
2263,"Predicted acyltransferase, contains DUF342 domain",7,0
2264,Diaminopimelate decarboxylase (LysA) (PDB:1D7K),6,0
2265,Alanine racemase (Alr) (PDB:1BD0),5,0
2266,Alanine-alpha-ketoisovalerate (or valine-pyruvate) aminotransferase (AvtA) (PDB:3G7Q),4,2
2267,Phosphoglycerate mutase (BPG-dependent) (GpmA) (PDB:1E58),6,1
2268,5'(3')-deoxyribonucleotidase (YorC) (PDB:1MH9),5,2
2269,"Possible nuclease of RNase H fold, RuvC/YqgF family",2,2
2270,Cystathionine beta-lyase family protein involved in aluminum resistance (YnbB) (PDB:3FD0),7,0
2271,"Cell division protein ZapE (Z ring-associated ATPase), AFG1 superfamily (ZapE)",7,1
2272,Broad specificity phosphatase PhoE (PhoE) (PDB:1EBB),6,0
2273,Carbamoylphosphate synthase small subunit (CarA) (PDB:1C30),5,0
2274,"Lysyl-tRNA synthetase, class I (LysS) (PDB:1IRX)",7,0
2275,DNA recombination-dependent growth factor RdgC (RdgC) (PDB:2OWL),5,2
2276,Exonuclease I (degrades ssDNA) (SbcB) (PDB:1FXX),7,0
2277,"Pyridoxal 5'-phosphate homeostasis protein YggS, UPF0001 family (YggS) (PDB:3SY1) (PUBMED:26872910)",8,0
2278,Purine-nucleoside phosphorylase (DeoD) (PDB:1A69),8,0
2279,"Uncharacterized conserved protein YybS, DUF2232 family (YybS)",4,1
2280,Cytochrome b subunit of formate dehydrogenase (FdnI) (PDB:1KQF),5,0
2281,Purine nucleoside permease (NUP),6,0
2282,Nucleoside-triphosphatase THEP1 (THEP1) (PDB:1YE8),4,0
2283,"Uncharacterized conserved protein, DUF1430 domain",4,1
2284,S-adenosylhomocysteine hydrolase (SAM1) (PDB:1A7A),5,0
2285,"Uncharacterized conserved protein, DUF2155 domain",4,0
2286,ABC-type ATPase fused to a predicted acetyltransferase domain (MK0520),3,0
2287,"Uncharacterized conserved protein, DUF1499 family",6,0
2288,Urease accessory protein UreE (UreE) (PDB:1EAR),7,0
2289,"Spore coat polysaccharide biosynthesis protein SpsF, cytidylyltransferase family (SpsF)",8,0
2290,Uncharacterized conserved protein (PDB:5YIU),5,0
2291,Predicted neuraminidase (sialidase),7,0
2292,"Penicillin-binding protein 1B/1F, peptidoglycan  transglycosylase/transpeptidase (MrcB) (PDB:3FWL)",7,1
2293,Predicted metal-binding protein,8,0
2294,"Alcohol dehydrogenase, class IV (EutG) (PDB:6AHC)",4,2
2295,Cu2+-containing amine oxidase (TynA) (PDB:1A2V),6,2
2296,Phytoene dehydrogenase-related protein (PDB:4REP),8,0
2297,"DNA glycosylase YcaQ, repair of DNA interstrand crosslinks (YcaQ) (PUBMED:32409837)",8,0
2298,Tryptophanyl-tRNA synthetase (TrpS) (PDB:3N9I),3,1
2299,"Sporulation protein YlmC, YlmC/YmxH family, contains PRC-barrel domain (YlmC) (PDB:1PM3)",7,0
2300,DNA topoisomerase IB (Top1) (PDB:1A31),6,0
2301,Streptomycin 6-kinase (StrB),8,0
2302,Quinolinate synthase (NadA) (PDB:4HHE) (PUBMED:24498065),8,0
2303,"Protocatechuate 3,4-dioxygenase beta subunit (PcaH) (PDB:1DLM)",8,0
2304,Signal transduction histidine kinase regulating phosphoglycerate transport system,4,0
2305,"Cell division protein ZapD, interacts with FtsZ (ZapD) (PDB:2OEZ)",6,0
2306,"Uncharacterized sporulation proteins YjcM and YhbB, contain C-terminal amidase domain (YhbB)",6,1
2307,"Stage IV sporulation protein SpoIVA, required for spore cortex formation and coat assembly (SpoIVA) (PUBMED:19775244;23267091)",3,2
2308,"Archease, activates RNA ligation by RtcB (tRNA splicing) (ARCH) (PDB:1J5U) (PUBMED:24435797)",4,1
2309,"Cyclic di-GMP-binding protein YajQ, UPF0234 family (YajQ) (PDB:1IN0) (PUBMED:25329577)",6,1
2310,AraC-type DNA-binding domain and AraC-containing proteins (AraC) (PDB:1BL0),5,0
2311,Ni/Fe-hydrogenase 2 integral membrane subunit HybB (HybB),5,1
2312,"Uncharacterized conserved protein YlbG, UPF0298 family (YlbG)",8,0
2313,Predicted peptidase (PDB:3DOH),6,1
2314,Fumarate reductase subunit D (FrdD) (PDB:1KF6),3,0
2315,Uncharacterized conserved protein (PDB:2O2A),6,1
2316,Flagellar motor switch/type III secretory pathway protein FliN (FliN) (PDB:1O9Y),5,0
2317,Glucan-binding domain (YG repeat) (PDB:1H09),8,0
2318,Phage-related holin (Lysis protein),7,0
2319,Formate hydrogenlyase subunit HyfC (HyfC) (PDB:6CFW),3,0
2320,3-oxoacyl-(acyl-carrier-protein) synthase (FabB) (PDB:2UV8) (PUBMED:21652641),7,0
2321,"Chromosome condensin MukBEF, MukE localization factor (MukE) (PDB:3RPU)",7,0
2322,Uncharacterized conserved protein with two CxxC motifs (PDB:2JOV),6,0
2323,"Flp pilus assembly protein, secretin CpaC (CpaC)",5,0
2324,"Uncharacterized conserved protein VgrG, implicated in type VI secretion and phage assembly (VgrG) (PDB:6SJL) (PUBMED:16980477)",7,0
2325,"Uncharacterized conserved protein, DUF1919 family (PDB:2G6T)",7,0
2326,Methylaspartate ammonia-lyase (Mal) (PDB:1KCZ),6,1
2327,Kojibiose phosphorylase YcjT (ATH1) (PDB:1H54) (PUBMED:29684280),7,1
2328,"Multimeric flavodoxin WrbA, includes NAD(P)H:quinone oxidoreductase (WrbA) (PDB:4DY4)",8,0
2329,"Sulfur carrier protein TusA (tRNA thiolation, molybdenum cofactor biosynthesis) (TusA) (PDB:1DCJ) (PUBMED:23894086)",8,0
2330,"Uncharacterized conserved protein YcgG, contains conserved FPC and CPF motifs (YcgG) (PUBMED:23055930)",8,0
2331,Flp pilus assembly protein TadC (TadC),7,0
2332,"DNA/RNA endonuclease G, NUC1 (NUC1) (PDB:1G8T)",5,0
2333,Esterase/lipase superfamily enzyme,8,0
2334,Outer membrane receptor for ferric coprogen and ferric-rhodotorulic acid (FhuE) (PDB:3EFM),8,0
2335,"DNA polymerase III, psi subunit (HolD) (PDB:3SXU)",8,0
2336,"ABC-type sulfate transport system, permease component (CysU) (PDB:3D31)",7,0
2337,Ferredoxin-like protein FixX (FixX),5,0
2338,Mg2+ and Co2+ transporter CorA (CorA) (PDB:2BBH),3,0
2339,Sugar (pentulose or hexulose) kinase (XylB) (PDB:4C23),8,0
