,feature_name,cultured_feature_counts,uncultured_feature_counts
1339,"DNA replicative helicase MCM subunit Mcm2, Cdc46/Mcm family (Mcm2) (PDB:3F8T)",3,1
1340,"ABC-type microcin C transport system, permease component YejE (YejE)",2,0
1341,"Uncharacterized conserved protein YcfJ, contains glycine zipper 2TM domain (YcfJ)",0,1
1342,L-asparagine transporter or related permease (AnsP),1,1
1343,tRNA(His) 5'-end guanylyltransferase (Thg1) (PDB:3OTB),0,4
1344,"Uncharacterized conserved protein, DUF934 family",0,3
1345,"Uncharacterized conserved protein, DUF2262 domain",1,1
1346,"mRNA-degrading endonuclease RelE, toxin component of the RelBE toxin-antitoxin system (RelE) (PDB:1WMI)",1,3
1347,Arginyl-tRNA synthetase (ArgS) (PDB:1BS2),2,2
1348,"Predicted antitoxin component of a toxin-antitoxin system, DUF433 family (PDB:2GA1)",1,2
1349,"Beta-phosphoglucomutase, HAD superfamily (YcjU) (PDB:3E58) (PUBMED:29684280)",2,0
1350,"Predicted transcriptional regulator, contains ribbon-helix-helix (RHH_1) domain (PutA1) (PDB:6IYA)",1,2
1351,Uncharacterized conserved protein related to deoxyribodipyrimidine photolyase (PDB:3ZXS),1,0
1352,"Cytoskeletal protein CcmA, bactofilin family (CcmA) (PDB:2N3D)",0,1
1353,Steroid 5-alpha reductase family enzyme,1,2
1354,"Periplasmic chaperone Spy, Spy/CpxP family (CpxP) (PDB:3ITF)",1,1
1355,Autotransporter translocation and assembly protein TamB (TamB) (PDB:5VTG),1,0
1356,TPR repeat (TPR) (PDB:1KLX),1,2
1357,HPr or related phosphotransfer protein (PtsH) (PDB:1CM2),1,0
1358,Ketosteroid isomerase homolog YybH (YybH) (PDB:2GXF),2,3
1359,"Predicted transcriptional regulator, contains an HTH and PUA-like domains",0,1
1360,Asparagine synthetase B (glutamine-hydrolyzing) (AsnB) (PDB:2ETD) (PUBMED:25951518),0,1
1361,"Predicted acetyltransferase, GNAT superfamily (YidJ) (PDB:1R57)",0,2
1362,Tryptophanyl-tRNA synthetase (TrpS) (PDB:3N9I),3,2
1363,"Cytochrome bd-type quinol oxidase, subunit 1 (AppC) (PDB:5DOQ)",1,2
1364,NMD protein affecting ribosome stability and mRNA decay (NMD3),2,0
1365,ERCC4-type crossover junction endonuclease (MUS81) (PDB:1J22),1,1
1366,"Uncharacterized conserved protein, DUF366 domain (PDB:2DDZ)",1,1
1367,"Stage V sporulation protein SpoVAEB, subunit of dipicolinate uptake complex (SpoVAEB)",0,1
1368,"Uncharacterized conserved protein YecM, predicted metalloenzyme (YecM) (PDB:1K4N) (PUBMED:12660999)",2,1
1369,"ABC-type guanosine uptake system NupNOPQ, permease subunit NupQ (NupQ) (PUBMED:21926227)",0,3
1370,Valyl-tRNA synthetase (ValS) (PDB:1GAX),3,1
1371,Ubiquitin C-terminal hydrolase,1,0
1372,Predicted transcriptional regulator (PDB:1R7J),1,0
1373,RecA/RadA recombinase (RecA) (PDB:1B22),3,1
1374,"Nucleotide monophosphate nucleosidase PpnN/YdgH, Lonely Guy (LOG) family (PpnN) (PDB:2PMB) (PUBMED:25728768;27941785;31023582;31420341)",1,1
1375,Formate dehydrogenase maturation protein FdhE (FdhE) (PDB:2FIY),1,0
1376,Phosphoenolpyruvate synthase/pyruvate phosphate dikinase (PpsA) (PDB:5HV6),1,0
1377,"Uncharacterized conserved protein YcgI, DUF1989 family (YcgI) (PDB:3DI4)",2,1
1378,Serine acetyltransferase (CysE) (PDB:1T3D),1,0
1379,DNA replication protein DnaD (DnaD) (PDB:2I5U),1,1
1380,Urease beta subunit (UreB),1,1
1381,"YycI protein, regulator of the WalKR two-component signal transduction system (YycI) (PDB:2O3O)",2,0
1382,CBS-domain-containing membrane protein,2,0
1383,Uncharacterized conserved protein (PDB:2KPP),1,0
1384,"Uncharacterized conserved protein, UPF0297 family (PDB:5US5)",4,2
1385,Cytochrome c5 (CytC5) (PDB:1CC5),2,1
1386,"Branched-chain amino acid ABC-type transport system, permease component (LivH)",1,0
1387,"Aromatic ring-opening dioxygenase, catalytic subunit, LigB family (LigB) (PDB:2PW6) (PUBMED:23258706)",2,1
1388,"Glycosyltransferase, GT2 family (WcaE) (PDB:2Z86)",2,0
1389,Zn-dependent protease PmbA/TldA or its inactivated homolog (TldD) (PDB:3TV9) (PUBMED:12029038),1,0
1390,"Uncharacterized membrane protein, BrkB/YihY/UPF0761 family (not an RNase) (BrkB)",2,2
1391,Leu/Phe-tRNA-protein transferase (Aat) (PDB:2CXA),0,1
1392,"Type IV secretory pathway, TrbL components (TrbL)",0,2
1393,"ABC-type protease/lipase transport system, ATPase and permease components (ArpD) (PDB:5L22)",1,4
1394,Methylglyoxal synthase (MgsA) (PDB:1S8A) (PUBMED:9665712),2,0
1395,Predicted heme/steroid binding protein,1,0
1396,Molybdopterin-binding protein MopI (MopI) (PDB:1B9M),0,1
1397,"ATP-dependent protease HslVU (ClpYQ), peptidase subunit (HslV) (PDB:5JI3)",0,2
1398,5-(aminomethyl)-3-furanmethanol-phosphate kinase MfnE (methanofuran biosynthesis) (MfnE) (PUBMED:26100040),1,1
1399,Predicted deacylase (PDB:3CDX),2,1
1400,"Pyruvate:ferredoxin oxidoreductase or related 2-oxoacid:ferredoxin oxidoreductase, gamma subunit (PorG) (PDB:1B0P)",1,1
1401,Aspartate/aromatic aminotransferase (TyrB) (PDB:1AAM),3,0
1402,"Uncharacterized protein, contains GIY-YIG domain",0,3
1403,"Regulator of PEP synthase PpsR, kinase-PPPase family (combines ADP:protein kinase and phosphorylase activities) (PpsR) (PDB:5D0N)",2,0
1404,Predicted amino acid racemase (YhfX) (PDB:4KBX) (PUBMED:23091052),1,1
1405,Nitrous oxide reductase (NosZ) (PDB:1FWX),2,1
1406,Fatty acid repression mutant protein (predicted oxidoreductase) (FMR2) (PDB:2WQF),1,2
1407,Cell wall assembly regulator SMI1 (Killer toxin-resistance protein 4) (SMI1) (PDB:5J1B),1,1
1408,Regulator of RNase E activity RraB (RraB) (PDB:1NXI),1,2
1409,Predicted SAM-depedendent methyltransferase,0,3
1410,Cytochrome b subunit of Ni2+-dependent hydrogenase (CytB),1,0
1411,"1,6-Anhydro-N-acetylmuramate kinase (AnmK) (PDB:3CQY) (PUBMED:15901686)",1,2
1412,"Uncharacterized conserved protein, DUF2390 domain",1,1
1413,Beta-ribofuranosylaminobenzene 5'-phosphate synthase (methanopterin biosynthesis) (bRFAP) (PDB:6YQQ) (PUBMED:16817932),1,0
1414,Ubiquinone biosynthesis accessory factor UbiK (UbiK) (PUBMED:28559279),2,0
1415,"Predicted  nucleic acid-binding protein, contains Zn-ribbon domain",0,1
1416,Uracil phosphoribosyltransferase (Upp) (PDB:2EHJ),1,0
1417,Uncharacterized conserved protein (PDB:6IAQ),4,0
1418,NADPH-dependent glutamate synthase beta chain or related oxidoreductase (GltD) (PDB:1H7X),0,2
1419,Aminoglycoside phosphotransferase family enzyme,0,2
1420,Chloramphenicol O-acetyltransferase (CatA) (PDB:1CIA),0,2
1421,Nitrate reductase alpha subunit (NarG) (PDB:1Q16),0,1
1422,"Predicted RNA-binding protein, contains C-terminal EMAP domain (PDB:2E8G) (PUBMED:17114934)",1,0
1423,"ABC-type uncharacterized transport system, periplasmic component",0,1
1424,Phosphotransferase system sorbitol-specific IIA component (SrlB) (PDB:2F9H),0,1
1425,"CRISPR/Cas system CMR subunit Cmr6, Cas7 group, RAMP superfamily (Cmr6) (PDB:3X1L)",0,1
1426,"Flp pilus assembly protein TadD, contains TPR repeats (TadD) (PDB:3WXX)",0,2
1427,"ABC-type hemin transport system, periplasmic component (ChuT) (PDB:3MD9)",3,0
1428,"Uncharacterized membrane protein, DUF368 family",0,2
1429,Predicted kinase related to dihydroxyacetone kinase (YloV),1,1
1430,NADH:ubiquinone oxidoreductase subunit 6 (chain J) (NuoJ) (PDB:4HE8),1,0
1431,Pyruvate kinase (PykF) (PDB:6QXL),1,0
1432,"Uncharacterized conserved protein, heparinase superfamily",1,1
1433,Uncharacterized conserved protein probably involved in high-affinity Fe2+ transport (Tpd) (PDB:2O6C) (PUBMED:18456808),0,2
1434,"Cytochrome oxidase maturation protein, CcoS/FixS family (FixS)",2,0
1435,"Electron transfer flavoprotein, alpha and beta subunits (FixA) (PDB:5OL2)",1,0
1436,Outer membrane receptor for ferrienterochelin and colicins (FepA) (PDB:2HDF) (PUBMED:16468998),1,0
1437,Alpha-D-ribose 1-methylphosphonate 5-phosphate C-P lyase PhnJ (PhnJ) (PDB:4XB6),1,1
1438,"Uncharacterized conserved protein, DUF749 domain (PDB:1IQO)",1,0
1439,"Cytochrome b6 maturation protein CCB3/Ycf19 and related maturases, YggT family (Ycf19)",0,1
1440,"6-hydroxymethyl-7,8-dihydropterin pyrophosphokinase MptE (tetrahydrofolate and tetrahydromethanopterin biosynthesis) (FolK) (PUBMED:22931285)",0,1
1441,TctA family transporter (PUBMED:14499931),1,1
1442,"DNA-binding transcriptional regulator DnrI/AfsR/EmbR, SARP family, contains BTAD domain (DnrI) (PDB:2FEZ) (PUBMED:12625841)",1,0
1443,Lysozyme inhibitor LprI (LprI) (PUBMED:18369469;26589796),1,0
1444,"Membrane-bound acyltransferase YfiQ, involved in biofilm formation (YfiQ)",0,1
1445,Thymidylate kinase (Tmk) (PDB:3LV8),0,1
1446,"Uncharacterized conserved protein, DUF937 domain",1,1
1447,"Sterol desaturase/sphingolipid hydroxylase, fatty acid hydroxylase superfamily (ERG3) (PDB:4ZR0)",0,1
1448,"Uncharacterized conserved protein YjlB, cupin superfamily (YjlB)",1,1
1449,Adenylyl- and sulfurtransferase ThiI (thiamine and tRNA 4-thiouridine biosynthesis) (ThiI) (PDB:1VBK) (PUBMED:22773787),2,0
1450,Monomeric isocitrate dehydrogenase (IcdM) (PDB:1ITW),3,2
1451,"GMP synthase, PP-ATPase domain/subunit (GuaA2) (PDB:4WIM)",1,1
1452,"Multimeric flavodoxin WrbA, includes NAD(P)H:quinone oxidoreductase (WrbA) (PDB:4DY4)",1,1
1453,Inosine-uridine nucleoside N-ribohydrolase (URH1) (PDB:1EZR),0,1
1454,"FoF1-type ATP synthase, delta subunit (AtpH) (PDB:1ABV)",0,1
1455,D-lyxose ketol-isomerase (YdaE) (PDB:3MPB),1,0
1456,"Predicted regulator of Ras-like GTPase activity, Roadblock/LC7/MglB family (PDB:1J3W)",0,1
1457,"8-oxo-dGTP pyrophosphatase MutT and related house-cleaning NTP pyrophosphohydrolases, NUDIX family (MutT) (PDB:4V14)",2,1
1458,"Regulator of protease activity HflC, stomatin/prohibitin superfamily (HflC)",1,0
1459,"Predicted membrane transporter YfcC, affects glyoxylate shunt (YfcC) (PUBMED:24513124)",0,3
1460,"Type III secretory pathway, lipoprotein EscJ (EscJ) (PDB:1YJ7)",1,2
1461,Transcriptional regulator DhaR of acetoin/glycerol metabolism (AcoR) (PDB:4LRX),1,0
1462,"Uncharacterized conserved protein YeeX, DUF496 family (YeeX)",0,1
1463,Orotate phosphoribosyltransferase homolog (PyrE2),0,1
1464,Nitrate reductase cytochrome c-type subunit NapB (NapB) (PDB:1JNI),1,0
1465,Glycerol-3-phosphate responsive antiterminator (mRNA-binding) (GlpP) (PDB:1VKF),2,0
1466,"Mevalonate 5-phosphate dehydratase subunit 1, aconitase superfamily (modified mevalonate pathway) (AcnX1) (PUBMED:30224495)",1,1
1467,"ABC-type taurine transport system, ATPase component (TauB)",2,2
1468,"Ferritin-like DNA-binding protein, DPS (DNA Protection under Starvation) family (DPS) (PDB:2CLB) (PUBMED:28800583)",1,1
1469,"ABC-type molybdate transport system, ATPase component ModC (ModC)",1,1
1470,UDP-N-acetylmuramoylalanine-D-glutamate ligase (MurD) (PDB:1E0D),0,1
1471,"CMP-N-acetylneuraminic acid synthetase, NeuA/PseF family (NeuA) (PDB:1EYR)",1,1
1472,Glyoxylate carboligase (Gcl),0,1
1473,"Serine protease, subtilase family",2,0
1474,"Predicted restriction endonuclease, HNH family (PDB:6GHC)",0,2
1475,"ABC-type tungstate transport system, permease component TupA (TupB)",1,0
1476,5-deoxy-D-glucuronate isomerase (IolB) (PDB:2QJV),1,1
1477,"ABC-type antimicrobial peptide export system, ATPase component SapF (SapF)",1,0
1478,5-oxoprolinase subunit C/Allophanate hydrolase subunit 2 (PxpC) (PDB:3MML) (PUBMED:28830929),2,2
1479,DNA polymerase B elongation subunit (PolB) (PDB:6P1H),1,2
1480,2-iminoacetate synthase ThiH/Menaquinone biosynthesis enzymes MqnC and MqnE (ThiH) (PDB:4WCX) (PUBMED:18801996),4,1
1481,"Predicted ATP-dependent carboligase, ATP-grasp superfamily (PDB:3GAA)",1,1
1482,NADH:ubiquinone oxidoreductase subunit 3 (chain A) (NuoA) (PDB:3RKO),0,1
1483,"Uncharacterized protein MTH814, DUF2098 family",1,1
1484,"Curved DNA-binding protein CbpA, contains a DnaJ-like domain (CbpA)",1,1
1485,Acyl carrier protein phosphodiesterase (AcpH) (PUBMED:16107329),1,2
1486,Circularly permuted ATP-grasp protein (PDB:3N6X) (PUBMED:20023723),1,0
1487,"Uncharacterized conserved protein YjaG, DUF416 family (YjaG) (PDB:2Q9R)",1,0
1488,4-hydroxybenzoate polyprenyltransferase (UbiA) (PDB:4OD4) (PUBMED:28830929),1,2
1489,2-succinyl-5-enolpyruvyl-6-hydroxy-3-cyclohexene-1-carboxylate synthase (MenD) (PDB:5Z2P),1,1
1490,16S rRNA G1207 methylase RsmC (RsmC) (PDB:1DUS),0,3
1491,"ABC-type polysaccharide transport system, permease component (LplB) (PDB:4TQU)",1,0
1492,"Cbb3-type cytochrome oxidase, subunit 3 (CcoQ)",0,3
1493,"GTPase Era, involved in 16S rRNA processing (Era) (PDB:1EGA)",2,1
1494,Fe-S-cluster formation regulator IscX/YfhJ (IscX) (PDB:1UJ8) (PUBMED:16698547),1,0
1495,Preprotein translocase subunit SecF (SecF) (PDB:2FYH) (PUBMED:28830929),1,0
1496,Outer membrane lipoprotein SlyB (SlyB),3,1
1497,ParA-like ATPase involved in chromosome/plasmid partitioning or cellulose biosynthesis protein BcsQ (ParA) (PDB:6NOO),2,1
1498,"Uncharacterized conserved protein YydD, contains DUF2326 domain (YydB)",1,0
1499,"Uncharacterized peptidoglycan binding protein, contains LysM and FecR  domains",1,1
1500,"ABC-type taurine transport system, periplasmic component (TauA) (PDB:6SSY)",1,1
1501,Divalent cation tolerance protein CutA (CutA1) (PDB:1NAQ),1,0
1502,"Predicted ATPase, AAA+ superfamily",1,1
1503,"Uncharacterized sporulation membrane protein YrzE, contains DUF3792 domain (YrzE)",1,2
1504,"CRISPR/Cas system-associated protein Cas10, large subunit of type III CRISPR-Cas systems, contains HD superfamily nuclease domain (Cas10) (PDB:6IFN)",0,2
1505,"Uncharacterized conserved protein, RmlC-like cupin domain (RmlC)",0,2
1506,"Uncharacterized conserved protein YdbL, DUF1318 family (YdbL)",1,1
1507,"ABC-type proline/glycine betaine transport system, ATPase component (OpuBA)",0,1
1508,"Type II secretory pathway, PulJ/GspJ component (PulJ)",1,1
1509,F420-dependent methylenetetrahydromethanopterin dehydrogenase (Mtd) (PDB:1QV9),0,1
1510,Prolipoprotein diacylglyceryltransferase (Lgt) (PDB:5AZB),2,3
1511,HPt (histidine-containing phosphotransfer) domain (HPtr) (PDB:3IQT),1,1
1512,"Ethanolamine ammonia-lyase, small subunit (EutC) (PDB:5YSN)",1,0
1513,"ABC-type phosphate transport system, ATPase component (PstB)",0,2
1514,Hydrogenase/urease accessory protein HupE (HupE),2,2
1515,Predicted metalloendopeptidase (PepO) (PDB:1DMT),0,2
1516,"Uncharacterized OB-fold protein, contains Zn-ribbon domain (PDB:3IRB)",2,0
1517,"ABC-type transport system involved in cytochrome c biogenesis, permease component (CcmC)",1,2
1518,Homoserine kinase (ThrB) (PDB:1FWK),0,1
1519,Citrate lyase beta subunit (CitE) (PDB:4ROQ),3,1
1520,Predicted metal-dependent hydrolase,0,2
1521,Autotransporter adhesin AidA (AidA),0,1
1522,"Transcriptional regulator, CopY/TcrY family (CopY) (PDB:1OKR)",0,2
1523,Spore coat protein CotV/CotX (outer spore coat) (CotV) (PUBMED:8509331),1,2
1524,"Phage terminase, small subunit (XtmA) (PDB:4ZC3)",1,1
1525,Small acid-soluble spore protein SspL (SspL) (PUBMED:9852018;10333516),1,0
1526,"Uncharacterized conserved protein YoaH, UPF0181 family (yoaH) (PUBMED:20729861;23239623;22706199)",1,3
1527,"Secreted virulence factor YukE/EsxA, WXG100 family (EsxA) (PDB:3GVM) (PUBMED:15657139;24798022;27600772)",1,1
1528,"Hydroxyethylthiazole kinase, sugar kinase family (ThiM) (PDB:1C3Q)",2,0
1529,"Methyl coenzyme M reductase, gamma subunit (McorG) (PDB:5N1Q)",0,2
1530,Tellurium resistance protein TerA/TerD (TerA),3,0
1531,"ABC-type xylose transport system, permease component (XylH)",0,1
1532,Uncharacterized conserved protein (PDB:6C4L),2,2
1533,"ATP-dependent protease ClpP, protease subunit (ClpP) (PDB:1TG6)",2,1
1534,"MraZ, DNA-binding transcriptional regulator and inhibitor of RsmH methyltransferase activity (MraZ) (PDB:1N0E)",2,1
1535,Cell division ATPase FtsE (FtsE),0,1
1536,"Methyl coenzyme M reductase, alpha subunit (McorA) (PDB:1E6V)",1,1
1537,Predicted ABC-type ATPase or kinase,1,0
1538,"Predicted dioxygenase, 2-oxoglutarate and Fe-dependent (2OG-Fe) dioxygenase superfamily (PDB:3PL0)",0,1
1539,"Uncharacterized conserved protein, DUF2321 domain",1,0
1540,Uncharacterized membrane protein YeiB (YeiB),0,1
1541,Anti-anti-sigma regulatory factor (antagonist of anti-sigma factor) (SpoIIAA) (PDB:1AUZ),1,1
1542,Outer membrane protein OmpA and related peptidoglycan-associated (lipo)proteins (OmpA) (PDB:1OAP),1,2
1543,"Predicted acyltransferase, contains DUF342 domain",1,0
1544,CRISPR/Cas system-associated endoribonuclease Cas2 (Cas2) (PDB:2I0X),3,0
1545,"Thiazole synthase ThiGH, ThiG subunit (thiamin biosynthesis) (ThiG) (PDB:1TYG)",1,1
1546,"Chemotaxis response regulator CheB, contains REC and protein-glutamate methylesterase domains (CheB) (PDB:1A2O)",1,2
1547,Periplasmic subunit MlaC of the ABC-type intermembrane phospholipid transporter Mla (MlaC) (PDB:2QGU) (PUBMED:19383799),0,1
1548,Predicted flavoprotein YhiN (YhiN) (PDB:3V76),1,1
1549,Precorrin-6x reductase (CobK) (PDB:4X7G),0,1
1550,Outer membrane murein-binding lipoprotein Lpp (Lpp) (PDB:1EQ7),3,2
1551,"Lysylphosphatidylglycerol synthetase MprF, lysyl-tRNA-binding C-terminal domain (MprF2) (PDB:5VRV) (PUBMED:14702396;30563904)",1,1
1552,"ABC-type phosphate transport system, permease component (PstC)",0,1
1553,"Type IV secretory pathway, VirB9 components (VirB9)",3,0
1554,"Uncharacterized conserved protein, DUF2316 domain",1,0
1555,"Tagatose-1,6-bisphosphate aldolase non-catalytic subunit AgaZ/GatZ (GatZ) (PDB:2FIQ)",1,2
1556,"Uncharacterized protein, contains PhoU and TrkA_C domains (PDB:1VCT)",0,2
1557,S-adenosylmethionine synthetase (MetK) (PDB:1FUG),1,0
1558,"Predicted transcription regulator, contains HTH domain, MarR family",2,0
1559,"Uncharacterized conserved protein, DUF1284 domain",0,3
1560,Tryptophanase (TnaA) (PDB:1AX4),1,1
1561,"Predicted Fe-Mo cluster-binding protein, NifX family (NifX) (PDB:1EO1)",0,2
1562,"1,4-alpha-glucan branching enzyme (GlgB) (PDB:4LPC) (PUBMED:25871919)",1,0
1563,"Uncharacterized conserved protein domain, often C-terminal to DUF262",0,1
1564,"Pyruvate dehydrogenase complex, dehydrogenase (E1) component (AceE) (PDB:1L8A)",1,2
1565,2-keto-3-deoxy-L-rhamnonate aldolase RhmA (HpcH) (PDB:1DXE),4,2
1566,"Trk-type K+ transport system, membrane component (TrkG) (PDB:3PJZ)",1,0
1567,Glutamyl- or glutaminyl-tRNA synthetase (GlnS) (PDB:1EUQ),3,0
1568,Cell division GTPase FtsZ (FtsZ) (PDB:1FSZ),1,1
1569,"Predicted protease, Abi (CAAX) family",2,0
1570,D-mannonate dehydratase (UxuA) (PDB:1TZ9),2,0
1571,"Ribosome assembly protein YihI, activator of Der GTPase (YihI) (PUBMED:20434458)",3,0
1572,"Uncharacterized conserved protein YfaQ, DUF2300 domain (YfaQ)",1,0
1573,5-formyltetrahydrofolate cyclo-ligase (FAU1) (PDB:1SBQ),1,1
1574,Nitrous oxide reductase accessory protein NosL (NosL) (PDB:2HPU),1,0
1575,Isocitrate dehydrogenase (Icd) (PDB:1IDD),1,2
1576,"Predicted histidine transporter YuiF, NhaC family (YuiF) (PUBMED:15135544)",1,2
1577,"ABC-type nitrate/sulfonate/bicarbonate transport system, permease component (TauC)",1,3
1578,Energy-converting hydrogenase Eha subunit L (EhaL) (PUBMED:19495416),1,0
1579,Cytochrome c oxidase assembly protein CtaG (CtaG) (PUBMED:14766920),1,1
1580,Sulfur carrier protein ThiS (thiamine biosynthesis) (ThiS) (PDB:1F0Z),1,1
1581,"Predicted NTPase, NACHT family domain (NACHT)",1,0
1582,"Uncharacterized conserved protein, contains Zn-finger domain of CDGSH type (PDB:2QD0)",2,1
1583,Flagellar basal body-associated protein FliL (FliL),0,1
1584,"Xanthine dehydrogenase, molybdopterin-binding subunit XdhB (XdhB)",0,2
1585,"Uncharacterized conserved protein, DUF452 domain (PDB:5GNG)",1,2
1586,ATP:corrinoid adenosyltransferase (BtuR) (PDB:4HUT),0,1
1587,DNA repair ATPase RecN (RecN) (PDB:4AD8),0,1
1588,Adenine-specific DNA methylase,0,1
1589,Siderophore synthetase component IucA/IucC/SbnC (IucA) (PDB:2W02) (PUBMED:19775248),1,1
1590,Periplasmic regulator RcnB of Ni and Co efflux (RcnB) (PDB:2L1S),0,1
1591,"Methylphosphotriester-DNA--protein-cysteine methyltransferase (N-terminal fragment of Ada), contains Zn-binding and two AraC-type DNA-binding domains (AdaA) (PDB:1ADN)",1,0
1592,"Stage III sporulation protein SpoIIIAD, component of the engulfment complex (SpoIIIAD)",0,1
1593,Endoglucanase Acf2 (Acf2),2,0
1594,Phosphorylcholine metabolism protein LicD (LicD),1,3
1595,"Heme/copper-type cytochrome/quinol oxidase, subunit 4 (CyoD)",1,2
1596,Glycerol kinase (GlpK) (PDB:2ZF5),1,2
1597,"DNA topoisomerase I, ssDNA-binding Zn-finger and Zn-ribbon domains (YrdD) (PDB:1YUA)",2,2
1598,Phosphopantetheinyl transferase (Sfp) (PDB:1QR0),2,0
1599,Radical SAM superfamily enzyme PflX (PflX),0,1
1600,Predicted PurR-regulated permease PerM (PerM),0,2
1601,Spore coat protein CotD (CotD) (PUBMED:2821284),1,0
1602,"Metal-dependent hydrolase, beta-lactamase superfamily II (PDB:2P4Z)",0,2
1603,3-oxoacyl-(acyl-carrier-protein) synthase (FabB) (PDB:2UV8) (PUBMED:21652641),0,1
1604,"Uncharacterized conserved protein, DUF2099 domain",1,0
1605,"Asparagine N-glycosylation enzyme, membrane subunit Stt3 (Stt3) (PDB:2LGZ)",1,2
1606,Molybdopterin biosynthesis enzyme MoaB/MogA (MoaB) (PDB:1DI6) (PUBMED:32239579),3,1
1607,Predicted extracellular nuclease,1,0
1608,"Uncharacterized conserved protein, contains GBA2_N and DUF608 domains (PDB:5BVU)",2,2
1609,Sulfate transporter CysZ (CysZ) (PDB:3TX3) (PUBMED:24657232),1,1
1610,"ABC-type enterobactin transport system, permease component (FepG)",1,0
1611,Ribosomal protein RSM22 (predicted mitochondrial rRNA methylase) (Rsm22),1,1
1612,"Cell fate regulator YaaT, PSP1 superfamily (controls sporulation, competence, biofilm development) (YaaT) (PUBMED:23490197)",1,0
1613,Glutaredoxin-related protein (GrxD) (PDB:1YKA),2,1
1614,Aspartate-semialdehyde dehydrogenase (Asd) (PDB:1BRM),1,2
1615,"Colicin E2 tolerance protein CbrC, UPF0167 family (CbrC) (PUBMED:20418396)",1,0
1616,"ABC-type molybdenum transport system, ATPase component ModF/photorepair protein PhrA (ModF) (PDB:2IHY)",0,2
1617,Serine/threonine protein phosphatase PrpC (PTC1) (PDB:6IHL),0,2
1618,"Ethanolamine utilization protein EutS, microcompartment shell protein (EutS) (PDB:3IA0)",2,1
1619,"Uncharacterized conserved protein YceH, UPF0502 family (YceH) (PDB:3BZ6)",2,1
1620,"Archaeal DNA polymerase II, small subunit/DNA polymerase delta, subunit B (HYS2) (PDB:3E0J)",1,1
1621,Flavoprotein (flavin reductase) subunit CysJ of sulfite and N-hydroxylaminopurine reductases (CysJ) (PDB:1YKG) (PUBMED:20118259),1,1
1622,Uncharacterized lipoprotein YajG (YajG),0,1
1623,Type IV pilus assembly protein PilN (PilN),2,1
1624,Peptide chain release factor RF-3 (PrfC) (PDB:3UOQ),1,1
1625,Urease accessory protein UreF (UreF) (PDB:3SF5),1,0
1626,Anaerobic C4-dicarboxylate transporter (DcuA),1,1
1627,"Light-independent protochlorophyllide reductase subunit N, BchN (=ChlN) (BchN) (PDB:2XDQ)",1,0
1628,Xaa-Pro aminopeptidase (PepP) (PDB:1A16),1,0
1629,Predicted membrane GTPase TypA/BipA involved in stress response (TypA) (PDB:5A9V),0,2
1630,"NAD(P)H-hydrate repair enzyme Nnr, NAD(P)H-hydrate epimerase domain (Nnr1) (PDB:3RRB)",0,1
1631,"Malate/lactate/ureidoglycolate dehydrogenase, LDH2 family (AllD) (PDB:1NXU)",1,0
1632,"Uncharacterized protein, contains ferritin-like DUF455 domain",2,0
1633,Recombinational DNA repair protein RecO (RecF pathway) (RecO) (PDB:1U5K),1,1
1634,"Uncharacterized copper-binding protein, cupredoxin-like subfamily",2,0
1635,"ATP-dependent helicase YprA,  contains C-terminal metal-binding DUF1998 domain (YprA)",1,0
1636,"ABC-type transport system involved in cytochrome c biogenesis, permease component (CcmB)",0,1
1637,"Succinate dehydrogenase/fumarate reductase, Fe-S protein subunit (SdhB/FrdB) (PDB:6LUM)",1,0
1638,"Predicted nuclease of restriction endonuclease-like (RecB) superfamily,  DUF1016 family (YhcG) (PUBMED:16011798)",2,2
1639,N-acetylmuramoyl-L-alanine amidase (AmiC) (PDB:1JWQ),0,2
1640,"Chitinase, GH19 family (GH19) (PDB:1WVU) (PUBMED:17010167)",2,0
1641,Mu-like prophage I protein,2,0
1642,"FoF1-type ATP synthase, epsilon subunit (AtpC) (PDB:3OAA) (PUBMED:29149348;30304218)",0,1
1643,Phage protein D (gpD),1,1
1644,3-keto-L-gulonate-6-phosphate decarboxylase (UlaD) (PDB:3F4W),1,1
1645,DNA mismatch repair protein MutH (MutH) (PDB:1AZO),0,1
1646,"Imelysin-like iron-regulated protein IrpA, duplicated M75 peptidase-like domain (IrpA) (PUBMED:21799754)",1,2
1647,"Protoporphyrinogen IX oxidase, menaquinone-dependent (flavodoxin domain) (HemG) (PUBMED:17873039)",1,1
1648,"Predicted transglycosylase, contains SLT domain (SLT)",0,1
1649,Predicted protein tyrosine phosphatase,2,2
1650,"Predicted NTP pyrophosphohydrolase, NUDIX family",2,2
1651,Cysteine synthase (CysK) (PDB:1FCJ),3,1
1652,Ribosomal protein L14E/L6E/L27E (RPL14A) (PDB:3IZS),2,3
1653,"Sugar or nucleoside kinase, ribokinase family (RbsK) (PDB:2QCV)",0,1
1654,"Uncharacterized membrane protein, DMT/DUF486 family (PUBMED:21873409)",1,1
1655,Heme A synthase (CtaA) (PDB:6A2J),1,0
1656,Signal transduction histidine kinase regulating C4-dicarboxylate transport system (PDB:4GCZ),1,0
1657,"Phosphotransferase system, mannitol-specific IIBC component (MtlA) (PDB:1VRV)",1,0
1658,Adenylosuccinate lyase (PurB) (PDB:2HVG),1,1
1659,"DNA-binding transcriptional regulator of sugar metabolism, DeoR/GlpR family (GlpR)",0,1
1660,Purine-cytosine permease or related protein (CodB),2,0
1661,tRNA(Met) C34 N-acetyltransferase TmcA (TmcA) (PDB:2ZPA),3,1
1662,"Inosine/xanthosine triphosphate pyrophosphatase, all-alpha NTP-PPase family (RdgB) (PDB:1B78)",1,0
1663,Triosephosphate isomerase (TpiA) (PDB:1HG3),0,3
1664,"GTP 3',8-cyclase (molybdenum cofactor biosynthesis protein MoaA) (MoaA) (PDB:1TV7)",0,2
1665,L-asparaginase/archaeal Glu-tRNAGln amidotransferase subunit D (AnsA) (PDB:1ZQ1),1,0
1666,"Uncharacterized conserved protein, DUF2097 domain",1,1
1667,Ketopantoate hydroxymethyltransferase (PanB) (PDB:3VAV),3,0
1668,Panthothenate kinase (CoaA) (PDB:2GA8),2,0
1669,"5-methylthioribose/5-deoxyribulose 1-phosphate isomerase (methionine salvage pathway), a paralog of eIF-2B alpha subunit (MtnA) (PDB:1T5O) (PUBMED:31950558)",0,2
1670,"L-lactate utilization protein LutB, contains a ferredoxin-type domain (LutB)",3,0
1671,"Uncharacterized conserved protein, DUF1223 domain (PDB:2AXO)",2,0
1672,Sporulation protein YabP (YabP) (PUBMED:11283287;15231775),3,0
