,feature_name,cultured_feature_counts,uncultured_feature_counts
3357,"2-Methylisocitrate lyase and related enzymes, PEP mutase family (PrpB) (PDB:1XG3)",7,0
3358,"Predicted oligopeptide transporter, OPT family (OPT)",7,1
3359,"Uncharacterized membrane protein YdcZ, DUF606 family (ydcZ)",5,2
3360,N-acetylglutamate kinase (ArgB) (PDB:3S6G),8,0
3361,"Uncharacterized membrane protein YgdD, TMEM256/DUF423 family (YgdD)",5,0
3362,"Predicted glycosyl hydrolase, contains GH57 and DUF1957 domains (PDB:1UFA)",4,0
3363,Phenylalanyl-tRNA synthetase alpha subunit (PheS) (PDB:3L4G),3,0
3364,"Acetyltransferase, isoleucine patch superfamily (WbbJ)",6,0
3365,"Stage II sporulation protein SpoIIP, required for dissolution of the septal cell wall (SpoIIP)",4,0
3366,"Cell wall-associated hydrolase, NlpC_P60 family (NlpC) (PDB:2EVR)",5,0
3367,"Xanthine dehydrogenase, molybdopterin-binding subunit XdhB (XdhB)",6,0
3368,4-(hydroxymethyl)-2-furancarboxaldehyde phosphate synthase MfnB (MfnB) (PDB:4RC1) (PUBMED:25905665),8,0
3369,"CRISPR-Cas system type III CSM-effector complex subunit Csm4, RAMP superfamily Cas5 group (Csm4) (PDB:4QTS)",8,0
3370,UDP-N-acetylglucosamine pyrophosphorylase (QRI1) (PDB:1JV1),7,0
3371,"Alpha-amylase/alpha-mannosidase, GH57 family (PDB:1K1W)",6,0
3372,Uncharacterized Zn-ribbon-containing protein (PhnA) (PDB:2AKK),6,0
3373,DNA repair photolyase (SplB),8,0
3374,"Stage II sporulation protein SpoIIR, required for processing of pro-sigma-E (SpoIIR) (PUBMED:7892217;24098137)",6,0
3375,Polyisoprenoid-binding periplasmic protein YceI (YceI) (PDB:1WUB) (PUBMED:15741337;20236316),8,0
3376,"Beta-glucanase, GH16 family (BglS) (PDB:1AJK)",6,0
3377,"Uncharacterized conserved protein YrzB, UPF0473 family (YrzB)",6,1
3378,Uncharacterized integral membrane protein YrvD (YrvD) (PUBMED:16737961),6,0
3379,"2',3'- and 3',5'-cNMP phosphodiesterase YmdB, calcineurin family (YmdB) (PDB:2CV9) (PUBMED:24163345)",7,0
3380,Lantibiotic modifying enzyme (LcnDR2) (PDB:5DZT),6,0
3381,"ATP-dependent helicase YprA,  contains C-terminal metal-binding DUF1998 domain (YprA)",7,0
3382,"Neuraminidase (sialidase) NanH, contains C-terminal autotransporter domain (NanH) (PDB:1EUT)",6,2
3383,"Membrane regulatory protein PfoR, PTS_EIIC_2 domain (does not regulate perfringolysin expression) (PfoR) (PUBMED:11889112)",8,0
3384,"Uncharacterized conserved protein YqgC, DUF456 family (YqgC)",8,0
3385,Molecular chaperone DnaK (HSP70) (DnaK) (PDB:3I33),7,0
3386,Predicted lipoprotein involved in lipopolysaccharide assembly,8,0
3387,Ribosomal protein S17E (RPS17A) (PDB:1RQ6),6,0
3388,Spore coat protein YraE/YraG (YraG) (PUBMED:9141695;9308178),8,0
3389,Type II secretory pathway component GspD/PulD (secretin) (PulD) (PDB:5TCQ),7,0
3390,Leu/Phe-tRNA-protein transferase (Aat) (PDB:2CXA),8,0
3391,"Hydroxypyruvate/dehydroerythronate isomerase, Hyi/OtnI family (Hyi) (PDB:1K77) (PUBMED:27402745)",8,0
3392,"Prefoldin, chaperonin cofactor (GimC) (PDB:1FXK)",8,0
3393,"Uncharacterized conserved protein associated with RNAses G and E,  UPF0374/DUF402 family (YgaC)",7,0
3394,"Uncharacterized protein, DUF1786 family, actin-like ATPase superfamily (AF0413)",7,0
3395,"Ni,Fe-hydrogenase I small subunit (HyaA) (PDB:6FPI)",8,0
3396,Membrane protein involved in the export of O-antigen and teichoic acid (RfbX),5,2
3397,Translation elongation factor EF-Ts (Tsf) (PDB:1EFU),7,0
3398,Uncharacterized conserved protein probably involved in high-affinity Fe2+ transport (Tpd) (PDB:2O6C) (PUBMED:18456808),8,0
3399,L-arabinose isomerase (AraA) (PDB:2AJT),5,0
3400,"DNA polymerase III sliding clamp (beta) subunit, PCNA homolog (DnaN) (PDB:1JQJ)",6,1
3401,"ABC-type guanosine uptake system NupNOPQ, ATPase component NupO (NupO) (PUBMED:21926227)",8,0
3402,"Radical SAM superfamily enzyme YgiQ, UPF0313 family (YgiQ) (PDB:6FD2)",5,0
3403,Outer membrane receptor for Fe3+-dicitrate (FecA) (PDB:1KMP),5,1
3404,Predicted metal-dependent peptidase,6,0
3405,"Uncharacterized 2Fe-2S and 4Fe-4S clusters-containing protein, contains DUF4445 domain (PDB:4C1N)",7,0
3406,"8-oxo-dGTP pyrophosphatase MutT and related house-cleaning NTP pyrophosphohydrolases, NUDIX family (MutT) (PDB:4V14)",8,0
3407,NAD(P)H dehydrogenase cyanobacteria/chloroplast-specific assembly factor CRR6 (CRR6) (PUBMED:23725563),4,1
3408,"Uncharacterized conserved protein ECs_4300, contains TPR-like domain",6,0
3409,Transposase InsO and inactivated derivatives (Tra5),7,0
3410,NaMN:DMB phosphoribosyltransferase (CobT) (PDB:1D0S),8,0
3411,RecA/RadA recombinase (RecA) (PDB:1B22),7,1
3412,tRNA A37 threonylcarbamoyltransferase TsaD (TsaD) (PDB:3ENO) (PUBMED:23072323;21285948;32385138),6,1
3413,"DNA-binding transcriptional regulator YdaS, prophage-encoded, Cro superfamily (YdaS)",4,0
3414,"Uncharacterized membrane protein YheB, UPF0754 family (YheB)",7,0
3415,"Redox-sensitive bicupin YhaK, pirin superfamily (YhaK) (PDB:1J1L) (PUBMED:18561187)",7,0
3416,"Proline 4-hydroxylase (includes Rps23 Pro-64 3,4-dihydroxylase Tpa1), contains SM-20 domain (EGL9) (PDB:2G19)",7,1
3417,Lipoprotein-anchoring transpeptidase ErfK/SrfK (ErfK) (PDB:4LZH),5,0
3418,"ABC-type transport system involved in cytochrome bd biosynthesis, fused ATPase and permease components (CydC)",6,0
3419,"Uncharacterized conserved protein YciU, UPF0263 family (YciU) (PDB:1NNV)",8,0
3420,4-hydroxybenzoate synthetase (chorismate-pyruvate lyase) (UbiC) (PDB:1FW9),7,0
3421,"Uncharacterized conserved protein YabN, contains tetrapyrrole methylase and MazG-like pyrophosphatase domain (YabN)",5,0
3422,Uncaracterized surface protein containing fasciclin (FAS1) repeats (FAS1),6,0
3423,5-carboxymethyl-2-hydroxymuconate isomerase (HpaF) (PDB:1OTG),4,1
3424,"CRISPR-Cas system type II-D effector complex subunit Csx10, RAMP superfamily Cas5 group (Csx10gr5)",4,0
3425,Putative Zn-dependent protease,4,1
3426,NAD(P)H-dependent FMN reductase (SsuE) (PDB:6DQI),6,0
3427,Mu-like prophage tail sheath protein gpL (gpL),7,0
3428,"Predicted  nucleic acid-binding protein, contains Zn-ribbon domain (includes truncated derivatives)",8,0
3429,Glycine cleavage system protein T (aminomethyltransferase) (GcvT) (PDB:2GAH) (PUBMED:25433025;25505271),8,0
3430,"Na+-translocating ferredoxin:NAD+ oxidoreductase  RNF, RnfD subunit (RnfD)",6,1
3431,"Flp pilus assembly protein TadD, contains TPR repeats (TadD) (PDB:3WXX)",7,0
3432,"Branched-chain amino acid ABC-type transport system, permease component (LivH)",8,0
3433,"Acid phosphatase, class B (AphA) (PDB:1N8N)",6,0
3434,"Uncharacterized membrane protein YkvA, DUF1232 family (YkvA)",8,0
3435,Stage III sporulation protein SpoIIIAA (SpoIIIAA),7,0
3436,"Protoporphyrinogen IX oxidase, menaquinone-dependent (flavodoxin domain) (HemG) (PUBMED:17873039)",5,1
3437,"ATP-dependent RNA circularization protein, DNA/RNA ligase (PAB1020)  family (PDB:2VUG) (PUBMED:18511537)",5,0
3438,"Uncharacterized membrane protein, DUF485 family (YjcH)",5,0
3439,Allantoicase (Alc) (PDB:1O59),7,0
3440,"RNA polymerase-interacting regulator, CarD/CdnL/TRCF family (CdnL) (PDB:4ILU)",7,0
3441,Beta-ribofuranosylaminobenzene 5'-phosphate synthase (methanopterin biosynthesis) (bRFAP) (PDB:6YQQ) (PUBMED:16817932),8,0
3442,Flagellar motor component MotA (MotA),5,0
3443,"Uncharacterized membrane protein, DUF368 family",4,0
3444,Malic enzyme (SfcA) (PDB:1DO8),5,2
3445,Adenylosuccinate lyase (PurB) (PDB:2HVG),7,0
3446,Dihydrofolate reductase (FolA) (PDB:1DDR),4,1
3447,Stand-alone amidase domain (YjcM1),7,0
3448,"N-hydroxylaminopurine reductase YiiM, contains MOSC domain (YiiM) (PDB:1O65) (PUBMED:18312271;29459651)",5,0
3449,Beta-lactamase class D (YbxI) (PDB:5CTN),8,0
3450,Carboxylesterase type B (PnbA) (PDB:1K4Y),6,0
3451,"CRISPR-Cas system type I-F effector complex subunit Cas7f/Csy3,  RAMP superfamily (Cas7f)",5,1
3452,"Predicted cysteine peptidase, C39 family (YvpB) (PDB:3ERV)",2,1
3453,Phosphotransferase system sorbitol-specific IIA component (SrlB) (PDB:2F9H),7,0
3454,"Cell fate regulator YmcA, YheA/YmcA/DUF963 family (controls sporulation, competence, biofilm development) (YmcA) (PDB:6PRH) (PUBMED:23490197)",7,0
3455,Adenylosuccinate synthase (PurA) (PDB:1ADE),8,0
3456,"3-Methyladenine DNA glycosylase, HhH-GPD/Endo3 superfamily (HP0602) (PDB:1PU6) (PUBMED:14517230;20410075)",6,1
3457,"Glycosyltransferase, GT2 family (WcaE) (PDB:2Z86)",7,0
3458,Sigma54-dependent transcription regulator containing an AAA-type ATPase domain and a DNA-binding domain (RtcR),5,1
3459,"Phage-related replication protein YjqB, UPF0714/DUF867 family (YjqB) (PDB:3A9L)",5,0
3460,tRNA G37 N-methylase Trm5 (Trm5) (PDB:2YX1),5,1
3461,Predicted hydrolase of the alpha/beta superfamily (YbbA) (PDB:3GFF),8,0
3462,"Predicted phage recombinase, RecA/RadA family",7,0
3463,"Membrane-associated protease RseP, regulator of RpoE activity (RseP)",8,0
3464,"Uncharacterized conserved protein YyaL, SSP411 family, contains thoiredoxin and six-hairpin glycosidase-like domains (YyaL) (PDB:3IRA)",8,0
3465,Proline racemase/hydroxyproline epimerase (PrdF) (PDB:1TM0) (PUBMED:17849014),5,0
3466,"Uncharacterized conserved protein YxeA, DUF1093 family (YxeA) (PDB:2K5Q)",8,0
3467,CO dehydrogenase nickel-insertion accessory protein CooC1 (CooC) (PUBMED:15466042),6,1
3468,"General stress protein YciG, contains tandem KGG domains (GsiB)",7,0
3469,Ribosomal protein L7Ae or related RNA K-turn-binding protein (Rpl7Ae) (PDB:4LCK),6,1
3470,Glutamate 5-kinase (ProB) (PDB:2W21),8,0
3471,Outer membrane receptor for monomeric catechols (Fiu),3,2
3472,Cytochrome c oxidase assembly protein Cox11 (COX11) (PDB:1SO9),7,0
3473,Small nuclear ribonucleoprotein (snRNP) homolog (LSM1) (PDB:1B34),7,0
3474,Peptidoglycan hydrolase (amidase) enhancer domain SpoIID (SpoIID),7,0
3475,Nitric oxide response protein NnrS (NnrS) (PUBMED:26452555;29934335;31481951),5,0
3476,Formyltetrahydrofolate synthetase (MIS1) (PDB:1EG7),5,1
3477,"Uncharacterized conserved protein, DUF2248 family",6,0
3478,"Stage VI sporulation protein SpoVIF, required for heat resistance (SpoVIF) (PUBMED:14523132;14702409)",8,0
3479,Glycerol-3-phosphate dehydrogenase (GlpA) (PDB:2RGH),7,0
3480,Maltooligosyltrehalose synthase (TreY),8,0
3481,Na+/H+-dicarboxylate symporter (GltP) (PDB:1XFH),7,0
3482,Phage-related tail fiber protein (PDB:6CL6),6,1
3483,S-adenosylmethionine:tRNA-ribosyltransferase-isomerase (queuine synthetase) (QueA) (PDB:1VKY),4,1
3484,Spore coat protein GerQ/YwdL (inner spore coat) (GerQ) (PUBMED:16751597;19933362),6,1
3485,"Type VI protein secretion system component TssA1/VasJ/EvfE, contains ImpA_N domain (TssA1) (PDB:6RIU)",8,0
3486,Xaa-Pro aminopeptidase (PepP) (PDB:1A16),6,0
3487,"Glucosamine 6-phosphate synthetase, contains amidotransferase and phosphosugar isomerase domains (GlmS) (PDB:2J6H)",3,1
3488,Replicative DNA helicase (DnaB) (PDB:1B79),7,0
3489,"Uncharacterized conserved protein YdbL, DUF1318 family (YdbL)",4,0
3490,"Ribonuclease BN, tRNA processing enzyme (ElaC) (PDB:1WW1)",7,0
3491,Phage portal protein BeeE (BeeE),7,0
3492,"Uncharacterized conserved protein, DUF871 domain (PDB:1X7F)",7,0
3493,"Mg2+ and Co2+ transporter CorC, contains CBS pair and CorC-HlyC domains (CorC) (PDB:4HG0) (PUBMED:1779764)",8,0
3494,"Predicted acetyltransferase, GNAT superfamily (YidJ) (PDB:1R57)",7,1
3495,"Nucleotide monophosphate nucleosidase PpnN/YdgH, Lonely Guy (LOG) family (PpnN) (PDB:2PMB) (PUBMED:25728768;27941785;31023582;31420341)",7,0
3496,"CRISPR/Cas system-associated protein Cas5, RAMP superfamily (Cas5)",8,0
3497,Acyl-carrier protein (citrate lyase gamma subunit) (CitD),6,0
3498,"Uncharacterized conserved protein, DUF166 domain",8,0
3499,"Mn2+ or Fe2+ transporter, NRAMP family (MntH) (PDB:5KTE)",8,0
3500,Glutamate-1-semialdehyde aminotransferase (HemL) (PDB:2CFB),8,0
3501,"ABC-type multidrug transport system, ATPase and permease component (MdlB) (PDB:2HYD)",7,1
3502,"Predicted Zn-dependent peptidase, M16 family (PqqL) (PDB:6OFS)",5,0
3503,Alpha-D-ribose 1-methylphosphonate 5-triphosphate synthase subunit PhnG (PhnG) (PDB:4XB6),6,0
3504,Stage II sporulation protein SpoIIB (spatial and temporal regulation of the dissolution of septal peptidoglycan during engulfment) (SpoIIB) (PUBMED:8419299),5,0
3505,Transcriptional regulators containing an AAA-type ATPase domain and a DNA-binding domain (PspF),7,0
3506,NhaP-type Na+/H+ or K+/H+ antiporter (NhaP) (PDB:4CZB),7,1
3507,Outer membrane porin OmpC/OmpF/PhoE (OmpC) (PDB:1PHO),8,0
3508,"Alcohol dehydrogenase YqhD, Fe-dependent ADH family (YqdH) (PDB:1OJ7)",7,0
3509,"Uncharacterized conserved protein, contains DUF4213 and DUF364 domains (PDB:3L5O)",8,0
3510,"Iron-guanylylpyridinol (FeGP) cofactor biosynthesis protein, fibrillarin family (HcgG) (PUBMED:25882909)",6,0
3511,Peroxiredoxin (Bcp) (PDB:5IPH),8,0
3512,Methionyl-tRNA synthetase (MetG) (PDB:1A8H),8,0
3513,"Uncharacterized conserved protein YmfQ in lambdoid prophage, DUF2313 family (YmfQ)",4,0
3514,"VapC family ribonuclease, contains PIN domain (VapC) (PDB:4XGQ)",6,0
3515,Galactose-1-phosphate uridylyltransferase (GalT2),7,0
3516,"Cell division protein DamX, binds to the septal ring, contains C-terminal SPOR domain (DamX)",8,0
3517,"DNA repair protein RadA/Sms, contains AAA+ ATPase domain (Sms) (PDB:5LKM) (PUBMED:30877841)",7,0
3518,"Cyclic di-GMP-binding flagellar brake protein FlgZ/YcgR, contains PilZNR(YcgR) and PilZ domains (YcgR) (PDB:5Y6F)",6,0
3519,"Multisubunit Na+/H+ antiporter, MnhC subunit (MnhC) (PDB:6CFW)",5,0
3520,"Trk-type K+ transport system, membrane component (TrkG) (PDB:3PJZ)",5,0
3521,Molybdopterin biosynthesis enzyme MoaB/MogA (MoaB) (PDB:1DI6) (PUBMED:32239579),6,0
3522,Chromosome segregation ATPase Smc (Smc) (PDB:5XG3),7,0
3523,Predicted nucleotidyltransferase,7,0
3524,Glutamine amidotransferase related to the GATase domain of CobQ (PDB:5N9M),5,1
3525,Signal transduction histidine kinase (PDB:2QHK),2,1
3526,Broad specificity polyphosphatase and 5'/3'-nucleotidase SurE (SurE) (PDB:2V4N),4,0
3527,"Photosystem II reaction center D2, PsbD (PsbD) (PDB:1S5L) (PUBMED:20558739;25043005)",6,1
3528,Sporulation-specific protease YabG (YabG) (PUBMED:10714992;16751597),6,0
3529,"Uncharacterized conserved protein YeeX, DUF496 family (YeeX)",7,0
3530,Repressor of nif and glnA expression (PDB:3NEK),6,0
3531,Uncharacterized conserved protein MJ1451,8,0
3532,Phosphoribosylanthranilate isomerase (TrpF) (PDB:1DL3),7,0
3533,2-succinyl-5-enolpyruvyl-6-hydroxy-3-cyclohexene-1-carboxylate synthase (MenD) (PDB:5Z2P),8,0
3534,"DNA-binding global transcriptional regulator BolA, affects cell shape, cell division and biofilm formation (BolA) (PDB:2DHM) (PUBMED:19111750;2569159)",6,0
3535,"6-phosphogluconolactonase, cycloisomerase 2 family (Pgl) (PDB:1JOF)",8,0
3536,Alkaline phosphatase (PhoA) (PDB:1AJA),8,0
3537,"RocR-type transcriptional regulator, contains PAS, AAA-type ATPase, and DNA-binding Fis domains (RocR)",6,0
3538,"ABC-type amino acid transport/signal transduction system, periplasmic component/domain (HisJ) (PDB:1GGG)",6,0
3539,CRISPR-Cas system type I-F effector complex large subunit Cas8f (Cas8f),7,0
3540,Spore coat protein CotW (outer spore coat) (CotW) (PUBMED:8509331),6,0
3541,DNA-binding protein H-NS (Hns) (PDB:1HNR),8,0
3542,Ribonucleotide reductase alpha subunit (NrdA) (PDB:1R1R),7,0
3543,"Uncharacterized conserved protein, DUF1810 family (Mll0975) (PDB:2JEK) (PUBMED:17142896)",7,0
3544,"Binding protein subunit MlaB of the ABC-type intermembrane phospholipid transporter Mla, contains STAS domain (MlaB)",7,0
3545,dCTP deaminase (Dcd) (PDB:1XS1),5,0
3546,"Adenine-specific DNA glycosylase, acts on AG and A-oxoG pairs (MutY) (PDB:1KG2)",4,1
3547,"Transcriptional regulator, middle operon regulator (Mor) family (Mor) (PDB:1RR7)",7,0
3548,"Zn-dependent metallopeptidase, zincin/DUF2342 superfamily (Zincin) (PDB:3CMN) (PUBMED:23671590)",7,0
3549,Epoxyqueuosine reductase QueH (tRNA modification) (QueH) (PUBMED:28128549),6,0
3550,tRNA G37 N-methylase TrmD (TrmD) (PDB:1P9P),7,0
3551,Tryptophan synthase beta chain (TrpB) (PDB:2DH5),7,0
3552,ATP-dependent Zn proteases (HflB) (PDB:1LV7),6,1
3553,"K+/H+ antiporter KhtSTU, c-di-AMP-binding regulatory subunit KhtT, contains RCK_C (TrkA_C) domain (KhtT) (PDB:4J90) (PUBMED:24330391;31061098)",8,0
3554,NADPH:quinone reductase or related Zn-dependent oxidoreductase (Qor) (PDB:2VCY),4,0
3555,"Stage II sporulation protein SpoIIQ, required for engulfement (SpoIIQ) (PDB:3TUF) (PUBMED:9150240;9140963;10781563;15044948;15574594;15882622;15752199;16164552;16959571;17824930;18077456;18485064;18812514)",4,0
3556,"Phosphoaspartate phosphatase CheZ, dephosphorylates CheY~P (CheZ) (PDB:1KMI)",8,0
3557,5-(aminomethyl)-3-furanmethanol-phosphate kinase MfnE (methanofuran biosynthesis) (MfnE) (PUBMED:26100040),8,0
3558,"UDP:flavonoid glycosyltransferase YjiC, YdhE family (YjiC) (PDB:2ACV) (PUBMED:23974133)",8,0
3559,S-formylglutathione hydrolase FrmB (FrmB) (PDB:1DQY),7,0
3560,Ferredoxin subunit of nitrite reductase or a ring-hydroxylating dioxygenase (NirD) (PDB:1FQT) (PUBMED:23844911),6,0
3561,"Inosine/xanthosine triphosphate pyrophosphatase, all-alpha NTP-PPase family (RdgB) (PDB:1B78)",8,0
3562,"Acetyl-CoA carboxylase, carboxyltransferase component (MmdA) (PDB:1OD2)",7,0
3563,Antitoxin component MazE of the MazEF toxin-antitoxin module (MazE) (PDB:1MVF),6,0
3564,Lipid II:glycine glycyltransferase (Peptidoglycan interpeptide bridge formation enzyme) (FmhB) (PDB:1LRZ),8,0
3565,Kynureninase (Bna5),8,0
3566,"Uncharacterized conserved protein, DUF2252 family",8,0
3567,"Uncharacterized N-terminal domain of tricorn protease, contains WD40 repeats",7,1
3568,dsRNA-specific ribonuclease (Rnc) (PDB:1DI2),6,0
3569,"S-layer protein MJ0795, predicted component of type IV pili-like system (MJ0795)",6,0
3570,"Predicted redox protein with CxxCxxC motif, DUF116 family (PUBMED:25583072)",7,1
3571,"Uncharacterized conserved protein, DUF1501 family",7,1
3572,N-acetylmuramoyl-L-alanine amidase CwlA (CwlA),7,0
3573,RNA polymerase subunit RPABC4/transcription elongation factor Spt4 (Spt4) (PDB:1RYQ),6,1
3574,"Uncharacterized conserved protein, UPF0335 family (PDB:6CFY)",6,0
3575,"Uncharacterized conserved protein YhhL, DUF1145 family (YhhL)",6,0
3576,Dihydroorotase or related cyclic amidohydrolase (AllB) (PDB:1J79),7,1
3577,Bacterioferritin-associated ferredoxin (Bfd) (PDB:6E6R),5,0
3578,N-Dimethylarginine dimethylaminohydrolase (DdaH) (PDB:6LRH),5,0
3579,Energy-converting hydrogenase Eha subunit G (EhaG) (PUBMED:19495416),7,0
3580,"Succinate dehydrogenase/fumarate reductase, Fe-S protein subunit (SdhB/FrdB) (PDB:6LUM)",7,0
3581,"Ribosome-binding ATPase YchF, GTP1/OBG family (GTP1) (PDB:2DWQ) (PUBMED:21527254)",7,1
3582,Dipicolinate synthase subunit B (sporulation protein SpoVFB) (DpaB) (PDB:3MCU) (PUBMED:8098035;8345520),5,1
3583,Uncharacterized membrane protein (PUBMED:15623504),7,0
3584,"Zn-dependent peptidase, M16 (insulinase) family (Cym1) (PDB:2FGE)",8,0
3585,Outer membrane translocation and assembly module TamA (TamA) (PDB:4BZA),6,0
3586,"Sensor histidine kinase, LytS/YehU family (LytS)",5,2
3587,"Cysteine desulfurase/Cysteine sulfinate desulfinase IscS or related enzyme, NifS family (NifS) (PDB:4IXO) (PUBMED:22773787;25825430)",7,0
3588,"Predicted RNA-binding protein, contains EVE domain (EVE) (PDB:1ZCE) (PUBMED:32652237)",6,0
3589,Predicted transcriptional regulator (PDB:6CYJ),8,0
3590,Deoxycytidylate deaminase (ComEB) (PDB:2HVV) (PUBMED:25746996;31954084),6,1
3591,Glutaredoxin 2 (GrxB) (PDB:1G7O),3,1
3592,Porphobilinogen deaminase (HemC) (PDB:1AH5),3,1
3593,Sensor histidine kinase DipB regulating citrate/malate metabolism (CitA),8,0
3594,Spore germination protein GerPA/GerPF (inner spore coat) (GerPA) (PUBMED:10715007),6,0
3595,Phage protein U,5,0
3596,Thiamine pyrophosphokinase (ThiN) (PDB:1IG0),8,0
3597,"Predicted metal-dependent hydrolase, phosphotriesterase family (Php) (PDB:1BF6)",8,0
3598,Opacity protein LomR and related surface antigens (LomR) (PDB:1Q9F),7,0
3599,Uncharacterized conserved protein (PDB:2FSQ),8,0
3600,"ABC-type phosphate transport system, permease component (PstC)",5,1
3601,CO dehydrogenase/acetyl-CoA synthase delta subunit (corrinoid Fe-S protein) (CdhD),5,1
3602,"Sugar transferase involved in LPS biosynthesis (colanic, teichoic acid) (WcaJ) (PDB:5W7L)",7,0
3603,CTP:molybdopterin cytidylyltransferase MocA (MocA) (PDB:2WAW),7,0
3604,Molybdopterin or thiamine biosynthesis adenylyltransferase (ThiF) (PDB:1ZUD) (PUBMED:32239579),5,1
3605,Cytochrome b involved in lipid metabolism (CYB5) (PDB:1AQA),8,0
3606,"Ethanolamine ammonia-lyase, large subunit (EutB) (PDB:3ABO)",5,1
3607,"NYN domain, predicted PIN-related RNAse, tRNA/rRNA maturation (LabA) (PDB:2QIP)",6,0
3608,Fe2+ or Zn2+ uptake regulation protein Fur/Zur (Fur) (PDB:1MZB),8,0
3609,"Uncharacterized conserved protein, DUF1015 family",7,0
3610,Predicted acetyltransferase (Eis) (PDB:2HV2),4,2
3611,Aldehyde:ferredoxin oxidoreductase (YdhV) (PDB:1AOR),6,0
3612,PII-like signaling protein (PDB:1O51),6,1
3613,"Uncharacterized conserved protein YqgQ, DUF910 family (YqgQ) (PDB:2NN4)",7,0
3614,"Uncharacterized membrane protein, UPF0182 family",6,1
3615,"Stalled ribosome rescue protein Dom34, pelota family (PelA) (PDB:2VGM)",4,1
3616,"Tetrahydromethanopterin S-methyltransferase, subunit H (MtrH)",4,0
3617,"Predicted transcriptional regulator,contains XRE-type HTH domain",7,0
3618,"Arsenate reductase or related protein, glutaredoxin family (ArsC) (PDB:1I9D)",7,0
3619,"Type III secretory pathway, component EscV (EscV) (PDB:2X49)",7,1
3620,"DNA polymerase III, alpha subunit (DnaE) (PDB:2HNH)",6,1
3621,tRNA U34 5-carboxymethylaminomethyl modifying GTPase MnmE/TrmE (MnmE),6,0
3622,"Fe-S cluster assembly scaffold protein IscU, NifU family (IscU) (PDB:1Q48)",6,0
3623,Methionine aminopeptidase (Map) (PDB:3J2I),6,0
3624,"Translation elongation factor EF-G, a GTPase (FusA) (PDB:1DAR)",4,2
3625,Carbamoylphosphate synthase large subunit (CarB) (PDB:1C30),6,0
3626,Molybdenum cofactor biosynthesis enzyme MoaC (MoaC) (PDB:1EKR) (PUBMED:32239579),5,1
3627,Beta-xylosidase (XynB) (PDB:1PX8),7,0
3628,"ABC-type sugar transport system, permease component (UgpA) (PDB:3FH6)",5,0
3629,Predicted helicase (PDB:5FFJ),7,0
3630,"N-acetylglucosaminyl deacetylase, LmbE family (LmbE) (PDB:1Q74)",7,1
3631,Isopenicillin N synthase and related dioxygenases (PcbC) (PDB:1BK0),5,0
3632,"ABC-type transport system involved in cytochrome c biogenesis, permease component (CcmC)",7,0
3633,"Uncharacterized conserved protein YfbU, UPF0304 family (YfbU) (PDB:1WPB)",4,0
3634,"Sulfate adenylyltransferase subunit 1, EFTu-like GTPase family (CysN) (PDB:1ZUN)",6,0
3635,"Stage V sporulation protein SpoVT, regulator of stationary/sporulation gene expression (SpoVT) (PDB:2RO5) (PUBMED:19000822;18996130)",8,0
3636,Ribonuclease HI (RnhA) (PDB:1LAW),7,0
3637,"Uncharacterized conserved protein YeaC, DUF1315 family (yeaC)",6,1
3638,"DNA gyrase/topoisomerase IV, subunit A (GyrA) (PDB:1SUU)",8,0
3639,Phosphotransferase system IIB components (PtsG2) (PDB:1IBA),8,0
3640,"DNA uptake channel protein ComEC, N-terminal domain (ComEC)",8,0
3641,"Uncharacterized conserved protein, DUF1465 domain (PDB:3CTW)",8,0
3642,2-keto-3-deoxy-L-rhamnonate aldolase RhmA (HpcH) (PDB:1DXE),8,0
3643,Aminopeptidase C (PepC),7,1
3644,Catalase (peroxidase I) (KatG) (PDB:5SX1) (PUBMED:31337720),6,0
3645,"ECF-type riboflavin transporter, membrane (S) component (ECF-S) (PDB:4HZU) (PUBMED:23584587)",4,0
3646,Capsule polysaccharide export protein KpsE/RkpR (KpsE),3,0
3647,"RNase adaptor protein RapZ for GlmZ sRNA degradation, contains a P-loop ATPase domain (RapZ) (PDB:5O5O) (PUBMED:23475961)",6,1
3648,Lipoate synthase (LipA) (PDB:4U0O) (PUBMED:27941785),8,0
3649,"Predicted DNA-binding transcriptional regulator YobV, contains HTH and WYL domains (YobV)",8,0
3650,"Coenzyme F420-reducing hydrogenase, delta subunit (FrhD) (PDB:5ODC)",6,0
3651,Predicted transcriptional regulator,5,2
3652,Acetyl-CoA acetyltransferase (PaaJ) (PDB:1AFW),8,0
3653,23S rRNA pseudoU1915 N3-methylase RlmH (RlmH) (PDB:1NS5),7,0
3654,"Multisubunit Na+/H+ antiporter, MnhG subunit (MnhG) (PDB:6CFW)",7,1
3655,"Uncharacterized conserved protein, LON_N-like domain, ASCH/PUA-like superfamily (LON/PUA) (PDB:1ZBO)",8,0
3656,Di- and tricarboxylate antiporter (CitT) (PDB:4F35),5,0
3657,Peptidoglycan-binding (PGRP) domain of peptidoglycan hydrolases (PGRP) (PDB:4FET),7,0
3658,"Uncharacterized conserved protein, DUF2195 domain",7,0
3659,Uncharacterized low-complexity protein,2,2
3660,"Type III secretory pathway, EscR/YscR component (EscR) (PDB:6R6B)",7,0
3661,"Putative Ca2+/H+ antiporter, TMEM165/GDT1 family (Gdt1) (PUBMED:23569283)",6,1
3662,"Uncharacterized conserved protein YhaN, contains AAA domain (YhaN)",4,1
3663,DNA repair exonuclease SbcCD ATPase subunit (SbcC) (PDB:3QKR),5,0
3664,Predicted lipoprotein with conserved Yx(FWY)xxD motif (function unknown),8,0
3665,CBS domain (CBS) (PDB:1B3O),5,0
3666,"Predicted RNA-binding protein, associated with RNAse of E/G family, DUF402 domain (PDB:2P12) (PUBMED:15126500)",6,0
3667,"Type IV secretory pathway, VirJ component (VirJ)",7,0
3668,"Lactoylglutathione lyase-related enzyme, vicinal oxygen chelate (VOC) family (VOC) (PDB:3OXH) (PUBMED:31710815)",6,0
3669,Pimeloyl-CoA synthetase (BioW) (PDB:5FLG),6,1
3670,"Delta-aminolevulinic acid dehydratase, porphobilinogen synthase (HemB) (PDB:1I8J)",7,0
3671,"Predicted lipocalin, contains AttH/CrtC domain (CrtC) (PDB:2ICH) (PUBMED:20944205)",8,0
3672,Predicted N-formylglutamate amidohydrolase (HutG2) (PDB:2ODF),7,0
3673,tRNA(Ile2) C34 agmatinyltransferase TiaS (TiaS) (PDB:3AMT),5,1
3674,"Mlc titration factor MtfA, regulates ptsG expression (MtfA) (PDB:3DL1) (PUBMED:16855233)",8,0
3675,N-acetylneuraminic acid mutarotase (NanM) (PDB:2UVK) (PUBMED:18063573),8,0
3676,Pyoverdine/dityrosine biosynthesis protein Dit1 (Dit1) (PDB:3E59) (PUBMED:18156253),4,0
3677,GTP-binding protein EngB required for normal cell division (EngB) (PDB:5UCV),7,0
3678,Protein-tyrosine phosphatase (CDC14) (PDB:1D5R),8,0
