,feature_name,cultured_feature_counts,uncultured_feature_counts
2328,"Uncharacterized protein, contains NAD-binding domain and a Fe-S cluster (PDB:5MOG)",1,0
2329,Isopropylmalate/homocitrate/citramalate synthases (LeuA) (PDB:4JN6),1,1
2330,DNA-binding beta-propeller fold protein YncE (YncE) (PDB:3VGZ) (PUBMED:22120742;28628661),0,1
2331,"ABC-type cobalt transport system, periplasmic component (CbiN)",2,2
2332,"Uncharacterized conserved protein, DUF2330 domain",0,2
2333,"Uncharacterized membrane protein, DUF373 family",2,1
2334,"Predicted ATPase, archaeal AAA+ ATPase superfamily",1,2
2335,Dihydroorotase (PyrC) (PDB:2Y3D),1,4
2336,"Lipoprotein Med, regulator of KinD/Spo0A, PBP1-ABC superfamily, includes NupN (Med) (PDB:2FQW) (PUBMED:21622736)",1,0
2337,Tryptophan synthase alpha chain (TrpA) (PDB:6HUL),0,1
2338,"Fe-S cluster assembly protein CyaY, frataxin homolog (CyaY) (PDB:1EKG)",2,2
2339,"Stalled ribosome rescue protein Dom34, pelota family (PelA) (PDB:2VGM)",2,2
2340,Ubiquinone biosynthesis protein Coq4 (COQ4),1,0
2341,"Beta-galactosidase, beta subunit (EbgC) (PDB:1JOP)",1,1
2342,ABC-type ATPase fused to a predicted acetyltransferase domain (MK0520),0,1
2343,Protein translocase subunit YajC (YajC),1,0
2344,"Type III secretory pathway, component EscV (EscV) (PDB:2X49)",1,2
2345,NAD kinase (NadK) (PDB:1SUW),1,3
2346,"DNA polymerase III, alpha subunit (gram-positive type) (PolC)",1,1
2347,Predicted molibdopterin-dependent oxidoreductase YjgC (YjgC) (PDB:1AA6),0,1
2348,"Pyruvate/2-oxoglutarate dehydrogenase complex, dihydrolipoamide acyltransferase (E2) component (AceF) (PDB:1B5S)",1,0
2349,Uncharacterized integral membrane protein YrvD (YrvD) (PUBMED:16737961),0,1
2350,"Uncharacterized HEPN domain protein YutE, UPF0331/DUF86 family (YutE) (PDB:1YLM) (PUBMED:26112399)",1,0
2351,tRNA A58 N-methylase Trm61 (Gcd14) (PDB:1I9G),0,1
2352,Catalase (KatE) (PDB:6RJR),2,1
2353,Glycosyltransferase involved in cell wall bisynthesis (WcaA) (PDB:5MLZ),3,1
2354,"Predicted ribonuclease, toxin component of the YeeF-YezG toxin-antitoxin module (YeeF)",1,0
2355,"Uncharacterized conserved protein YigA, DUF484 family (YigA) (PDB:3E98)",1,0
2356,Seryl-tRNA(Sec) selenium transferase (SelA) (PDB:3W1J),0,3
2357,Fructose/tagatose bisphosphate aldolase (Fba) (PDB:1B57),1,2
2358,Uncharacterized membrane protein,1,1
2359,Disulfide oxidoreductase YuzD (YuzD) (PDB:1XG8),0,1
2360,"Multisubunit Na+/H+ antiporter, MnhE subunit (MnhE) (PDB:6CFW)",2,1
2361,Lipase chaperone LimK (LimK),0,1
2362,"ABC-type molybdate transport system, permease component ModB (ModB)",1,0
2363,Superfamily I DNA or RNA helicase (UvrD) (PDB:6PPR),1,3
2364,"Multisubunit Na+/H+ antiporter, MnhG subunit (MnhG) (PDB:6CFW)",0,2
2365,Tryptophan-rich sensory protein TspO/CrtK (mitochondrial benzodiazepine receptor homolog) (TspO) (PDB:2MGY),1,0
2366,Cystathionine beta-lyase/cystathionine gamma-synthase (MetC) (PDB:1CL1),3,0
2367,"Thiamin-binding stress-response protein YqgV, UPF0045 family (YqgV) (PDB:1LXJ) (PUBMED:20471400)",1,0
2368,"Protocatechuate 3,4-dioxygenase beta subunit (PcaH) (PDB:1DLM)",2,1
2369,Uncharacterized membrane protein YkvI (YkvI),2,0
2370,"Predicted DNA-binding protein MJ1475, contains C-terminal HTH domain (MJ1475)",0,1
2371,"ABC-type sulfate transport system, permease component (CysU) (PDB:3D31)",3,3
2372,Inorganic pyrophosphatase (Ppa) (PDB:117E),1,1
2373,Ribonuclease I (RnaI) (PDB:1BK7),1,1
2374,"Oxidoreductase (NAD-binding), involved in siderophore biosynthesis (PchG) (PDB:4GMG)",0,1
2375,"Catechol 2,3-dioxygenase or related enzyme, vicinal oxygen chelate (VOC) family (GloA) (PDB:3R4Q) (PUBMED:11830595)",1,1
2376,"Non-homologous end joining protein Ku, dsDNA break repair (YkoV)",2,0
2377,Anti-sigma-F factor Fin (YabK) (PDB:5MSL) (PUBMED:15317759;21037003),2,0
2378,"DNA-binding transcriptional regulator WhiA, involved in cell division (WhiA) (PDB:3HYI)",0,1
2379,"3',5'-cyclic AMP phosphodiesterase CpdA (CpdA) (PDB:2ZO9)",1,0
2380,Glutathionyl-hydroquinone reductase (ECM4) (PDB:6GCA),0,1
2381,Outer membrane usher protein FimD/PapC (FimD) (PDB:2KT6),0,1
2382,Glycerol-3-phosphate O-acyltransferase (PlsB),1,0
2383,"Prophage-encoded protein YbcV, DUF1398 family (YbcV)",2,0
2384,Dipeptidase (PepD) (PDB:5IAU),2,1
2385,Glycine cleavage system protein H (lipoate-binding) (GcvH) (PDB:1DXM),1,0
2386,"PASTA domain, binds beta-lactams (PASTA)",0,1
2387,Flagellar motor switch/type III secretory pathway protein FliN (FliN) (PDB:1O9Y),0,1
2388,DNA repair enzyme Ada (O6-methylguanine-DNA--protein-cysteine methyltransferase) (AdaB) (PDB:6RLA) (PUBMED:29061663),1,2
2389,Copper(I)-binding protein (PDB:1X9L),0,1
2390,"Mannitol/fructose-specific phosphotransferase system, IIA domain (MtlA2) (PDB:1A3A)",0,1
2391,"Uncharacterized conserved protein YbjN, helps stabilize unstable proteins (YbjN) (PUBMED:16701556)",0,1
2392,Stage 0 sporulation-control protein Spo0M (Spo0M) (PDB:5CL2),0,1
2393,"Uncharacterized conserved protein, MAPEG superfamily",2,1
2394,Enolase (Eno) (PDB:1E9I),1,1
2395,Precorrin-4 methylase (CobM) (PDB:4E16),2,1
2396,Predicted acyltransferase (OpgC),1,2
2397,Predicted exporter,1,2
2398,Ornithine carbamoyltransferase (ArgF) (PDB:1A1S),3,1
2399,Post-segregation antitoxin (ccd killing mechanism protein) encoded by the F plasmid (PDB:2ADL),2,1
2400,Superfamily II RNA helicase (Dob10) (PDB:4A4Z),0,2
2401,"Predicted membrane anchor for polysulfide/nitrite-type reductase, PsrC/NrfD syperfamily (PUBMED:11856339)",0,1
2402,Spermidine/putrescine-binding periplasmic protein (PotD) (PDB:1POT),1,2
2403,Urease accessory protein UreE (UreE) (PDB:1EAR),0,1
2404,"Riboflavin transporter RibN, EamA domain (RibN) (PUBMED:23935051)",3,1
2405,Na+/H+ antiporter NhaD or related arsenite permease (ArsB),3,1
2406,Energy-converting hydrogenase Eha subunit E (EhaE) (PUBMED:19495416),1,3
2407,5-keto 4-deoxyuronate isomerase (KduI) (PDB:1X8M),1,1
2408,Biotin-(acetyl-CoA carboxylase) ligase (BirA2) (PDB:1BIA) (PUBMED:32188788),2,0
2409,Threonine/homoserine/homoserine lactone efflux protein (RhtB),1,1
2410,"N-glycosidase YbiA/RibX (riboflavin biosynthesis, damage control), NADAR superfamily (RibX) (PDB:2B3W) (PUBMED:22399070;25431972)",0,1
2411,"Putative GTP cyclohydrolase 1 type 2, NIF3 family (NIF3) (PDB:3SY1) (PUBMED:24435797;26385509)",1,3
2412,Truncated hemoglobin YjbI (YjbI) (PDB:1DLW),1,0
2413,"Type IV secretory pathway, TrbD component (TrbD)",2,0
2414,Spore coat protein YuzC (inner spore coat) (YuzC),2,1
2415,"Transposase and inactivated derivatives, IS30 family (Tra8)",2,0
2416,Bifunctional DNase/RNase (PDB:1SJ5) (PUBMED:20018603),1,1
2417,"ABC-type sugar transport system, ATPase component (MglA)",2,0
2418,Predicted amidohydrolase (PDB:2OGJ),0,1
2419,"DNA/RNA endonuclease YhcR, contains UshA esterase domain (YhcR)",1,0
2420,"Cysteine desulfurase/Cysteine sulfinate desulfinase IscS or related enzyme, NifS family (NifS) (PDB:4IXO) (PUBMED:22773787;25825430)",1,1
2421,"Mg-protoporphyrin IX monomethyl ester cyclase BchE, aerobic (=Ycf59) (Ycf59) (PUBMED:21388705)",1,0
2422,FKBP-type peptidyl-prolyl cis-trans isomerase (FkpA) (PDB:1A7X),0,2
2423,"RocR-type transcriptional regulator, contains PAS, AAA-type ATPase, and DNA-binding Fis domains (RocR)",2,1
2424,Uncharacterized conserved protein (PDB:1NC7),1,4
2425,"Fe-S cluster biogenesis protein NfuA, 4Fe-4S-binding domain (NifU) (PDB:2Z51)",0,1
2426,Phage P2 baseplate assembly protein gpV (gpV) (PDB:3AQJ),0,2
2427,"Predicted permease, AEC (auxin efflux carrier) family (YfdV)",2,0
2428,Phosphoglucomutase/phosphomannomutase (Pgm) (PDB:1C47) (PUBMED:30938049),1,2
2429,Spore coat protein CotW (outer spore coat) (CotW) (PUBMED:8509331),0,1
2430,"Na+-transporting NADH:ubiquinone oxidoreductase, subunit NqrD (NqrD) (PDB:4P6V)",0,3
2431,Archaeal S-adenosylmethionine synthetase (MetK2) (PDB:4HPV),0,2
2432,"Uncharacterized conserved protein YloU, alkaline shock protein (Asp23) family (YloU)",1,0
2433,"Protein kinase association domain CaMKII_AD, NTF2-like superfamily (CaMKIID) (PUBMED:26949248)",2,0
2434,"Uncharacterized conserved protein YhjY, contains autotransporter beta-barrel domain (YhjY)",1,0
2435,Flagellar biosynthesis protein FliR (FliR) (PDB:6S3R),0,2
2436,Phage terminase large subunit (XtmB) (PDB:4IDH),0,1
2437,"RecA-superfamily ATPase, KaiC/GvpD/RAD55 family (RAD55) (PDB:1TF7)",0,2
2438,"ABC-type tungstate transport system, periplasmic component (TupA)",0,2
2439,rRNA-processing protein FCF1 (Fcf1) (PDB:4MJ7),1,1
2440,"Uncharacterized conserved protein YkvS, DUF2187 family (YkvS)",0,2
2441,"Uncharacterized conserved protein YabN, contains tetrapyrrole methylase and MazG-like pyrophosphatase domain (YabN)",1,1
2442,Cobalamin biosynthesis protein CbiD (cobalt-precorrin-5B C-methyltransferase) (CbiD) (PDB:1SR8),1,0
2443,Citrate lyase synthetase CitC (CitC),1,0
2444,Type IV pilus assembly protein PilZ (PilZ),1,2
2445,Palmitoleoyl-ACP: Kdo2-lipid-IV acyltransferase (lipid A biosynthesis) (LpxP) (PDB:5F2T) (PUBMED:11830595),3,0
2446,"RNA 2',3'-cyclic phosphodiesterase (2'-5' RNA ligase) (ThpR) (PDB:1IUH) (PUBMED:25239919)",1,0
2447,Eukaryotic-type DNA primase (LigD) (PDB:5DMU),2,1
2448,"Uncharacterized conserved protein, DUF2460 domain",3,0
2449,Mannitol-1-phosphate/altronate dehydrogenases (MtlD) (PDB:1LJ8),0,1
2450,"Uncharacterized conserved protein, DUF2121 domain",1,1
2451,Surfactin synthase thioesterase subunit (GrsT) (PDB:6VAP),3,3
2452,"Uncharacterized conserved protein, DUF2247 domain",2,1
2453,23S rRNA A1618 N6-methylase RlmF (RlmF) (PDB:2H00) (PUBMED:18021804),1,1
2454,"RseB, negative regulator of sigma E activity (RseB) (PDB:2P4B)",2,0
2455,"Predicted ribonuclease YlaK, contains NYN-type RNase and PhoH-family ATPase domains (YlaK) (PUBMED:17114934)",0,1
2456,"Glycyl-tRNA synthetase, beta subunit (GlyS)",1,0
2457,Nitric oxide reductase large subunit (NorB) (PDB:3WFC),1,2
2458,"Chagasin-like inhibitor of cysteine peptidase, I42 family (ICP) (PUBMED:12142451;17561110)",2,3
2459,Uncharacterized membrane protein (PUBMED:15623504),3,0
2460,"Mannose-6-phosphate isomerase, class I (ManA) (PDB:1PMI)",1,1
2461,"Uncharacterized sporulation proteins YjcM and YhbB, contain C-terminal amidase domain (YhbB)",1,1
2462,"Phosphotransferase system, mannose/fructose-specific component IIA (ManX) (PDB:1PDO)",0,1
2463,"Predicted phosphohydrolase, HAD superfamily (PDB:1Y8A)",1,0
2464,"Uncharacterized cysteine cluster protein YcgN, CxxCxxCC family (YcgN)",0,2
2465,"Heme-binding protein HbpS, GlcG/HbpS family (GlcG) (PDB:2A2L) (PUBMED:19244623;25342754)",0,1
2466,Uncharacterized NAD(P)/FAD-binding protein YdhS (YdhS),0,2
2467,"Uncharacterized Tic20-related protein, DUF4870 domain (Tic20a) (PUBMED:9817756;20100520)",0,2
2468,"Predicted ATPase, PilT family, contains N-terminal PIN domain (PilT) (PDB:5F4H)",0,1
2469,"Translation elongation factor EF-Tu, a GTPase (TufA) (PDB:1EFU)",0,1
2470,"Predicted RNA-binding protein, contains EVE domain (EVE) (PDB:1ZCE) (PUBMED:32652237)",1,1
2471,"ABC-type Fe3+-siderophore transport system, permease component (FepD) (PDB:2NQ2)",0,2
2472,Molybdopterin or thiamine biosynthesis adenylyltransferase (ThiF) (PDB:1ZUD) (PUBMED:32239579),2,1
2473,ATPase/5-3 helicase helicase subunit RecD of the DNA repair enzyme RecBCD (exonuclease V) (RecD) (PDB:1W36) (PUBMED:29901759;30601118),0,2
2474,CRISPR-Cas system type III CSM-effector complex small subunit Csm2 (Csm2) (PDB:5AN6),0,1
2475,"Usg protein (tryptophan operon, function unknown) (Usg)",3,0
2476,"ABC-type amino acid transport system, permease component (BatB)",2,0
2477,"Predicted metal-binding protein, contains CGGC domain (CGGC)",1,1
2478,"Uncharacterized membrane protein YdjX, related to fungal oxalate transporter, TVP38/TMEM64 family (TVP38) (PUBMED:20889782)",0,2
2479,Ribosomal protein L34E (RPL34A) (PDB:4BYN),1,1
2480,"ABC-type enterochelin transport system, permease component (CeuB)",0,1
2481,"DNA-binding transcriptional regulator, MocR family, contains an aminotransferase domain (ARO8) (PDB:2R2N)",1,2
2482,"Putative Ca2+/H+ antiporter, TMEM165/GDT1 family (Gdt1) (PUBMED:23569283)",0,1
2483,"TRAP-type uncharacterized transport system, fused permease components",0,1
2484,"Succinate dehydrogenase flavin-adding protein, antitoxin component of the CptAB toxin-antitoxin module (SdhE) (PDB:1PUZ)",2,2
2485,Predicted Na+-dependent transporter YfeH (YfeH) (PDB:4N7X) (PUBMED:21175741),3,1
2486,"VapC family ribonuclease, contains PIN domain (VapC) (PDB:4XGQ)",2,2
2487,"TRAP-type C4-dicarboxylate transport system, large permease component (DctQ)",1,1
2488,"ABC-type enterochelin transport system, ATPase component (CeuD)",0,3
2489,16S rRNA G966 N2-methylase RsmD (RsmD) (PDB:2IFT),1,1
2490,Chromosome segregation and condensation protein ScpB (ScpB) (PDB:1T6S),2,1
2491,DNA mismatch repair ATPase MutS (MutS) (PDB:1E3M),2,0
2492,Monoamine oxidase (YobN) (PDB:1B37),0,4
2493,"Uncharacterized CoxE-like protein,  contains von Willebrand factor type A (vWA) domain (CoxE2)",1,0
2494,Predicted transcriptional regulator YtfJ (YtfJ),0,1
2495,Flagellar hook-capping protein FlgD (FlgD) (PDB:6IEF),1,0
2496,Type IV pilus assembly protein PilF/PilW (PilF) (PDB:2VQ2) (PUBMED:16403447),3,0
2497,Ribosomal protein L5 (RplE) (PDB:1VS6),2,1
2498,"Predicted DNA-binding protein with PD1-like DNA-binding motif, PPC/DUF296 domain (AF0104) (PDB:2DT4)",1,0
2499,Aspartate ammonia-lyase (AspA) (PDB:6WNG),1,1
2500,"Queuosine precursor transporter YhhQ, DUF165 family (YhhQ) (PUBMED:31481610)",0,1
2501,"ATPase/GTPase, AAA15 family",1,0
2502,Peptide deformylase (Def) (PDB:1BS4),1,1
2503,"5-hydroxyisourate hydrolase (purine catabolism), transthyretin-related family (HiuH) (PDB:2IGL)",1,0
2504,Capsule polysaccharide modification protein KpsS (KpsS),0,1
2505,Uncharacterized conserved protein YaaN involved in tellurite resistance (YaaN),0,3
2506,Ferredoxin (Fer) (PDB:1IQZ),0,1
2507,Phage-related tail fiber protein (PDB:6CL6),1,1
2508,"Predicted transcriptional regulator, contains XRE-type HTH domain (AF0184)",1,0
2509,Ligand-binding sensor domain (PocR),1,2
2510,"Folate-binding protein YgfZ, synthesis and repair of Fe-S clusters (YgfZ) (PDB:1NRK) (PUBMED:27941785;22081392)",0,5
2511,Predicted glycosyltransferase involved in capsule biosynthesis,3,0
2512,"Uncharacterized beta-barrel protein YwiB, DUF1934 family (YwiB) (PDB:1R0U)",1,0
2513,Na+/H+ antiporter NhaA (NhaA) (PDB:1ZCD) (PUBMED:25746996),0,2
2514,"Virulence-associated protein VapD, endoribonuclease (VapD) (PDB:5DYR) (PUBMED:26694028)",1,1
2515,"Stage III sporulation protein SpoIIIAC, component of the engulfment complex (SpoIIIAC)",2,0
2516,Ribosomal protein L32 (RpmF) (PDB:1VS6) (PUBMED:17114934),1,0
2517,Glucuronate isomerase (UxaC) (PDB:1J5S),0,2
2518,"Uncharacterized conserved protein, DUF2336 family",1,2
2519,mRNA degradation ribonuclease J1/J2 (RnjA) (PDB:3T3N),1,1
2520,Aconitase B (AcnB) (PDB:1L5J),0,3
2521,Prephenate dehydrogenase (TyrA) (PDB:2F1K),0,1
2522,"Type IV secretory pathway, component VirB8 (VirB8) (PDB:2BHM)",1,0
2523,Nitrogenase Mo-Fe protein NifD/coenzyme F430 biosynthesis subunit CfbD (NifD/CfbD) (PDB:1FP4) (PUBMED:28225763),0,1
2524,"Phage-related protein, tail protein J",3,0
2525,"Uncharacterized protein RhuM, Salmonella virulence factor (RhuM)",0,4
2526,"Archaeal aspartate aminotransferase or a related aminotransferase, includes purine catabolism protein PucG (PucG) (PDB:3NNK)",0,1
2527,Putative NADH-flavin reductase (YwnB) (PDB:3EW7),1,0
2528,"Aldehyde, CO or xanthine dehydrogenase, Mo-binding subunit (CoxL) (PDB:1DGJ) (PUBMED:10095793)",0,1
2529,ATP-dependent 26S proteasome regulatory subunit (RPT1) (PDB:5EQT),1,2
2530,ATP-dependent helicase/DNAse subunit B (AddB) (PDB:3U44),2,3
2531,"ABC-type thiamine transport system, ATPase component ThiQ (ThiQ)",1,0
2532,"Cyclic di-AMP-specific phosphodiesterase PgpH, HD superfamily (PgpH) (PUBMED:25583510)",0,1
2533,"Pyruvate:ferredoxin oxidoreductase or related 2-oxoacid:ferredoxin oxidoreductase, delta subunit (PorD) (PDB:5C4I)",2,1
2534,Spore germination protein GerPA/GerPF (inner spore coat) (GerPA) (PUBMED:10715007),2,0
2535,PAS domain (PAS) (PDB:2MWG),1,4
2536,"NAD(P)H-hydrate repair enzyme Nnr, NAD(P)H-hydrate dehydratase domain (Nnr2) (PDB:1KYH)",0,1
2537,"Patatin-like phospholipase/acyl hydrolase, includes sporulation protein CotR (PATA) (PDB:1OXW)",0,1
2538,Ribosomal protein S17 (RpsQ) (PDB:4V4H),0,2
2539,Dihydroxyacetone kinase (DAK1) (PDB:1UN8),0,1
2540,dsDNA-binding nucleoid-associated protein YejK/NdpA (NdpA) (PUBMED:24043617),1,1
2541,Autonomous glycyl radical cofactor GrcA (GrcA) (PDB:6OWR),2,0
2542,L-alanine-DL-glutamate epimerase or related enzyme of enolase superfamily (RspA) (PDB:1BKH),1,0
2543,SPX domain-containing protein involved in vacuolar polyphosphate accumulation (PDB:3G3O),1,0
2544,"Outer membrane receptor protein, Fe transport (CirA) (PDB:1BY3)",1,1
2545,Orotidine-5'-phosphate decarboxylase (PyrF) (PDB:1DBT),1,2
2546,L-rhamnose isomerase (PDB:3M0Y),1,1
2547,"Flp pilus assembly protein TadG, includes N-terminal TadE domain (TadG) (PUBMED:12010986)",1,2
2548,"Uncharacterized membrane protein, DUF1648 family",0,1
2549,Spore coat protein CotY/CotZ (outer spore coat) (CotY) (PUBMED:8509331),0,1
2550,Outer membrane lipoprotein LptE/RlpB (LPS assembly) (LptE) (PDB:2JXP),1,1
2551,"Integral membrane protein YbhL, putative Ca2+ regulator, Bax inhibitor (BI-1)/TMBIM family (YbhL) (PDB:4PGR) (PUBMED:28064000)",0,3
2552,Thiamine transporter ThiT (ThiT) (PDB:4POP),1,2
2553,Ribosome-binding factor RbfA (RbfA) (PDB:1JOS),1,0
2554,Uncharacterized conserved protein involved in sex pheromone biosynthesis (CamS) (PDB:2QX2),0,1
2555,"Regulator of sirC expression, contains transglutaminase-like and TPR domains (SirB1)",0,1
2556,Ribosomal protein S19E (S16A) (RPS19A) (PDB:2V7F),1,1
2557,"Eukaryotic-type DNA primase, catalytic (small) subunit (PRI1) (PDB:1G71)",1,1
2558,Flp pilus assembly protein TadB (TadB),1,0
2559,"Uncharacterized conserved protein, DUF871 domain (PDB:1X7F)",1,1
2560,"N-hydroxylaminopurine reductase subunit YcbX, contains MOSC domain (YcbX) (PUBMED:18312271;20118259)",1,0
2561,"Predicted DNA-binding protein, XRE-type HTH domain",1,3
2562,Flagellar basal body rod protein FlgC (FlgC),1,0
2563,Butyrate kinase (Buk) (PDB:1SAZ),1,1
2564,NADH:ubiquinone oxidoreductase 20 kD subunit (chain B) or related Fe-S oxidoreductase (NuoB) (PDB:2FUG) (PUBMED:25941396),0,1
2565,Peptide methionine sulfoxide reductase MsrA (MsrA) (PDB:1FF3),0,2
2566,L-arabinose isomerase (AraA) (PDB:2AJT),1,2
2567,"Uncharacterized conserved protein, UPF0276 family (PDB:3BWW)",1,0
2568,Predicted 3'-5' exonuclease related to the exonuclease domain of PolB,0,2
2569,"Uncharacterized conserved protein, DUF427 family (PDB:3DJM)",0,2
2570,Isocitrate lyase (AceA) (PDB:1DQU),2,1
2571,Chemotaxis signal transduction protein CheW (CheW) (PDB:2QDL),2,2
2572,Energy-converting hydrogenase Eha subunit H (EhaH) (PUBMED:19495416),2,0
2573,"Predicted Zn-dependent protease, minimal metalloprotease (MMP)-like domain (PDB:3E11)",1,0
2574,tRNA1(Val) A37 N6-methylase TrmN6 (TrmN6),0,4
2575,Adenosyl cobinamide kinase/adenosyl cobinamide phosphate guanylyltransferase (CobU) (PDB:1C9K),2,0
2576,Predicted secreted acid phosphatase (PDB:3OCY),1,0
2577,"Light-independent protochlorophyllide reductase subunit  B, BchB (= ChlB) (BchB) (PDB:2XDQ)",2,1
2578,S-adenosylmethionine:diacylglycerol 3-amino-3-carboxypropyl transferase (BtaA) (PUBMED:11331765),1,3
2579,Acetyl-CoA carboxylase beta subunit (AccD) (PDB:2F9I),0,2
2580,"Uncharacterized coiled-coil protein, contains DUF342 domain",1,0
2581,"Na+-translocating membrane potential-generating system subunit MpsB, UPF0753/DUF2309 family (MpsB) (PUBMED:21467222;25448817)",0,1
2582,Flagellar hook-associated protein FlgK (FlgK) (PDB:2D4Y),0,1
2583,"Lysyl-tRNA synthetase, class I (LysS) (PDB:1IRX)",3,1
2584,"Uncharacterized conserved protein, UPF0147 family (PDB:2QSB)",1,1
2585,"Uncharacterized conserved protein, UPF0280 family, ApbE superfamily (PDB:2O34)",2,2
2586,Alpha-mannosidase (MngB) (PDB:5KBP) (PUBMED:14645248),0,1
2587,Competence protein ComGF (ComGF),1,1
2588,Phage capsid portal protein XkdE,1,0
2589,"Uncharacterized TerC-related membrane protein, DUF475 domain (TerC2)",2,2
2590,DNA anti-recombination protein (rearrangement mutator) RmuC (RmuC),1,1
2591,"tRNA 2-selenouridine synthase SelU, contains rhodanese domain (SelU)",0,2
2592,"Ubiquinone biosynthesis accessory factor UbiT, lipid carrier SCP2 domain (UbiT) (PDB:1C44) (PUBMED:31289180)",2,2
2593,DNA-binding ferritin-like protein (Dps family) (GINS) (PDB:2HH6),1,1
2594,"Predicted phosphodiesterase, calcineurin family (YfcE) (PDB:1SU1) (PUBMED:17586769)",2,0
2595,"Uncharacterized conserved protein YwqG, DUF1963 family (YwqG) (PDB:1PV5)",0,1
2596,Glutamine synthetase type III (GlnA3),1,2
2597,"Signal recognition particle receptor subunit beta, a GTPase (Srp102) (PDB:1NRJ)",1,0
2598,Flagellar basal body rod protein FlgB (FlgB),0,1
2599,"Predicted nucleic-acid-binding protein, contains Zn-ribbon domain",0,3
2600,Imidazolonepropionase or related amidohydrolase (HutI) (PDB:3OOQ),0,2
2601,Small ligand-binding sensory domain FIST (FIST) (PUBMED:17855421),1,0
2602,"Stage VI sporulation protein SpoVID (LysM domain), required for assembly of the spore coat (SpoVID) (PUBMED:8449878)",1,2
2603,Ribosomal protein L19 (RplS) (PDB:1VS6) (PUBMED:27941785),1,1
2604,"Uncharacterized membrane protein YjfL, UPF0719 family (YjfL)",2,0
2605,"Transcriptional regulator NrdR, contains Zn-ribbon and ATP-cone domains (NrdR)",3,0
2606,Carbamoyl dehydratase HypE (hydrogenase maturation factor) (HypE) (PDB:2I6R) (PUBMED:28618091),1,1
2607,Glycerate-2-kinase (GckA) (PDB:1X3L) (PUBMED:18156253),1,1
2608,"Radical SAM superfamily enzyme YgiQ, UPF0313 family (YgiQ) (PDB:6FD2)",1,2
2609,"DNA-directed RNA polymerase, subunit E'/Rpb7 (RPB7) (PDB:1NT9)",0,3
2610,"Radical SAM superfamily maturase, SkfB/NifB/PqqE family (SkfB) (PDB:6Q2P) (PUBMED:23282011)",0,1
2611,Phosphatidylglycerophosphatase A (PgpA) (PDB:1RFZ),1,0
2612,Predicted phosphoribosyltransferase,0,1
2613,Carbonic anhydrase (Cah) (PDB:1KOP) (PUBMED:12730195),0,1
2614,Flagellar biosynthesis protein FlhB (FlhB) (PDB:6S3L),0,1
2615,"Uncharacterized conserved protein YqgQ, DUF910 family (YqgQ) (PDB:2NN4)",0,1
2616,tRNA A37 threonylcarbamoyltransferase TsaD (TsaD) (PDB:3ENO) (PUBMED:23072323;21285948;32385138),1,1
2617,"Endolytic transglycosylase MltG, terminates peptidoglycan polymerization (MltG) (PDB:2R1F) (PUBMED:26507882)",0,1
2618,"Predicted component TssB of the type VI protein secretion system, VipA/VipB/TssB family (PDB:5MYU)",1,2
2619,"FoF1-type ATP synthase AtpZ/Atp1/AtpQ subunit, putative Ca2+/Mg2+ transporter (AtpZ) (PUBMED:12917488;23123906)",0,1
2620,Predicted TIM-barrel enzyme (PDB:2P10),3,0
2621,Hemerythrin domain,2,1
2622,"Predicted metal-dependent carbohydrate esterase YdaL, contains NodB-like catalytic (CE4) domain (YdaL)",0,1
2623,"Phosphoserine phosphatase RsbU, regulator of sigma subunit (RsbU) (PDB:5UCG)",0,2
2624,Uncharacterized membrane protein YqjE (YqjE),1,0
2625,HKD family nuclease,1,0
2626,"ABC-type arginine/histidine transport system, permease component (ArtM)",0,1
2627,Putative lipase ATG15 (essential for vacuolar disintegration of autophagic bodies) (CVT17),1,0
2628,Pyruvate-formate lyase-activating enzyme (PflA) (PDB:3CAN),2,0
2629,"CCR4-NOT transcriptional regulation complex, NOT5 subunit (Not5) (PDB:4BY6)",1,0
2630,Undecaprenyl pyrophosphate phosphatase (UppP) (PDB:5OON),1,3
2631,Flagellar biosynthesis/type III secretory pathway chaperone FlgN (FlgN) (PDB:2FUP),1,0
2632,Uri superfamily endonuclease,1,0
2633,Primase-polymerase (Primpol) domain protein (PDB:6A9W) (PUBMED:29198957),0,1
2634,ACT domain-containing protein (ACTx2),1,0
2635,Glutamate 5-kinase (ProB) (PDB:2W21),1,1
2636,Histidyl-tRNA synthetase (HisS) (PDB:1KMM),3,1
2637,"DNA-binding transcriptional regulator, CsgD family (CsgD)",0,1
2638,Archaeal/vacuolar-type H+-ATPase subunit D/Vma8 (NtpD) (PDB:3AON),1,1
2639,Predicted ATPase,2,3
2640,"Murein L,D-transpeptidase YcbB/YkuD (YcbB) (PDB:6NTW) (PUBMED:18456808)",0,1
2641,Intein/homing endonuclease (Hop) (PDB:1EF0),2,1
2642,"Uncharacterized conserved protein MJ0835, predicted component of type IV pili-like system, DUF1515 family (MJ0835)",0,2
2643,"Uncharacterized membrane-anchored protein YjiN, DUF445 family (YjiN)",2,1
2644,"rRNA processing protein Krr1/Pno1, contains KH domain (Krr1) (PDB:4QMF)",0,1
2645,"Uncharacterized conserved protein, DUF763 domain",1,2
2646,Predicted 2-oxoglutarate- and Fe(II)-dependent dioxygenase YbiX (PiuC) (PDB:3DKQ),0,1
2647,"ABC-type Fe3+-hydroxamate transport system, periplasmic component (FepB) (PDB:1ESZ)",1,0
2648,"Uncharacterized conserved protein YyaL, SSP411 family, contains thoiredoxin and six-hairpin glycosidase-like domains (YyaL) (PDB:3IRA)",0,1
2649,"Membrane protease subunit, stomatin/prohibitin family, contains C-terminal Zn-ribbon domain (YdjI)",1,2
2650,"ABC-type uncharacterized transport system, ATPase component (PhnK)",1,1
2651,"Endo-1,4-beta-xylanase, GH35 family (XynA) (PDB:1B30)",0,1
2652,DNA modification methylase (YhdJ) (PDB:1BOO),1,2
2653,"Cell division inhibitor SulA, prevents FtsZ ring assembly (SulA) (PDB:1OFT)",3,0
2654,"Transcription elongation factor, GreA/GreB family (GreA) (PDB:1GRJ)",1,2
2655,Signal transduction histidine kinase (BaeS) (PDB:1JOY),4,0
2656,"Alcohol dehydrogenase YqhD, Fe-dependent ADH family (YqdH) (PDB:1OJ7)",1,2
2657,Glutamine phosphoribosylpyrophosphate amidotransferase (PurF) (PDB:1ECB),0,1
2658,"Uncharacterized conserved protein YoxC, contains an MCP-like domain",1,0
2659,"DNA-binding transcriptional regulator, XRE family (YozG) (PDB:3TYR)",1,1
2660,NADH dehydrogenase/NADH:ubiquinone oxidoreductase 75 kD subunit (chain G) (NuoG) (PDB:1C4A),1,1
2661,"ABC-type dipeptide/oligopeptide/nickel transport system, ATPase component (DppD) (PDB:4FWI)",1,1
2662,Ribonuclease G or E (CafA) (PDB:1SLJ),1,0
2663,Adenosylcobinamide amidohydrolase (CbiZ) (PUBMED:14990804),1,0
